,dataIndex,realTitle,criticsConcensus,tomatoMeter,tomatoCount,audienceScore,audienceCount,realSynopsis,rating,genreString,directedBy,studio,runTime,cast
0,8003,To End All Wars,N/A,62%,13,85%,8125,"A World War II, prisoner-of-war drama about a group of American POWs. Led by Lieutenant Colonel Stuart McLean, the officers--Major Ian Campbell, Captain Ernest Gorgon and Lieutenant Tom Rigden--endure harsh treatment at the hands of their Japanese captors, while building a railway through the Burmese jungle.",R (for war violence and for some language),Drama,David L. Cunningham,Argyll Film Partners,126 minutes,"Robert Carlyle, Kiefer Sutherland, Ciaran McMenamin"
1,8008,High School Confidential,N/A,70%,10,47%,1900,"Complete with a performance by Jerry Lee Lewis over its opening credits, Jack Arnolds High School Confidential stars Russ Tamblyn as Tony, a troubled street kid sent to live with his hot-to-trot aunt (Mamie Van Doren). After enrolling in school, he quickly becomes wrapped up in the local drug scene, culminating in a surprise ending. Also titled Young Hellions.",NR,"Classics, Drama, Mystery & Suspense",Jack Arnold,MGM,85 minutes,"Russ Tamblyn, Jan Sterling, John Drew Barrymore"
2,8017,Fancy Pants,N/A,80%,5,72%,2382,"Fancy Pants is a musicalized remake of the oft-filmed Harry Leon Wilson story Ruggles of Red Gap, tailored to the talents of ""Mr. Robert Hope (formerly Bob)"". The basic plotline of the original, that of an English butler entering the service of a rowdy nouveau-riche family from the American West, is retained. The major difference is that main character (Bob Hope) plays a third-rate American actor who only pretends to be a British gentlemans gentleman. Social-climbing American heiress Lucille Ball hires Hope to impress her high-society English acquaintances, then takes him back to her ranch in New Mexico. Though there are many close shaves, Hope manages to convince the wild and woolly westerners that hes a genuine British Lord--even pulling the wool over the eyes of visiting celebrity Teddy Roosevelt (John Alexander). Never as droll as the 1935 Leo McCarey-directed Ruggles of Red Gap, Fancy Pants nonetheless works quite well on its own broad, slapsticky level. If the ending seems abrupt, it may be because the original finale, in which a fleeing Bob Hope and Lucille Ball were to be rescued by surprise guest star Roy Rogers, was abandoned just before the scene was shot.",G,"Classics, Comedy, Musical & Performing Arts",George Marshall,Paramount Pictures,92 minutes,"Bob Hope, Lucille Ball, Bruce Cabot"
3,8020,Uncle Sam,N/A,56%,9,23%,2235,"In this blood-soaked horror outing, the corpse of a soldier who died during the Gulf War arises from the grave to terrorize those engaging in unpatriotic behavior.",R,Horror,William Lustig,Blue Underground,89 minutes,"Bo Hopkins, Timothy Bottoms, Isaac Hayes"
4,8022,La Belle Noiseuse,"A sensual and hypnotic masterpiece, La Belle Noiseuse luxuriates in its four-hour run time while holding audience attention.",100%,29,84%,3811,"In 1991, the master French director Jacques Rivette released one of his most acclaimed works- the four-hour La Belle noiseuse. It was a fascinating and unconventional examination of the creative process, about an artist named Edouard Frenhofer (Michel Piccoli) who reaches the age of 60, and finds new inspiration in a young model (Emmanuelle Beart), much to the quiet indignation of his wife Liz (Jane Birkin). Two years later, Rivette was asked to edit the original 240-minute drama down into a feature-length version that would be more palatable for mainstream audiences. The result was Divertimento (its full title La Belle noiseuse - Divertimento). Released to U.S. cinemas in September 1993, it received much less enthusiastic notices from critics, a fair number of whom (see the Roger Ebert and Vincent Canby assessments) implored viewers to stick with the original. Unsurprisingly, the recut version reduces many of the long, ethereally beautiful sequences that show Frenhofer hard at work on his canvas; instead, it places a much greater emphasis on the emotional toll that Frenhofers artistic obsessions and infidelities take on the women in his life. The movie also features a different framing sequence, and incorporates takes unused in the original cut. In the eyes of many, the alterations basically maimed the picture, and Divertimento - unlike its parent film - soon faded into total obscurity.",NR,"Art House & International, Drama",Jacques Rivette,Cohen Media Group,240 minutes,"Michel Piccoli, Jane Birkin, Emmanuelle Béart"
5,8030,Lovers and Other Strangers,N/A,100%,7,72%,779,"This engaging comedy focuses on the effect that Susan and Mikes marriage has on their family and friends. Susans father Hal has been having an affair for years, unknown to his wife. Mikes mother and father are delighted with the wedding plans, but their son Richie has a troubled marriage.",PG,"Comedy, Romance",Cy Howard,ABC,106 minutes,"Bea Arthur, Gig Young, Anne Jackson"
6,8031,Kotch,N/A,75%,8,68%,965,"Joseph P. ""Kotch"" Kotcher is an irksome 72-year-old who lives with his son and daughter-in-law. When he learns the familys former babysitter Erica is pregnant, Kotch loans her some money; and when she moves away to Palm Springs, he moves in with her, hoping to be of some use.",PG,"Classics, Comedy, Drama",Jack Lemmon,ABC,113 minutes,"Walter Matthau, Deborah Winters, Felicia Farr"
7,8038,This Gun for Hire,N/A,93%,14,81%,2400,"Though billed fourth in This Gun For Hire, Alan Ladd was catapulted to stardom in the role of Phillip Raven, a ruthless professional killer with a long-suppressed streak of decency. After successfully pulling off his latest murder, Raven reports to his boss, effeminate fifth columnist Willard Gates (Laird Cregar). He collects his $1000 fee, only to discover later that Gates has double-crossed him with marked bills. This was done at the behest of Gates boss, crooked business executive Alvin Bewster (Tully Marshall), who wants no loose ends left around to connect him with a plot to sell poison gas to the Axis. As Raven ducks and dodges the police, detective Michael Crane (Robert Preston) is hot on the trail of Bewster and Gates. Crane talks his girlfriend, nightclub singer-musician Ellen Graham (Veronica Lake), into taking a job at Gates nightclub. While on the train to the club, Ellen makes the acquaintance of the escaping Raven. Gates boards the train, spots Ellen innocently sitting next to Raven, and assumes that the two are in cahoots. Later, Gates kidnaps Ellen and spirits her away to his mansion, intending to do away with her the first chance he gets. Instead, Raven, still seeking revenge for being set up, bursts into the mansion in search of Gates. Having previously been impressed by Ellens kindness, he rescues her, though he intends using her as hostage should the police catch up with him. As they hide out together in the rail yards, Ellen and Raven get to know each other. Learning of Ravens miserable, abusive childhood, Ellen tries to chip away his murderous veneer, hoping to reform him. But when the cops arrive, Raven reverts to his instincts, shooting his way out of his hiding place. As Crane escorts Ellen out of harms way, Raven rushes towards a bloody showdown with Bewster and Gates. Based on Graham Greenes A Gun For Sale, This Gun For Hire was remade in 1958 as Short Cut to Hell, then again under the original title as a 1990 made-for-TV film.",R,"Classics, Drama, Mystery & Suspense",Frank Tuttle,Paramount Pictures,81 minutes,"Alan Ladd, Laird Cregar, Veronica Lake"
8,8040,The Big Clock,N/A,100%,8,83%,1406,"Told in the back-to-front fashion typical of film noir, The Big Clock opens with George Stroud (Ray Milland) trapped, his life in danger, his survival measured in the minute-by-minute movements of the huge central clock of the office building where hes hiding. In flashback we learn that Stroud works for media baron Earl Janoth (Charles Laughton) as the editor of Crimeways magazine. Janoth is a manipulative megalomaniac with various obsessions, including clocks; among other manifestations of the latter fixation, the skyscraper housing his empires headquarters has as its central feature a huge clock that reads out the time around the world down to the second. Twenty-four hours earlier, on the eve of a long-delayed combined honeymoon/vacation with his wife (Maureen OSullivan), Stroud was ordered by Janoth to cancel the trip, and he resigned. In his depression, Stroud missed his wifes train and crossed paths with Pauline York (Rita Johnson), Janoths very unhappy mistress, and the two commiserated by getting drunk together in a night on the town. While hurriedly leaving Paulines apartment, he glimpsed Janoth entering. George sobers up the next day and joins his wife on their vacation, but is soon contacted by Janoth -- he apologizes to Stroud and wants him to lead an investigation into a criminal on the run. It immediately becomes clear to George that the man Janoth wants found is Stroud himself, a fact of which Janoth is unaware, because he did not see the face of the man who saw him entering Yorks apartment. And Stroud has to return to work on the case, or risk exposure in a scandal that could end his marriage -- but when he returns to New York and starts running the investigation, he soon realizes that hes caught up in a murder, and that he may be next, if Janoth ever realizes the identity of the man hes trying to find. The two play a clever, disjointed game of cat-and-mouse, Janoth in partnership with his general manager Steve Hagen (George Macready) pushing the investigation, knowing they plan on bringing the suspect in dead, and Stroud doing his best to delay and sidetrack the investigation, playing for time, knowing that the man theyre looking for is standing right next to the two conspirators. Janoth seems near to be unraveling at the lack of conclusion to the hunt, but Stroud cant ignore the trail of proof and guilt winding ever tighter around both of them, even as it takes some grimly comic twists, mostly over the presence of Elsa Lanchester as a witness who has seen the ""suspect."" Milland is perfect in the role of the hapless Stroud, and Laughton is brilliant as the vain, self-centered Janoth, but George Macready is equally good as Hagen, his smooth, upper-crust Waspy smarminess making ones skin crawl. Also worth noting is Harry Morgans sinister, silent performance as Janoths personal valet; and sharp-eyed viewers will also recognize such performers as Douglas Spencer and Noel Neill (especially memorable as a tart-tongued elevator operator). Additionally, the Janoth Publications building where most of the action takes place is almost a cast member in itself, an art deco wonder. This film was later remade -- much less effectively -- as No Way Out.",PG-13,"Classics, Drama, Mystery & Suspense",John Farrow,Paramount Pictures,95 minutes,"Charles Laughton, Ray Milland, Maureen O'Sullivan"
9,8041,Criss Cross,N/A,100%,10,79%,1612,"Armored car guard Steve Thompson (Burt Lancaster) should know better than to make whoopee with his no-good ex-wife Anna (Yvonne De Carlo) -- especially since shes now married to gangster Slim Dundee (Dan Duryea). Caught by Slim in a compromising position with Anna, Steve alibis that hes merely planning an armored car heist. Slim doesnt completely buy this, but he decides to go through with the robbery, sending along several henchmen to make sure that Steve doesnt pull a double-cross. But he hasnt reckoned with Anna, who convinces the wounded Steve to steal the loot and skip town with her. No one ever wins in a set-up like this; the audience knows this, but follows along just the same. Based on a novel by Don Tracy, Criss Cross is a terse, doom-drenched film noir from a master of the game, director Robert Siodmak. And yes, that handsome hunk dancing with Yvonne De Carlo in the opening scene is an unbilled Tony Curtis.",NR,"Classics, Drama, Mystery & Suspense",Robert Siodmak,MCA Universal Home Video,98 minutes,"Burt Lancaster, Yvonne De Carlo, Dan Duryea"
10,8043,Evilspeak,N/A,43%,14,37%,1597,"Professional weirdo Clint Howard plays one of his more interesting oppressed-geek roles in this occult revenge thriller about a tormented military-school nerd (apparently in his mid-thirties!) whose personal computer provides the only solace from the endless taunts and pranks of his fellow cadets. He also has an intense fascination with the occult, leading him to investigate an arcane tome secreted within an ancient, crumbling chapel. In an attempt to decipher the text, he feeds it into the computer, which translates the writings into actual working spells. As Clints mind reels with the possibilities of sweet revenge against his cruel classmates and teachers, the demonic forces once trapped within the book begin to exert control over his mind and body. Before long, he is able to summon an army of snarling devil-pigs (no, thats not a misprint) to do his evil bidding. Though this is essentially a gender-bent rip-off of Carrie, there is enough in the way of spooky atmosphere and well-staged shocks to keep less discriminating horror fans interested.",R,"Horror, Science Fiction & Fantasy",Eric Weston,Moreno Films,97 minutes,"Clint Howard, R.G. Armstrong, Joseph Cortese"
11,8044,Terror by Night,N/A,75%,8,62%,581,"One of the later movies in the Sherlock Holmes series, in this one the sleuth is dodging death as he tries to solve the murder of the owner of a priceless diamond. On a train, they are racing against time to solve the mystery before the train arrives at its destination, allowing the murderer to escape.",PG,"Action & Adventure, Classics, Drama, Mystery & Suspense","Roy William Neill, Frank R. Strayer",Focus Film Entertainment,60 minutes,"Basil Rathbone, Nigel Bruce, Alan Mowbray"
12,8045,The Spy Who Came In from the Cold,N/A,87%,15,82%,5405,"Based on the novel by John Le Carre, The Spy Who Came in from the Cold stars Richard Burton as a dispirited, end-of-tether British secret agent. He comes in from ""the cold"" (meaning he is pulled out of field operations) to act as a undercover man behind the Iron Curtain. To make his staged defection seem genuine, Burton goes on an alcoholic toot and is imprisoned and publicly humiliated. Once he has been accepted into East German espionage circles, Burton discovers that what he thought was his mission was a mere subterfuge--and that hes been set up as a pawn for an entirely different operation. Though Ireland and England ""stand in"" for East Berlin, Spy Who Came In From the Cold has the air of authenticity throughout, thanks in great part to the bleak black and white photography by Oswald Morris. The film was condemned as incomprehensible by those filmgoers accustomed to the simplistic melodramatics of James Bond; seen today, the double-crosses and double-double crosses seem all too clear and credible.",NR,"Action & Adventure, Classics, Drama, Mystery & Suspense",Martin Ritt,Paramount Pictures,112 minutes,"Richard Burton, Claire Bloom, Oskar Werner"
13,8051,Dressed to Kill,"With arresting visuals and an engrossingly lurid mystery, Dressed to Kill stylishly encapsulates writer-director Brian De Palma's signature strengths.",83%,47,74%,10549,"In this stylish, violent thriller,an unhappy wife, Kate Miller (Angie Dickinson), meets a handsome man in a museum and goes to his apartment for a quick sexual encounter. As she leaves, she is brutally murdered. Kates son, Peter (Keith Gordon) sets out to solve the murder aided by the call-girl Liz (Nancy Allen), who discovered his mothers body and got a glimpse of the murderer, a blond woman. Peter begins watching the office of Kates psychiatrist, Dr. Elliott (Michael Caine), setting up a camera to record the comings and goings of his patients. When the suspect finally appears, Liz makes an appointment with Elliott in order to get a look at his appointment book. In Dressed to Kill director Brian De Palma deftly incorporates all the tricks and plot devices he learned from observing the masters of the genre, Alfred Hitchcock, Mario Bava and Dario Argento to great effect. The scene where Kate meets her lover in the museum is reminiscent of Vertigo. The murder of Kate in the elevator frightening, bloody and chillingly effective, is similar in tone to the shower scene in HitchcocksPsycho. Brian De Palma directs with great visual panache, and gets great performances from his cast, particularly Michael Caine who gives his usual fine performance in a surprising and difficult role. Dressed to Kill is a violent, gory, memorable thriller with many surprises and exciting plot twists.",R,"Drama, Horror, Mystery & Suspense",Brian DePalma,MGM,105 minutes,"Michael Caine, Angie Dickinson, Nancy Allen"
14,8055,Thunderbirds,Live-action cartoon for kids.,19%,106,37%,21870,"In a family of heroes, Alan Tracy was always being left out. While his father, billionaire and former astronaut Jeff Tracy and his four elder brothers are busy saving the world, Alans biggest challenge is saving his grade point average at boarding school. And whats worse, he cant even tell his schoolmates that his dad and brothers are better known as the fearless adventurers behind the top-secret organization International Rescue--called in to save those in need whenever disaster strikes. Alan dreams of one day joining his close-knit family in their global vocation and even getting into the drivers seat of one of the awesome, incredible machines the Tracys utilize in their life-saving work; the Thunderbirds. Back home on Tracy Island--a secret oasis in the South Pacific and headquarters to International Rescue--Alan and his friends, the brainy Fermat and the adventurous Tin-Tin, are left behind as Jeff Tracy and his elder sons are deployed on a fake mission by their arch nemesis The Hood. Once the master criminal takes control of Tracy Island and the Thunderbirds, it falls to Alan and his friends to come up with a plan to defeat The Hood and rescue his family--oh, and save the world while theyre at it.",PG (for intense action sequences and language),"Action & Adventure, Comedy, Kids & Family, Science Fiction & Fantasy",Jonathan Frakes,Universal Pictures,95 minutes,"Bill Paxton, Brady Corbet, Ben Kingsley"
15,8057,Garden State,Delivering a quirky spin on familiar twentysomething tropes -- with a cannily-placed soundtrack -- Garden State has enough charm to mark a winning debut for first-time director Zach Braff.,86%,191,88%,330040,"Andrew Largeman shuffled through life in a lithium-induced coma until his mothers death inspired a vacation from the pills to see what might happen. A moderately successful TV actor living in Los Angeles, ""Large"" hasnt been home to the ""Garden State"" in nine years. But even with 3,000 miles between them, hes been unable to escape his domineering father Gideon and the silencing effect hes had on his son from afar. Stunned to find himself in his hometown after such a long absence, Large finds old acquaintances around every corner living quite unique lives as gravediggers, fast food knights and the panderers of pyramid schemes. Meanwhile, at home, he does his best to avoid a long-simmering but inevitable confrontation with his father. By a twist of fate, Large meets Sam, a girl who is everything he isnt. A blast of color, hope and quirks, Sam becomes a sidekick who refuses to ride in his sidecar. Her warmth and fearlessness give Large the courage to open his heart to the joy and pain of the infinite abyss that is life.","R (for language, drug use and a scene of sexuality)","Comedy, Drama, Romance",Zach Braff,Fox Searchlight,102 minutes,"Zach Braff, Natalie Portman, Peter Sarsgaard"
16,8060,Thunderbirds Are Go,N/A,57%,7,57%,942,,NR,"Kids & Family, Science Fiction & Fantasy, Television",David Lane,United Artists,93 minutes,"Peter Dyneley, Sylvia Anderson, Shane Rimmer"
17,8062,Castle Keep,N/A,38%,8,49%,2081,"Major Falconer (Burt Lancaster) leads his eight battle weary soldiers into the Ardennes Forest for some rest and relaxation. They stay at castle keep, where the eccentric Count wants Falconer to sire an heir with his beautiful wife. Sergeant Rossi (Peter Falk) manages to sleep with the bakers wife. Captain Beckman (Patrick ONeal) and Lieutenant Amberjack (Tony Bill) are not as fortunate as the troop is attacked by Nazis. Surrounded and outnumbered, the brave soldiers valiantly try to holdout the enemy charge as the bloody conflict ensues towards the end of this action war feature.",R,"Action & Adventure, Classics, Drama, Science Fiction & Fantasy, Romance",Sydney Pollack,Sony Pictures Entertainment,105 minutes,"Burt Lancaster, Peter Falk, Patrick O'Neal"
18,8063,Revengers Tragedy,N/A,60%,5,76%,870,"Revenge, obsession, and the morally ambiguous aristocracy are targets of this adaptation by director Alex Cox of the 17th century dark comic play +Revengers Tragedy, written by Shakespeare contemporary Thomas Middleton. The vindictive and mentally unstable Vindici (Christopher Eccleston) has returned to the grimy streets of a post-apocalyptic Liverpool in order to attempt to bring ruin to the ruling family led by the Duke (Derek Jacobi). The Duke was personally responsible for the death of Vindicis fiancée ten years previously when the woman would not yield to the Dukes sexual advances. An opportunity arises for Vindicis vengeance when the Dukes youngest son is accused of raping the wife (Sophie Dahl) of Lord Antonio (Anthony Booth) -- one of the Dukes courtiers. When the Dukes son is acquitted of the rape charges, Lord Antonios wife dies a mysterious death, which leads to even more havoc in the court of the Duke. Seizing the opportunity, Vindici acts swiftly and violently but the morality of his cause is just as questionable as the aristocracy he is ousting. Revengers Tragedy was a competing film at the 2002 Locarno Film Festival.",NR,"Comedy, Drama, Horror",Alex Cox,N/A,109 minutes,"Eddie Izzard, Christopher Eccleston, Alex Cox"
19,8070,Salesman,N/A,100%,21,89%,2461,This famous documentary is said to have single-handedly brought back a resurgence of documentary filmmaking in the 1960-1970s. It follows the mishaps of door-to-door Bible salesmen.,G,"Documentary, Drama, Special Interest","Albert Maysles, David Maysles, Charlotte Mitchell Zwerin",Criterion Collection,85 minutes,"Paul Brennan, Jamie Baker, Charles McDevitt"
20,8071,Collateral,"Driven by director Michael Mann's trademark visuals and a lean, villainous performance from Tom Cruise, Collateral is a stylish and compelling noir thriller.",86%,234,84%,364088,"A taxi driver is unexpectedly taken on the ride of his life in this stylish thriller from acclaimed director Michael Mann. Max (Jamie Foxx) is a cab driver who hopes to some day open his own limo company; one night behind the wheel begins promisingly when he picks up Annie (Jada Pinkett Smith), an attorney working with the federal government who is attractive, friendly, and gives him her business card after paying her fare. Max thinks his luck is getting even better when his next fare, Vincent (Tom Cruise), offers him several hundred dollars in cash if hell be willing to drop him off, wait, and pick him up at five different spots over the course of the evening. Max agrees, but he soon realizes Vincent isnt just another guy with errands to run -- Vincent is an assassin who has been paid to murder five people who could put the leaders of a powerful drug trafficking ring behind bars in an upcoming trial. As circumstances force Max to do Vincents bidding, the cabbie has to find a way to prevent Vincent from killing again and save his own skin, a task that becomes especially crucial when he discovers Annie is one of the names on Vincents hit list. Collateral also stars Mark Ruffalo, Peter Berg, and Bruce McGill as police detectives hot on Vincents trail. ~ Mark Deming, Rovi",R (for violence and language),"Action & Adventure, Drama, Mystery & Suspense",Michael Mann,Paramount Pictures,122 minutes,"Tom Cruise, Jamie Foxx, Mark Ruffalo"
21,8072,Little Black Book,"An obnoxious, awkward mix of romantic comedy and reality show satire.",22%,111,37%,65770,"When her boyfriend leaves town on a trip, television producer Stacy raids his Palm Pilot and interviews all of his past girlfriends. The prying leads to public humiliation, though, when Stacys friend puts all the prying on live television.",PG-13 (for sexual content/humor and language),Comedy,Nick Hurran,Sony Pictures,107 minutes,"Brittany Murphy, Holly Hunter, Kathy Bates"
22,8073,Code 46,"Code 46 crafts an intriguing hypothetical future and populates it with characters who never engage, producing a slick sci-fi package without any humanity to power it.",50%,101,59%,8628,"In the not-so-distant future, a married man investigates a counterfeiter and ends up the perpetrator of an ethical crime in Code 46, the latest film from prolific British director Michael Winterbottom. Set against the backdrop of a technologically advanced Shanghai, where people are only allowed to travel between countries with official passports called ""papelles,"" the film charts the efforts of Seattle native William (Tim Robbins) to get to the bottom of a contraband-papelle operation within the walls of a high-tech company that manufactures them. There he finds Maria (Samantha Morton), an enigmatic young woman who may or may not be selling the passports on the black market. William has a brief affair with Maria, which, despite his attempts to return home, causes him to become embroiled in an even bigger controversy in Shanghai.","R (for a scene of sexuality, including brief graphic nudity)","Drama, Science Fiction & Fantasy, Romance",Michael Winterbottom,MGM,85 minutes,"Tim Robbins, Samantha Morton, Om Puri"
