,dataIndex,realTitle,criticsConcensus,tomatoMeter,tomatoCount,audienceScore,audienceCount,realSynopsis,rating,genreString,directedBy,studio,runTime,cast
184,8392,"Edison, the Man",N/A,80%,5,63%,368,"In 1940, MGM turned out two films on the life of Thomas Alva Edison.The first, Young Tom Edison, starred Mickey Rooney and trotted out all the old Edison folklore, including the now-discredited incident in which Tom loses his hearing by being yanked onto a train by his ears. Edison the Man, starring Spencer Tracy in the title role, downplays certain inconvenient facts (including Edisons strong-arm tactics to protect his patents), but adheres more closely to actual events than its predecessor. The story concentrates on Edisons most productive years, from 1872 to 1882 (surprisingly ignoring his role in the development of the motion picture!) The inventions invented herein include the ticker-tape machine, the phonograph, the Dictaphone, and of course the electric light. Gene Lockhart is on hand to once more perform his movie specialty of the blinkered financier who can see no future in Edisons crazy schemes. The film tries to stir up suspense by giving Edison only six months to complete his dream of illuminating the streets of New York, lest he lose the contract--and, by extension, his credibility. While Young Tom Edison had unexpectedly lost money, Edison the Man was a success; as for Spencer Tracy, he was a versatile enough actor to escape the fate of poor Don Ameche, who was forever and inextricably associated with his portrayal of Alexander Graham Bell.",NR,"Classics, Drama",Clarence Brown,MGM,107 minutes,"Spencer Tracy, Rita Johnson, Lynne Overman"
185,8393,The Letter,N/A,100%,13,82%,3713,"Based on a novel by W. Somerset Maugham, William Wylers drama stars Bette Davis as Leslie Crosbie, the malevolent wife of a Malaysian rubber magnate (Herbert Marshall) who is accused of murdering her lover and attempting to cover up the crime.",PG,"Classics, Drama",William Wyler,MGM Home Entertainment,95 minutes,"Bette Davis, Herbert Marshall, James Stephenson"
186,8395,Ball of Fire,"A splendidly funny twist on the story of Snow White, Ball of Fire boasts a pair of perfect leads in Gary Cooper and Barbara Stanwyck.",100%,27,90%,3313,"Professor Bertram Potts is the youngest of eight bookish academics assembling a dictionary of slang. They find a perfect ""research associate"" in the curvaceous form of strip-tease dancer Kathryn ""Sugar Puss"" OShea, who has hidden out at the professors domicile to escape Joe Lilac, her gangster boyfriend. As Sugar Puss interprets various slang expressions, she and the professors grow quite fond of one another. She brings their personalities out from under their collegiate facades, while they revive her essential decency and genial womanhood. When Joe and his enforcer Duke Pastrami show up to claim Kathryn, the professors save the day.",NR,"Comedy, Drama",Howard Hawks,MGM,120 minutes,"Gary Cooper, Barbara Stanwyck, Oscar Homolka"
187,8397,Here Comes Mr. Jordan,N/A,100%,19,83%,1111,"Robert Montgomery plays saxophone-playing boxer Joe Pendleton, who insists upon piloting his own plane, much to the consternation of his manager Max Corkle (James Gleason). Just before a championship bout, Joes plane crashes. When he revives, he finds he has been whisked away to Heaven by the overanxious Messenger #7013. Checking with the man in charge, one Mr. Jordan (Claude Rains), Pendleton discovers that he isnt scheduled to die for another 50 years. Joe heads back to earth, only to learn to his chagrin that his body has been cremated. Mr. Jordan is obliged to find Joe a new body; the ""candidate"" is a business mogul named Farnsworth, who is in the process of being murdered in his bath by his wife (Rita Johnson) and her lover (John Emery). Joe takes over Farnsworths body, astonishing the murderers by emerging from the bathroom, very much alive (while Joe still looks like Joe to himself and the audience, he looks like Farnsworth to everyone else). Still desirous of winning the upcoming championship, Joe begins to whip Farnsworths body into shape, even hiring Max Corkle to manage him. It takes some doing, but Joe convinces Max that he is indeed Joe and not Farnsworth (their scenes together are priceless, far better seen than described). Meanwhile, Joe has fallen in love with Bette Logan (Evelyn Keyes), a woman whose father had been ruined by the real Farnsworth. For her sake, he pays back millions of dollars that the crooked Farnsworth had finagled out of his investors. This prompts Mrs. Farnsworth and her lover to kill ""Farnsworth"" again, and once more Joe Pendleton is without a body. How Mr. Jordan arranges for Joe to win the championship, expose the murderers and walk off arm and arm with Bette is a bit too complex to detail here. Here Comes Mr. Jordan is one of the most consistently clever romantic comedies of the 1940s, and richly deserving of the Oscars won by screenwriters Sidney Buchman, Seton I. Miller and Harry Segall. A sequel, Down to Earth, was filmed in 1947, with Roland Culver as Mr. Jordan; and in 1978, the original Jordan was remade by Warren Beatty as Heaven Can Wait.",NR,"Classics, Comedy, Science Fiction & Fantasy, Romance",Alexander Hall,Sony Pictures Entertainment,93 minutes,"Robert Montgomery, Claude Rains, Evelyn Keyes"
188,8400,Never Give a Sucker an Even Break,N/A,100%,11,81%,538,"In this film, W. C. Fields heads to Esoteric studios to pitch a story idea to producer Franklin Pangborn. The producer wants to make a conventional romantic musical starring Fields niece, teen-aged soprano Gloria Jean, but ""The Great Man"" has other ideas.",NR,"Classics, Comedy, Musical & Performing Arts",Edward F. Cline,Universal,71 minutes,"W.C. Fields, Gloria Jean, Leon Errol"
189,8401,That Uncertain Feeling,N/A,60%,5,56%,379,"Ernst Lubitschs That Uncertain Feeling was previously filmed by the director in 1925 as Kiss Me Again; both versions were inspired the Victorien Sardou-Emile de Najac bedroom farce Lets Get a Divorce. Six year into her marriage to preoccupied insurance salesman Larry Baker (Melvyn Douglas), Jill Baker (Merle Oberson) develops a case of hiccups. Phlegmatic Freudian psychologist Vengard (Alan Mowbray) suggests that Jills affliction is caused by marital problems, whereupon she decides to enter into a new relationship with Vengards star patient, hilariously neurotic concert pianist Sebastian (Burgess Meredith). Magnanimously agreeing to a divorce, Larry nonetheless remains in love with Jill, and she with him. Theyll get back together, of course, but not until a multitude of delightful misunderstandings. Outside of Burgess Merediths brilliant comic performance (obviously patterned on Oscar Levant), the films highlight finds Larry trying to figure out the gentlest possible way to permit Jill to file for divorce on the grounds of cruelty.",NR,Comedy,Ernst Lubitsch,United Artists,86 minutes,"Melvyn Douglas, Merle Oberon, Burgess Meredith"
190,8403,All Through the Night,N/A,100%,10,70%,589,"In this film, Humphrey Bogart plays Gloves Donahue, a rough-hewn but essentially decent New York gambler. The Runyonesque plot gets moving when Gloves tries to find out whats holding up his favorite restaurants daily shipment of cheesecake. Paying a call on the bakery, Gloves stumbles into a Nazi spy ring.",NR,"Action & Adventure, Classics, Comedy, Drama, Mystery & Suspense",Vincent Sherman,Warner Bros.,107 minutes,"Humphrey Bogart, Conrad Veidt, Kaaren Verne"
191,8404,Gentleman Jim,N/A,100%,9,86%,567,This is a loosely structured biopic about 19th-century bare-knuckle boxing champion James J. Corbett.,NR,"Classics, Comedy, Drama, Romance",Raoul Walsh,Warner Bros.,104 minutes,"Errol Flynn, Alexis Smith, Jack Carson"
192,8406,My Favorite Blonde,N/A,100%,6,74%,219,"Each of Bob Hopes ""My Favorite"" films (My Favorite Blonde, My Favorite Brunette, My Favorite Spy) was, by accident or design, a parody of a dead-serious movie genre. 1942s My Favorite Blonde, for example, was a takeoff of Alfred Hitchcock in general and Hitchcocks 39 Steps in particular. Two-bit vaudeville entertainer Hope gets mixed up with gorgeous blonde British-spy Madeline Carroll. The ""maguffin"" (Hitchcocks nickname for ""gimmick"") which ties the two stars together is a ring which contains the microfilmed plans for a revolutionary new bomber. Hope and Carroll are forced to take it on the lam when Hope is framed for murder by Nazi-agents Gale Sondergaard, George Zucco et. al. Highlights include Hope eluding capture by impersonating a famed psychologist (watch for Carl ""Alfalfa"" Switzer as Hopes most contentious ""patient""). Madeline Carroll also got several opportunities to shine comedically, especially when she lapsed into cloying baby talk while posing as Hopes wife. Bob Hope was hesitant to work with My Favorite Blonde director Sidney Lanfield, having heard of Lanfields reputation as an on-set dictator. However, the two got along so swimmingly that they would collaborate on such future top-notch Hope farces as Lets Face It (1943) and The Lemon Drop Kid (1951).",NR (not Rated),Comedy,Sidney Lanfield,Universal Studios Home Video,78 minutes,"Bob Hope, Madeleine Carroll, Gale Sondergaard"
193,8408,Random Harvest,N/A,89%,9,89%,2797,"At the close of World War I, shell-shocked amnesia victim Ronald Colman is sequestered in a London sanitarium; with no identity and no next of kin, he has nowhere else to go. Unable to stand the loneliness, Colman wanders into the streets, then stumbles into a music hall, where he is befriended by good-natured entertainer Greer Garson. That Colman and Garson fall in love and marry should surprise no one; what is surprising, at least to Colman, is that he discovers that he has a talent for writing. Three years pass: while in Liverpool to sell one of his stories, Colman is struck down by a speeding car. When he comes to, he has gained full memory of his true identity; alas, he has completely forgotten both Garson and their child. Returning to his well-to-do relatives, Colman takes over the family business. Having lost her child, the distraught Garson seeks out the missing Colman. Psychiatrist Philip Dorn helps Garson, advising her that to reveal her identity may prove a fatal shock for her husband. To stay near him all the same, Garson takes a job as Colmans secretary. ""Strangely"" attracted to Garson, Colman falls in love with her all over again. Will there be yet another memory lapse? Under normal circumstances, we wouldnt believe a minute of Random Harvest, but the magic spell woven by the stars and by author James Hilton (Lost Horizon, Goodbye Mr. Chips etc.) transforms the wildly incredible into the wholly credible (just one quibble: isnt Colman a bit long in tooth as a ""young"" World War I veteran?) The film was one of MGMs biggest hits in 1942--indeed, one of the biggest in the studios history.",NR,"Classics, Drama",Mervyn LeRoy,MGM Home Entertainment,126 minutes,"Ronald Colman, Greer Garson, Philip Dorn"
194,8412,Heaven Can Wait,"A throwback to the high-gloss screwball comedies of the 1940s, Heaven Can Wait beguiles with seamless production values and great comic relief from Charles Grodin and Dianne Cannon.",89%,37,68%,13218,"In this film, Warren Beatty plays pro-football-player Joe Pendleton, who is whisked to Heaven before his due date by over-eager celestial escort Buck Henry. The erudite Mr. Jordan arranges for Joe to enter the mortal coil of a cold-hearted businessman named Farnsworth, who has just been murdered by his wife.",PG,"Comedy, Science Fiction & Fantasy, Romance, Sports & Fitness","Warren Beatty, Buck Henry",Paramount Home Video,101 minutes,"Warren Beatty, Julie Christie, James Mason"
195,8423,Ministry of Fear,N/A,87%,23,75%,983,"An innocent man is drawn into a web of espionage when he unwittingly comes into possession of a crucial piece of microfilm in this shadowy, ominous film noir. Fritz Langs adaptation of Graham Greenes novel is filled with unusual touches, beginning with the fact that protagonist Stephen Neale (Ray Milland) has just been released from a mental asylum. To celebrate his return to the real world, he visits a local carnival, only to accidentally receive a ""prize"" meant for a Nazi agent. When he discovers the error, he turns for help to a detective, whose investigations only make the matter more complicated. Neale soon winds up on the run from both the Nazis and the police, who mistakenly believe him guilty of murder. Langs famous expressionistic style is somewhat muted here, but Henry Sharps crisp black-and-white cinematography sets a suitably unsettling mood, and the twists and double-crosses of Greenes story unfold at an appropriately quick pace. While it does not reach the same level of timeless classic as Carol Reeds adaptation of Greenes The Third Man four years later, Ministry of Fear stands as a well-made, thoroughly gripping and intelligent example of film noir.",NR (not rated),"Classics, Drama, Mystery & Suspense",Fritz Lang,Paramount Pictures,85 minutes,"Ray Milland, Marjorie Reynolds, Carl Esmond"
196,8425,Mr. Skeffington,N/A,57%,7,81%,2683,"Whose face ravaged, grotesque is in the mirror? Surely its not that of Fanny Skeffington, the prettiest woman in New York. Fanny always used her beauty to manipulate her way through life. Shes encouraged dozens of suitors, even after her marriage. But now diphtheria has robbed her of her only attribute. And without her looks, shes lost. Bette Davis earned her eighth Best Actress Oscar nomination portraying Fanny.",G,"Classics, Drama, Romance",Vincent Sherman,MGM Home Entertainment,145 minutes,"Bette Davis, Claude Rains, Walter Abel"
197,8431,Isle of the Dead,N/A,87%,15,51%,1807,"Inspired by Swiss artist Arnold Böcklins famous painting, this seminal horror film marked the first of three collaborations between RKO producer Val Lewton and British genre star Boris Karloff. Set during the 1912 Balkan Wars, Isle of the Death featured Karloff as Greek general Pherides who, along with an American journalist (Marc Cramer), visits the gravesite of his late wife on a deserted island. They find the grave desecrated and a group of travelers held hostage by the superstitious beliefs of Kyra (Helene Thimig). One by one, the inhabitants of the island are felled by what Dr. Drossos (Ernest Dorian aka Ernst Deutsch) terms the plague, but what Kyra insists is the work of Thea (Ellen Drew), a young nurse she believes to be a ""varvoloka,"" an ancient Greek vampire. Theas patient, Mrs. St. Aubun (Katherine Emery), suffers from death-like trances and, sure enough, during one of her spells, she is pronounced dead by Swiss archeologist Albrecht (Jason Robards Sr. and is interred alive.",NR,"Drama, Horror, Musical & Performing Arts, Mystery & Suspense",Mark Robson,RKO Pictures,72 minutes,"Boris Karloff, Ellen Drew, Marc Cramer"
198,8434,They Were Expendable,N/A,90%,10,72%,3459,"Based on a true World War II story, They Were Expendable follows two American PT boats fighting a battle against a fleet of Japanese ships in the Philippines. They Were Expendable is also shown in a computer-colorized version.",NR,"Classics, Drama",John Ford,MGM Home Entertainment,135 minutes,"Robert Montgomery, John Wayne, Donna Reed"
199,8436,The Beast With Five Fingers,N/A,89%,18,58%,435,"When a concert pianist dies without recognizing his personal secretary in his will, the secretary chops off one of the corpses hands and begins to plot revenge. Things get more complicated, however, when the disembodied hand takes on a life of its own in this renowned early horror film.",NR,"Classics, Horror",Robert Florey,Dominant Pictures Corp.,88 minutes,"Robert Alda, Andrea King, Peter Lorre"
200,8437,The Blue Dahlia,N/A,100%,8,71%,1087,"At the end of WWII, a veteran returns to Los Angeles and becomes a murder suspect when his adulterous wife is found dead. Helped by a beautiful blonde, he tries to avoid the police while looking for the killer. Raymond Chandler wrote the screenplay for this moody, hard-boiled film noir.",NR,Mystery & Suspense,George Marshall,Paramount Pictures,96 minutes,"Alan Ladd, Veronica Lake, William Bendix"
201,8441,Humoresque,N/A,60%,5,71%,1252,"Fannie Hursts novel Humoresque is the lachrymose tale of a famed Jewish-American violinist who forgets all about his friends and family in his rise to fame. Screenwriters Clifford Odets and Zachary Gold refashioned this timeworn material into a first-class, big-budget soap opera, completely dominated by the high-octane talents of Joan Crawford and John Garfield. A gifted musician, Garfield rises from the slums to the upper echelons of society, thanks to the patronage of wealthy, alcoholic Crawford. Virtually ignored by her husband Paul Cavanaugh, Crawford adopts Garfield as her lover as well as her protégé. He is only mildly offended by the setup; she, on the other hand, becomes jealous and possessive. It is not a woman who comes between Crawford and Garfield: it the intensity of his talent, not to mention the spectre of the great composers whose works he interprets so brilliantly. Garfields virago of a mother (Ruth Nelson) feeds upon Crawfords jealousy, planting the seeds of guilt for (allegedly) holding her son back. The ultrastylish suffering of Joan Crawford and the street-punk insouciance of John Garfield (who looks like a ""Dead End Kid"" even while wearing a tux) is counterpointed by the phlegmatic comedy relief of Oscar Levant.",NR,"Classics, Drama",Jean Negulesco,Warner Home Video,123 minutes,"John Garfield, Joan Crawford, Oscar Levant"
202,8447,Road to Rio,N/A,100%,6,76%,2931,"Road to Rio was the first of three ""Road"" pictures jointly produced by stars Bing Crosby and Bob Hope. On the run from the law again, musicians Bob and Bing stow away on an ocean liner. They try to come to the rescue of heiress Dorothy Lamour, who is doomed to an arranged marriage to caddish George Meeker. All gratitude and effusions for their assistance, Dorothy surprises Bob and Bing on their next meeting by slapping them in their faces and declaring ""I hate you! I loathe you! I despise you!"" The explanation? Dorothy is being hypnotized by her scheming aunt Gale Sondergaard, who has set up the marriage for mysterious mercenary reasons of her own. When Dorothy is ""herself"" again, Bob and Bing smuggle her off the ship and into their Rio de Janeiro hotel room. The boys plan to save Dorothy from her unwanted marriage by passing her off as a nightclub singer, and themselves as band leaders. Trouble is, they have no band. Enter the Wiere Brothers, three Rio street entertainers. Bob and Bing hire the threesome on the spot, unmindful that they have booked themselves into Nestor Paivas nightclub on the promise that theyre delivering an American band. Since the Wieres speak only Portuguese, Bing teaches each brother an American phrase by rote: ""Youre in the groove, Jackson"", ""Youre Telling Me,"" and ""This is Murder."" Naturally, it isnt long before the boys ruse is discovered, and this coupled with the newly hypnotized Lamours threats to have Bob and Bing arrested, leaves our heroes broke and stranded once more. Still, they pose a menace to Sondergaard, thus she contrives a method of disposing of them. Hypnotizing them both, Sondergaard orders Bob and Bing to kill each other. They snap out of the spell just in time, but still theres the problem of rescuing Dorothy. And now theres a new angle: mysterious stranger Frank Puglia informs the boys that the only way to stop the wedding is to retrieve (pause; a furtive glance left; a furtive glance right) ""The Papers."" Said papers are in the possession of Sondergaard, obliging Bob and Bing to show up at the pre-nuptial festival in disguise (with Bob in drag). Managing to hypnotize Sondergaards henchmen Frank Faylen and Joseph Vitale, Bob and Bing uncover the precious Papers, and Dorothy is saved. But how can those papers stop a wedding? We wont give away the surprise, nor will we tell you whether Dorothy ends up with Bob or Bing, nor even what the heck Jerry Colonna is doing in the picture leading a cavalry charge. Not the best of the ""Road"" pictures, Road to Rio is nonetheless one of the most memorable--and quotable (how many of your high school pals used to confound the teacher by declaring ""Youre in the groove, Jackson""?)",NR,"Classics, Comedy","Norman Z. McLeod, Norman McLeod",Paramount Pictures,100 minutes,"Bob Hope, Bing Crosby, Dorothy Lamour"
203,8449,Three Godfathers,N/A,82%,11,79%,2290,"This film is John Fords second version of Peter B. Kynes western about three outlaws who adopt and care for a baby they find in the desert. The three outlaws are on the run from the law, yet they risk their lives to bring the baby to the nearest town.",NR,"Classics, Drama, Western",John Ford,WARNER BROTHERS PICTURES,105 minutes,"John Wayne, Pedro Armendáriz, Harry Carey Jr."
204,8452,Easter Parade,N/A,90%,21,86%,9309,A nightclub performer hires a naive chorus girl to become his new dance partner to make his former partner jealous and to prove he can make any partner a star.,NR,"Classics, Musical & Performing Arts, Romance",Charles Walters,MGM Home Entertainment,103 minutes,"Fred Astaire, Judy Garland, Ann Miller"
205,8453,Fort Apache,N/A,100%,21,83%,7910,"The soldiers at Fort Apache may disagree with the tactics of their glory-seeking new commander. But to a man, theyre duty-bound to obey - even when it means almost certain disaster. John Wayne, Henry Fonda and many familiar supporting players from master director John Fords ""stock company"" saddle up for the first film in the directors famed cavalry trilogy (She Wore a Yellow Ribbon and Rio Grande are the others). Roughhouse camaraderie, sentimental vignettes of frontier life, massive action sequences staged in Monument Valley - all are part of Fort Apache. So is Fords exploration of the Wests darker side. Themes of justice, heroism and honor that Ford would revisit in later Westerns are given rein in this moving, thought-provoking film that, even as it salutes a legend, gives reasons to question it.",NR,"Classics, Western",John Ford,Turner Home Entertainment,127 minutes,"Henry Fonda, John Wayne, Shirley Temple"
206,8454,The Lady From Shanghai,"Energetic and inventive, The Lady from Shanghai overcomes its script deficiencies with some of Orson Welles' brilliantly conceived set pieces.",82%,45,85%,8711,"After watching a rough cut of Orson Welles The Lady From Shanghai, Columbia Pictures head Harry Cohn looked furtively around the projection room, and in an anguished voice begged ""Somebody please tell me what this is about!"" Cohn missed the point: in an Orson Welles film, it doesnt matter what its about. You just sit back and wallow in his camera pyrotechnics and shadow-drenched imagery. Actually, the story, based on a novel by Sherwood King, makes perfect sense after two or three viewings. Welles plays an Irish-American sailor (with a brogue that wouldnt convince a cow) who rescues a beautiful blonde from muggers in Central Park. The blonde is portrayed by the otherwise redheaded Rita Hayworth, who under the direction of her ex-husband Welles delivers one of her most impressive performances. Orson and Rita meet again when Welles is hired as a crew member of the yacht owned by Ritas husband, the brilliant, crippled defense attorney Everett Sloane. As he falls deeper under Ritas spell, Welles gets involved in a bizarre insurance scam. Glenn Anders, Sloanes eccentric law partner, plans to stage his own death, collect the insurance, and skip town. All Welles has to do is pretend to murder Anders, and hell get a big chunk of the money. As it turns out, Anders is murdered for real. The innocent Welles is defended in court by Sloane, who is famous for never losing a case, but who in this instance seems bound and determined to lose. As the jury files out, Welles makes a break for it. Rita catches up with him at a Chinese theatre, then stands by with a glazed expression on her face as she watches her cohorts drug Welles. As he comes to in an amusement park fun house, he begins to piece the plot together; he has been set up as a clay pigeon by Rita and Sloane. Only now, Rita intends to double-cross her husband. The plot comes to a literally smashing climax in the famous ""hall of mirrors"" sequence, with Rita and Sloane shooting it out amidst shards of shattering glass. No, it isnt the simplest thing in the world to follow Lady From Shanghai, but we wouldnt forego this bizarre cinematic jigsaw puzzle for anything.",NR,"Classics, Drama, Mystery & Suspense",Orson Welles,Columbia Pictures Corporation,87 minutes,"Orson Welles, Rita Hayworth, Everett Sloane"
