,dataIndex,realTitle,criticsConcensus,tomatoMeter,tomatoCount,audienceScore,audienceCount,realSynopsis,rating,genreString,directedBy,studio,runTime,cast
94,8211,Tarnation,"Using music and home video footage to great effect, Jonathan Caouette has made a very personal and moving film.",92%,103,82%,7493,"Part documentary, part narrative fiction, part home movie, and part acid trip. A psychedelic whirlwind of snapshots, Super-8 home movies, old answering machine messages, video diaries, early short films, snippets of 80s pop culture, and dramatic reenactments to create an epic portrait of an American family travesty. The story begins in 2003 when Jonathan learns that his schizophrenic mother, Renee, has overdosed on her lithium medication. He is catapulted back into his real and horrifying family legacy of rape, incest, abandonment, promiscuity, drug addiction, child abuse, and psychosis. As he grows up on camera, he finds the escapist balm of musical theater and B horror flicks and reconnects to life through a queer chosen family. Then a look into the future shows Jonathan as he confronts the symbiotic and almost unbearable love he shares with his beautiful and tragically damaged mother.",NR,"Documentary, Drama, Special Interest",Jonathan Caouette,Wellspring,100 minutes,"Jonathan Caouette, Renee LeBlanc, Adolph Davis"
95,8213,Hair Show,N/A,17%,12,69%,7109,"Blood may be thicker than water, but it doesnt hold a candle to hairspray, as we learn in this urban comedy. Angela (Kellita Smith) is a successful hairdresser who operates her own salon based in Los Angeles. One day, Angela gets an unexpected visit from her sister Peaches (MoNique), who runs a beauty shop of her own in Baltimore. The family reunion turns out to not be as happy as Angela may have hoped -- Peaches is trying to stay a step ahead of IRS agents who want to collect 50,000 dollars in back taxes, while also avoiding Marcella (Gina Torres), a fellow hair stylist who wants to take over Peaches shop. Despite their differences, Angela and Peaches join forces in hopes of finding a way to get the bill paid and take Marcella out of the picture.",PG-13 (for sexual content including dialogue.),Comedy,Leslie Small,UrbanWorks Entertainment,100 minutes,"Mo'Nique, Kellitta Smith, Kellita Smith"
96,8214,Riding the Bullet,Stephen King adaptation veteran director Mick Garris has lofty storytelling goals which ultimately flail and undercut the story's terror.,26%,23,34%,7837,"A young man who has flirted with death is forced to come to terms with mortality in this tale of terror based on a story by Stephen King. Alan Parker (Jonathan Jackson) is a college student studying art at the University of Maine in 1969. Cursed with an over-active imagination, Alan constantly obsesses over the worst outcome of any situation, and when he begins to suspect his girlfriend, Jessica (Erika Christensen), is thinking of leaving him, it drives him to the brink of suicide. Shortly after this brush with death, Alan receives word that his mother, Jean (Barbara Hershey), has suffered a severe stroke and may not pull through. Alan grabs his jacket and hits the road, hoping to hitchhike the one hundred miles to the hospital. As it happens, Alan is trying to catch a ride on Halloween night, and after hes picked up by one George Staub (David Arquette), he realizes that hes riding the highway with a creature not of this Earth. Riding the Bullet was directed by Mick Garris, marking the fourth time the filmmaker has brought one of Kings stories to the cinema or television screen.","R (adult situations/language, nudity, violence)","Horror, Mystery & Suspense",Mick Garris,LionsGate Entertainment,98 minutes,"Jonathan Jackson, David Arquette, Cliff Robertson"
97,8216,Being Julia,"Annette Bening delivers a captivating performance in Being Julia, a sophisticated comedy that follows a 1930s stage diva who experiences an identity crisis at age 40.",76%,123,74%,7551,"In London in 1938, actress Julia Lambert is at her peak, physically and professionally, but her successful theatrical career and her marriage to handsome impresario Michael Gosselyn have become stale and unfulfilling. She longs for novelty, excitement, sparks. Enter Tom Fennell. A younger man who claims to be Julias greatest fan. Finding his ardor irresistible, she decides that romance is the best antidote to a mid-life crisis and embarks on a passionate affair. Life becomes more daring and exciting, until Julias young lover callously tries to relegate her to a supporting role. But on opening night, Julia reveals that she is a more formidable actress than anyone ever imagined.",R (for some sexuality),"Comedy, Drama",István Szabó,Sony Pictures Classics,103 minutes,"Annette Bening, Jeremy Irons, Michael Gambon"
98,8219,Surviving Christmas,"Surviving Christmas is unpleasant characters attacking each other for 90 minutes before delivering a typical, hollow anti-consumerist message",7%,115,29%,28472,"Facing another Christmas alone, Drew Latham decides to go back to his idyllic childhood home to spend the holidays with family. There is, however, one problem: the people living there now are not Drews family. Nevertheless, Drew has his mind set on an old-fashioned family Christmas, and the fact that the ""family"" in question, the Valcos, are complete strangers, isnt about to put a crimp in his plans. Offering them a small fortune, Drew bribes his newfound ""parents"" to let him spend Christmas in their home, pretending to be part of the family. Just when the Valcos begin to question if any amount of money is worth being dragged all over town on such traditional family holiday excursions as Christmas shopping and the requisite choosing of the Christmas tree, their eldest daughter Alicia comes home for the holidays, with no intention of adopting a new ""brother.""","PG-13 (for sexual content, language and a brief drug reference)","Comedy, Romance",Mike Mitchell,Dreamworks,90 minutes,"Ben Affleck, James Gandolfini, Christina Applegate"
99,8220,The Grudge,"There's some creepy imagery to be found, but not much in the way of logic or truly jarring scares.",39%,160,46%,458635,"Karen is an exchange student studying social work in Japan who innocently agrees to cover for a nurse who didnt show up for work. When she enters the assigned home, she discovers an elderly American woman, Emma, who is lost in a catatonic state while the rest of the house appears deserted and disheveled. As she is tending to the stricken old woman, Karen hears scratching sounds from upstairs. When she investigates, she is faced with a supernatural horror more frightening than she could ever imagine. Within this house, a chain of terror has been set in motion resulting from a terrifying evil that was born years before. As more people die, Karen is pulled into the cycle of horror and learns the secret of the vengeful curse that has taken root in this house. Now she must stop it before its too late.","PG-13 (for mature thematic material, disturbing images/terror/violence, and some sensuality)","Drama, Horror, Mystery & Suspense",Takashi Shimizu,Sony Pictures Entertainment,91 minutes,"Sarah Michelle Gellar, Jason Behr, William Mapother"
100,8221,Alfie,"This unnecessary remake wants Alfie to have his cake and eat it, too, but a lack of sexual fizz and a sour performance by Jude Law conspire to deliver audiences a romantic comedy that isn't romantic or funny.",48%,155,51%,85333,"Alfie Elkins is a philosophical womanizer who is forced to question his seemingly carefree existence. Ultimately, his freewheeling lifestyle begins to slowly unravel.","R (for sexual content, and some language and drug use)","Comedy, Drama, Romance",Charles Shyer,Paramount Pictures,105 minutes,"Jude Law, Marisa Tomei, Omar Epps"
101,8222,Sideways,"Charming, thoughtful, and often funny, Sideways is a decidedly mature road trip comedy full of excellent performances.",97%,231,78%,197615,"A wine tasting road trip to salute Jacks final days as a bachelor careens woefully sideways as he and Miles hit the gas en route to mid-life crises. The comically mismatched pair, who share little more than their history and a heady blend of failed potential and fading youth, soon find themselves drowning in wine and women. Emerging from a haze of pinot noir, wistful yearnings and trepidation about the future, the two inevitably collide with reality.","R (for language, some strong sexual content and nudity)","Comedy, Drama, Romance",Alexander Payne,Fox Searchlight Pictures,127 minutes,"Paul Giamatti, Thomas Haden Church, Virginia Madsen"
102,8223,The Machinist,Brad Anderson's dark psychological thriller about a sleepless factory worker is elevated by Christian Bale astonishingly committed performance.,77%,143,83%,155957,"Brad Anderson directs the psychological thriller The Machinist, a production of Spains Filmax company. Christian Bale plays Trevor Reznik, a factory lathe operator who has developed a serious case of insomnia. Lack of sleep has already started to wear down on his brain and his body. When hes involved in an accident at work, his co-workers turn against him. He starts to find strange notes in his apartment and see people that apparently arent there. Jennifer Jason Leigh stars as call girl Stevie. The Machinist premiered at the Sundance Film Festival in 2004. ~ Andrea LeVasseur, Rovi","R (for violence, and disturbing images, sexuality and language)","Drama, Mystery & Suspense",Brad Anderson,Paramount Classics,98 minutes,"Christian Bale, Jennifer Jason Leigh, Aitana Sánchez-Gijón"
103,8224,Vera Drake,"With a piercingly powerful performance by Imelda Staunton, Vera Drake brings teeming humanity to the controversial subject of abortion.",92%,159,84%,11607,"Vera Drake is a selfless woman who is completely devoted to, and loved by, her working class family. She spends her days doting on them and caring for her sick neighbor and elderly mother. However, she also secretly visits women and helps them induce miscarriages for unwanted pregnancies. While the practice itself was illegal in 1950s England, Vera sees herself as simply helping women in need, and always does so with a smile and kind words of encouragement. When the authorities finally find her out, Veras world and family life rapidly unravel.",R (for depiction of strong thematic material),Drama,Mike Leigh,New Line Cinema,124 minutes,"Imelda Staunton, Philip Davis, Peter Wight"
104,8225,Falling Angels,N/A,63%,8,66%,1251,"Canadian filmmaker Scott Smith directs the black comedy Falling Angels, based on the novel by Barbara Gowdy and adapted for the screen by poet and author Esta Spalding. Set in the late 60s and filmed on-location in Saskatchewan, this dark family drama focuses on the three teenaged daughters of the Field household. Callum Keith Rennie plays Jim Field, the loud-mouthed, domineering patriarch who has intimidated his wife Mary (Miranda Richardson) into a catatonic state of alcoholism and depression. Norma (Monté Gagné) is the oldest, most responsible daughter; she is overburdened and preoccupied by events from the past. Middle child Lou (Katharine Isabelle) chooses the rebellious path in order to escape her fathers unreasonable demands. Youngest daughter Sandy (Kristin Adams) aspires to maximum femininity, engaging in an affair with an older, married man (Mark McKinney) in the process. Falling Angels was shown at the 2003 Toronto Film Festival.",NR,Drama,Scott Smith,Film Movement,109 minutes,"Miranda Richardson, Callum Keith Rennie, Katharine Isabelle"
105,8226,Stella Street,N/A,12%,17,49%,829,"A satirical glimpse at the early 21st century in which impressionists Phil Cornwell and John Sessions send up celebrity culture, including: Keith Richards and Mick Jagger, who run a corner shop; Jack Nicholson and Al Pacino, who rub shoulders in a leafy lane in suburbia; and David Bowie, who has his underpants starched and ironed by an uptight cockney charlady named Mrs. Huggett. Megastars come and go, but nothing escapes the watchful eye of their long-suffering neighbor, Michael Caine.",R (for language and some drug material),"Art House & International, Comedy, Drama, Television",Peter Richardson,Sony Pictures,78 minutes,"Phil Cornwell, John Sessions, Ronni Ancona"
106,8228,Undertow,"Undertow's gently fantastical elements are balanced by fully realized characters and a story with genuine, steadily accumulating emotional weight.",55%,120,62%,7299,"Chris (Jamie Bell of Billy Elliot) is a volatile teen who lives with his father, John (Dermot Mulroney), and his little brother, Tim (Devon Alan). After the death of Chris mother, his reclusive father moved the family to a shack in backwoods Georgia, where they raise hogs. Tim has an unusual eating disorder. He is constantly making himself sick by eating things like dirt and paint. One day, Johns estranged brother, Deel (Josh Lucas), gets out of prison and shows up on the farm. John is less than thrilled to see him, but agrees to let him stay with the family as long as Deel helps him look after his boys. Chris is drawn to his wild-man uncle, but it soon becomes clear that Deel has more on his mind than a family reunion. Greed and years of resentment lead to violence, and Chris finds himself on the run, towing his sickly brother along, with Deel in pursuit. Undertow is writer/director David Gordon Greens third feature film, and features many of the same crew as his previous films, George Washington and All the Real Girls, including cinematographer Tim Orr. Green, who co-wrote the script with Joe Conway, has cited the influence of filmmaker Terrence Malick, who is credited as a producer. Green was also influenced by low-budget regional films of the 1970s (like Macon County Line and The Texas Chainsaw Massacre) and by Charles Laughtons classic The Night of the Hunter. Undertow was selected by the Film Society of Lincoln Center for inclusion in the 2004 New York Film Festival.",R (for violence),"Drama, Mystery & Suspense",David Gordon Green,MGM,120 minutes,"Jamie Bell, Josh Lucas, Devon Alan"
107,8229,Enduring Love,"While it strains credibility and isn't ultimately as profound as it might first appear, Enduring Love is still an intriguing thriller fueled by strong performances from Rhys Ifans and Daniel Craig.",58%,98,60%,8573,"On a beautiful cloudless day a young couple celebrate their reunion with a picnic. Joe has planned a postcard-perfect afternoon in the English countryside with his partner, Claire. But as Joe and Claire prepare to open a bottle of champagne, their idyll comes to an abrupt end. A hot air balloon drifts into the field, obviously in trouble. The pilot catches his leg in the anchor rope, while the only passenger, a boy, is too scared to jump down. Joe and three other men rush to secure the basket. Just as they secure the balloon, the wind rushes into the field, and at once the rescuers are airborne. Joe manages to drop to the ground, as do most of his companions, but one man is lifted skywards. As Joe, Claire and the other rescuers watch this strangely beautiful sight; they see the man fall to his death. Recalling the days events at dinner with his friends Robin and Rachel, Joe reveals the impact the accident has had on his battered psyche. Ironically the balloon eventually lands safely, the boy unscathed. But fate has far more unpleasant things in store for Joe. Going to retrieve the body of the fallen man with fellow rescuer Jed Parry, for example, turns out to be a very bad move. Jed feels an instant connection with Joe--one that, as the weeks go by, becomes ever more intense.","R (for language, some violent images and brief nudity)","Drama, Mystery & Suspense",Roger Michell,Paramount Classics,101 minutes,"Daniel Craig, Samantha Morton, Rhys Ifans"
108,8230,Saw,"Saw ensnares audiences with a deceptively clever plot and a myriad of memorable, nasty set pieces, but its lofty ambitions are undercut by a nihilistic streak that feels more mean than profound.",49%,184,84%,852589,"The directorial debut from filmmaker James Wan, this psychological thriller comes from the first screenplay by actor Leigh Whannell, who also stars. Whannell plays Adam, one of two men chained up in a mysterious chamber. The other, Dr. Gordon (Cary Elwes), like Adam, has no idea how either of them got there. Neither of them are led to feel optimistic by the man lying between them dead of a self-inflicted gunshot wound. Together, Adam and Dr. Gordon attempt to piece together what has happened to them and who the sadistic madman behind their imprisonment is. Also starring Danny Glover and Monica Potter, Saw premiered at the 2004 Sundance Film Festival. ~ Matthew Tobey, Rovi",R (for strong grisly violence and language),"Horror, Mystery & Suspense",James Wan,Lions Gate Films,103 minutes,"Leigh Whannell, Cary Elwes, Danny Glover"
109,8231,Ray,"An engrossing and energetic portrait of a great musician's achievements and foibles, Ray is anchored by Jamie Foxx's stunning performance as Ray Charles.",80%,204,87%,214491,"Born in a poor town in Georgia, Ray Charles went blind at the age of seven shortly after witnessing his younger brothers accidental death. Inspired by a fiercely independent mother who insisted he make his own way in the world, Charles found his calling and his gift behind a piano keyboard. Touring across the Southern musical circuit, the soulful singer gained a reputation and then exploded with worldwide fame when he pioneered incorporating gospel, country, jazz and orchestral influences into his inimitable style. As he revolutionized the way people appreciated music, he simultaneously fought segregation in the very clubs that launched him and championed artists rights within the corporate music business.","PG-13 (for depiction of drug addiction, sexuality, and some thematic elements)",Drama,Taylor Hackford,Universal Pictures,148 minutes,"Jamie Foxx, Kerry Washington, Regina King"
110,8232,Birth,"A well-mounted production is undermined by a muddled, absurd storyline of questionable taste.",38%,147,43%,28239,"Anna is a young widow who is finally getting on with her life after the death of her husband, Sean. Now engaged to be married, Anna meets a ten-year-old boy who tells her he is Sean reincarnated. Though his story is both unsettling and absurd, Anna cant get the boy out of her mind. And much to the concern of her fiancée, her increased contact with him leads her to question the choices she has made in her life.",R (for sexuality),"Drama, Mystery & Suspense",Jonathan Glazer,New Line Cinema,100 minutes,"Nicole Kidman, Cameron Bright, Danny Huston"
111,8236,It's All About Love,"It's All About Love has ambitious ideas and an impressive cast, none of which are put to compelling use in this dramatically inert and narratively incoherent sci-fi drama.",19%,31,27%,1314,"In a near-future world, environmental damage causes flash ice ages and gravity loss, and people who experience devastating grief and loneliness are susceptible to a fatal disease that suddenly freezes the heart--transforming them into human carnage that collects on street corners and airport escalators. On a business trip, John stops over in New York City to sign divorce papers at the request of his ex-wife-to-be, world-famous ice-skating star, Elena. Her enormous entourage greets him warmly, but the kindly looking patriarch of the clan has a malevolent plan of appalling proportions that endangers the lives of John and Elena.","R (for a scene of strong violence, some language and sexuality)","Drama, Mystery & Suspense, Science Fiction & Fantasy, Romance",Thomas Vinterberg,Focus Features,105 minutes,"Joaquin Phoenix, Claire Danes, Sean Penn"
112,8237,Callas Forever,"An uneven biopic that struggles to convey what made its subject special, Callas Forever is far from a definitive look at the life of this brilliant opera diva.",41%,58,55%,1574,"A mournful look at the last days of opera diva Maria Callas, director Franco Zeffirellis biographical drama attempts to explore the irresistible allure of a comeback for a fallen star who hungers for the success of her past. Weathered from the excess of the previous decade and with her best performances long behind her, Callas (Fanny Ardant) withdraws to her Paris apartment to live her final days in seclusion. Despite being ravaged by a throat disease and being stuck in an extended period of mourning following the death of her true love, Callas manager Larry Kelly (Jeremy Irons) nevertheless suggests that the former reigning queen of opera attempt a spectacular comeback. Though she is physically unable to perform the pieces the way that she once did, the suggestion to lip-sync to recordings of her previous performances offers a tentative chance for latter day fame. Despite her belief that lip-syncing her performance would be dishonest to her fans, the prospect of performing +Carmen, an opera that she once recorded but never performed on stage, offers Callas one last shot at reliving her former glory.",PG-13 (for some sexual content and strong language),"Drama, Musical & Performing Arts",Franco Zeffirelli,Regent Releasing,108 minutes,"Fanny Ardant, Jeremy Irons, Joan Plowright"
113,8238,The Polar Express,"Though the movie is visually stunning overall, the animation for the human characters isn't lifelike enough, and the story is padded.",56%,206,63%,242212,"Directed by Robert Zemeckis and based on childrens author Chris Van Allsburgs modern holiday classic of the same name, The Polar Express revolves around Billy (Hayden McFarland), who longs to believe in Santa Claus but finds it quite difficult to do so, what with his familys dogged insistence that all of it, from the North Pole, to the elves, to the man himself, is all just a myth. This all changes, however, on Christmas Eve, when a mysterious train visits Billy in the middle of the night, promising to take him and a group of other lucky children to the North Pole for a visit with Santa. The trains conductor (Tom Hanks) along with the other passengers help turn Billys crisis in faith into a journey of self-discovery. A long-time fan of Van Allsburgs book, Hanks also helped produce the film. ~ Tracie Cooper, Rovi",G,"Animation, Drama, Kids & Family",Robert Zemeckis,Warner Bros. Pictures,100 minutes,"Leslie Zemeckis, Tom Hanks, Michael Jeter"
114,8239,Kinsey,"A biopic of the sex researcher is hailed as adventurous, clever, and subversive, with fine performances by Liam Neeson and Laura Linney.",90%,195,75%,34218,"Alfred Kinsey was an entomologist who taught at Indiana University and had a keen interest in an area of human behavior that had seen little scholarly research -- human sexuality. While the courtship and reproductive patterns of animals had been carefully documented, Kinsey believed that most ""established facts"" about human sexual behavior were a matter of conjecture rather than research and that what most people said about their sex lives was not born out by the evidence (a subject that had personal resonance for him given the troubles he and his wife Clara Kinsey had in the early days of their marriage). After introducing a course in ""Marriage"" at Indiana University which offered frank and factual information on sex to students, Kinsey began an exhaustive series of interviews with a wide variety of people from all walks of life in order to find out the truth about sex practices in America. When he published Sexual Behavior and the Human Male in 1948, his findings were wildly controversial, indicating that most men had a wider variety of sexual experiences than most people imagined, including a number of practices commonly thought to be dangerous or perverted (including pre-marital sex, same-sex contacts, and masturbation). An even greater outcry greeted Kinseys next volume, Sexual Behavior and the Human Female, which contradicted common notions than most women went into marriage sexually inexperienced. Kinsey is a film biography written and directed by Bill Condon which examines Kinseys life and work from his strict childhood until his death in 1956. Liam Neeson plays Alfred Kinsey, and Laura Linney co-stars as Kinseys wife and colleague Clara. John Lithgow highlights the supporting cast as Kinseys repressed and moralistic father, while Chris ODonnell, Peter Sarsgaard, and Timothy Hutton play members of Kinseys research team and Tim Curry appears as an IU faculty member at odds with Kinseys teachings. ~ Mark Deming, Rovi","R (for pervasive sexual content, including some graphic images and descriptions)",Drama,Bill Condon,Fox Searchlight Pictures,118 minutes,"Liam Neeson, Laura Linney, Chris O'Donnell"
