,dataIndex,realTitle,criticsConcensus,tomatoMeter,tomatoCount,audienceScore,audienceCount,realSynopsis,rating,genreString,directedBy,studio,runTime,cast
275,8634,Sympathy for the Devil (One Plus One),N/A,50%,10,57%,3160,"Jean-Luc Godards Sympathy for the Devil, also known as One Plus One, uses both documentary and staged sequences, alternating between an inside look at a rock bands recording process and reflections on contemporary politics and aesthetics. One half of the film focuses on the Rolling Stones, as they rehearse and ultimately record the song that would become ""Sympathy for the Devil."" By presenting repeated takes of the entire composition, the film allows the viewer to witness the progressive evolution of the song from its original, slower conception to the more percussive version that became the final recording. The other half of the film -- which is occasionally accompanied by the song -- presents a series of sequences dealing with issues like black power, pornography, racism, and Marxism, amongst others. These sequences, which often focus on a group of revolutionary youth in Paris, provide a chance for Godard to inject political commentary and meta-fictional musings on the nature of cinema. These more cerebral scenes serve as counterpoint to the direct presentation of the creative process seen in the Stones studio sessions, and provide oblique commentary on the political meanings of popular music. ~ Judd Blaise, Rovi",NR,"Documentary, Musical & Performing Arts, Special Interest, Television",Jean-Luc Godard,N/A,110 minutes,"Mick Jagger, Keith Richards, Brian Jones"
276,8636,"Yours, Mine & Ours","The initial set-up is unbelievable, the plotting is predictable and stale, and the comedy depends on repetitive pratfalls that soon get old.",6%,107,51%,398045,"When Frank Beardsley, a widower with eight children, runs into his high school sweetheart, Helen North, its as if 30 years never passed! Helen, also a widow with 10 kids of her own that include the six she and her husband adopted, feels the attraction as well. Its no wonder they rush into marriage without telling their kids. True love can conquer all -- right? Unfortunately for Frank and Helen, the families dont mesh quite as easily as the newlyweds had hoped. They probably should have seen the culture clash coming: the disciplined Beardsleys run things by the book; for the energetic and vivacious Norths, there is no book. Helens kids arent pleased about moving and sharing rooms with a bunch of uptight strangers. Franks children have nothing in common with the unruly Norths. Since both sets of kids arent happy, they devise a plan to undermine the marriage and team up to plot the breakup. East meets west as the two families find a way to work together -- in order to separate! Just when it appears that the kids have succeeded, they realize they like each other despite their differences -- they dont want their families to split up! Can they save Frank and Helens marriage after they so brilliantly split them up? Its up to Frank and Helen.",PG (for mild crude humor),"Comedy, Kids & Family, Romance",Raja Gosnell,Paramount Pictures,88 minutes,"Dennis Quaid, Rene Russo, Sean Faris"
277,8637,Alice's Restaurant,N/A,63%,16,60%,3647,"This uneven film is based on Arlo Guthries popular song ""The Massacre At Alices Restaurant."" Arlo, son of famous folksinger Woody Guthrie, wrote the almost 19-minute song after being arrested for littering when he threw out some food. He visits his dying father in the film, and Pete Seeger also makes an appearance. Arlo sings three songs including the title track, and Joni Mitchells ""Songs To Aging Children"" is appropriately played during a funeral scene. Pat Quinn plays Alice, with James Broderick as her husband Ray. Arlos criminal past is exposed when he is rejected for a tour in the U.S. Army because he is a ""degenerate"".",R (adult situations/language),"Classics, Comedy, Science Fiction & Fantasy",Arthur Penn,MGM Home Entertainment,111 minutes,"Arlo Guthrie, Pat Quinn, Patricia Quinn"
278,8639,Colossus: The Forbin Project,N/A,88%,8,75%,2118,"The granddaddy of all ""computer run amok"" films, Colossus: The Forbin Project concerns a huge electronic brain designed to control the American missile defense system. Colossus technicians do not count on the computer developing an intelligence of its own. Communicating with its Russian counterpart, Colossus decides to take over the earth, threatening global destruction should anyone try to pull its plug. The films climax is unsettling, but no more so than the actual state of world affairs in 1970. Colossus: The Forbin Project was filmed in Canada.",R,"Mystery & Suspense, Science Fiction & Fantasy",Joseph Sargent,MCA Universal Home Video,100 minutes,"Eric Braeden, Susan Clark, Gordon Pinsent"
279,8643,Last Summer,N/A,78%,9,76%,530,"A pretty teenage girl comes to the rescue of a dying seagull in Last Summer. Sandy (Barbara Hershey) enlists the help of Peter (Richard Thomas) and Dan (Bruce Davison) to help the bird and remove a fishhook from the gulls throat. The three become friends and they smoke marijuana and swim, discussing their problems about parents and life. Rhoda (Cathy Burns) is the level headed plain looking girl who admonishes the trio for trying to make the injured bird fly. Peter and Dan talk about having sex with Sandy, who engages the shy Rhonda in a game of ""truth or dare"" as the sassy Sandy removes her bikini top. The three hold Rhonda down while she is brutally raped. Ralph Waite plays Peters father, and the two would again play father and son in the 1970s television series ""The Waltons."" Last Summer was rated X at the time of its initial release, but quickly became rated R in the wake of the sexual and cultural revolution sparked in the 1960s.",R,Drama,Frank Perry,Allied Artists,97 minutes,"Richard Thomas, Barbara Hershey, Bruce Davison"
280,8645,The Magic Christian,N/A,59%,17,68%,2652,"This zany British comedy finds a homeless hobo (Ringo Starr) being adopted by the worlds richest man, Sir Guy Grand (Peter Sellers). Setting sail on the luxury liner The Magic Christian, Sir Grand tests the limit of human avarice. With money to motivate the greedy, Laurence Harvey combines his Hamlet soliloquy with a striptease. A vile cesspool of excrement is seeded with cash and the money-hungry dive right in. Wilfred Hyde White is the drunken captain, Yul Brynner is uncredited in his performance as a chanteuse transvestite, and John Cleese is the director of Sothebys auction house. Roman Polanski, Richard Attenborough and Raquel Welch also appear in this offbeat comedy. Paul McCartney wrote and produced ""Come and Get It,"" the first international hit from the power-pop group Badfinger. John ""Speedy"" Keene wrote ""Something In The Air"" and performed the track with his group Thunderclap Newman. Sellers, Cleese, Graham Chapman and Terry Southern co-authored the screenplay taken from Southerns novel. ~ Dan Pavlides, Rovi",PG,"Classics, Comedy",Joseph McGrath,Commonwealth United Entertaime,101 minutes,"Peter Sellers, Ringo Starr, Isabel Jeans"
281,8646,Marlowe,N/A,71%,7,49%,558,"James Garner is so good as Raymond Chandlers philosophical gumshoe Philip Marlowe that you forget hes totally wrong for the part. Based on Chandlers The Little Sister, Marlowe involves the detectives efforts to locate the missing brother of Orfamay Quest (Sharon Farrell). He follows the clues to two men who deny any knowledge of the brothers existence. Since both men soon find themselves on the wrong end of an ice pick, Marlowe deduces that theres more to this caper than a mere missing-person case. The plot thickens as more ""dramatis personae"" are added to the intrigues, including TV star Gayle Hunnicutt, Hunnicutts gangster boyfriend H.M. Wynant and stripper Rita Moreno. A pre-stardom Bruce Lee shows up as a karate-happy thug who lays waste to Marlowes office shortly before suffering a spectacular demise. It is preferable to view Marlowe in videocassette or theatrical form; the commercial TV print cuts so much out that viewers are left with virtually nothing but protection leader and a few close-ups of James Garner.",PG,"Drama, Mystery & Suspense",Paul Bogart,Warner Home Video,95 minutes,"James Garner, Carroll O'Connor, Rita Moreno"
282,8649,Taste the Blood of Dracula,N/A,67%,12,55%,3609,"A Victorian English lord hosts a black-magic ceremony that resurrects Count Dracula in this, the fourth Hammer horror production to feature the notorious vampire. When the lord is killed, the vampire sets out to avenge his death, utilizing the killers own children.",R,"Art House & International, Classics, Drama, Horror, Science Fiction & Fantasy",Peter Sasdy,Warner Home Video,95 minutes,"Christopher Lee, Geoffrey Keen, Gwen Watford"
283,8652,Brewster McCloud,N/A,85%,20,83%,1715,"A boy yearns to fly in Robert Altmans whimsical youthquake parable. With the aid of seraphic Louise (Sally Kellerman), owlish Brewster (Bud Cort) constructs a pair of human-size wings in his Houston Astrodome nest to realize his dream. Meanwhile, conservative creeps, including a witchy ""Star-Spangled Banner""-belting crone (Margaret Hamilton) and Brewsters skinflint boss (Stacy Keach), keep turning up dead covered with bird droppings; the Houston Establishment calls in blue-eyed, turtleneck-wearing ""San Francisco super cop"" Frank Shaft (Michael Murphy) to investigate. Brewster cooks his own goose, however, when he defies Louises edict against sex and hooks up with Astrodome usher Suzanne (Shelley Duvall) after she impresses him (and saves him) by out-driving Shaft in her Road Runner. Despite her apparent sweetness, Suzanne ultimately will not compromise her comfortable home for flight with Brewster.",R,"Comedy, Science Fiction & Fantasy",Robert Altman,MGM,101 minutes,"Bud Cort, Sally Kellerman, Michael Murphy"
284,8658,"Hi, Mom!",N/A,73%,11,56%,3058,"Writer/director Brian DePalmas sequel to his 1968 counter-culture comedy ""Greetings"" is an even wilder attack on the insanity of bourgeois life in modern America. Although the film focuses on an amateur pornographer who tries to turn professional, the highlight is an extended sequence of a white-liberal audience being thoroughly humiliated and abused by the African-American cast of the avant-garde play ""Be Black, Baby!""--which is being broadcast on the ""NIT"" (""National Intellectual Television"") network!",R,"Classics, Comedy",Brian DePalma,Sigma III,87 minutes,"Robert De Niro, Charles Durnham, Jennifer Salt"
285,8659,House of Dark Shadows,N/A,43%,7,70%,920,"This film is based on the popular 1960s TV ""Gothic"" serial Dark Shadows. Vampire Barnabas Collins resides in the spectre-filled Collinswood mansion. Elizabeth Collins Stoddard finds her blood supply depleted by the elusive Barnabas. When Elizabeth dies, she is soon wandering the hallways as one of the ""undead.""",PG,"Drama, Horror, Television, Romance",Dan Curtis,MGM,97 minutes,"Jonathan Frid, Joan Bennett, Roger Davis"
286,8662,On a Clear Day You Can See Forever,N/A,100%,9,75%,3600,"Barbara Streisand como una mujer que pide a su doctor hipnotizarla para que deje de fumar. Yves Montand, Bob Newhart, Larry Blyden, Simon Oakland, Jack Nicholson.",G,"Classics, Comedy, Drama, Musical & Performing Arts, Science Fiction & Fantasy","Vincente Minnelli, Vicente Minelli",Paramount Pictures,129 minutes,"Barbra Streisand, Yves Montand, Bob Newhart"
287,8663,Performance,"Performance is an exuberant and grimy ode to the sexual revolution, evoking cultural upheaval and identity crisis with rock 'n' roll verve and a beguiling turn by Mick Jagger.",85%,34,79%,5178,"This psychological crime thriller finds Chas (James Fox) as a crook on the run from the law. He hides out at the house of Turner (Mick Jagger), a rocker who lives with Pherber (Anita Pallenberg) and Lucy (Michelle Breton). Sexual situations and sadism prompted the original X rating, that was later rescinded to R. Randy Newman conducts the music of Jack Nitzsche for this psychedelic psychodrama.","R (Rated R for sexual content, nudity, drug material and some violence.)","Classics, Drama, Musical & Performing Arts, Special Interest","Nicolas Roeg, Donald Cammell",Warner Bros. Pictures,105 minutes,"Mick Jagger, James Fox, Anita Pallenberg"
288,8667,Zabriskie Point,N/A,64%,28,75%,11105,This is a poetic chronicle of counterculture America.,R,"Action & Adventure, Drama, Romance",Michelangelo Antonioni,MGM,112 minutes,"Mark Frechette, Daria Halprin, Rod Taylor"
289,8668,The Beguiled,"The Beguiled adds just enough extra depth to its source material to set itself apart, and director Sofia Coppola's restrained touch is enlivened by strong performances from the cast.",79%,316,48%,13878,"""The Beguiled"" is an atmospheric thriller from acclaimed writer/director Sofia Coppola. The story unfolds during the Civil War, at a Southern girls boarding school. Its sheltered young women take in an injured enemy soldier. As they provide refuge and tend to his wounds, the house is taken over with sexual tension and dangerous rivalries, and taboos are broken in an unexpected turn of events.",R (for some sexuality),Drama,Sofia Coppola,Focus Features,N/A,"Colin Farrell, Nicole Kidman, Kirsten Dunst"
290,8669,The Devils,"Grimly stylish, Ken Russell's baroque opus is both provocative and persuasive in its contention that the greatest blasphemy is the leveraging of faith for power.",73%,26,89%,3948,"The Devils was the Ken Russell film version of the controversial play by John Whiting. The story, based on Aldous Huxleys The Devils of Loudun, concerns controversial 17th century French priest Urbain Grandier, whose radical political and religious notions and profligate sex life earn him many enemies. When a group of nuns appears to have been ""bewitched"" by Grandier, his rivals feed on the resulting mass hysteria, using this incident as an excuse to have the priest arrested. Refusing to confess to being in league with Satan and to renounce his ""heretical"" views, Grandier undergoes appalling tortures, and is finally burned at the stake. Vanessa Redgrave co-stars as the head nun. Due to censorship issues in virtually every country in which The Devils has been released, running times vary greatly.",R,Drama,Ken Russell,Warner Bros.,109 minutes,"Vanessa Redgrave, Oliver Reed, Dudley Sutton"
291,8673,Johnny Got His Gun,N/A,67%,21,87%,5793,"The author of the famous late 1930s antiwar book Johnny Got His Gun wrote and directed this film adaptation. It concerns a nameless young soldier (Timothy Bottoms) in a veterans hospital in the World War I period. The young man has had his face blown off, he is without the use of any of his senses save touch, and also has no arms or legs. He is in a coma at the beginning of the film, and his doctors doubt that he will regain consciousness. This is also what they hope. A nurse, while changing his dressings, discovers that he is awake and responsive. The unrelieved awfulness of his situation is apparent to many. However, in order to keep the ""good order"" of the military, the regular Army general commanding the hospital will not allow the boy to be seen or his family notified, nor will he permit anyone to perform a mercy killing. Interspersed with this horror are flashbacks of the youths life before the war. ~ Clarke Fountain, Rovi",PG,"Classics, Drama",Dalton Trumbo,Cinemation,100 minutes,"Timothy Bottoms, Kathy Fields, Marsha Hunt"
292,8674,Lawman,N/A,63%,8,61%,1731,"This Michael Winner western stars Burt Lancaster as a marshal who vows justice against a band of killers led by Lee J. Cobb, and who is determined to uphold the law no matter what the cost.",R (for violent content),"Action & Adventure, Classics, Western",Michael Winner,MGM,98 minutes,"Burt Lancaster, Robert Ryan, Lee J. Cobb"
293,8675,Let's Scare Jessica to Death,N/A,22%,9,50%,2392,"This eerie low-budget chiller has recently released mental patient Jessica (Zohra Lampert) moving to a Connecticut farm with her husband and some friends. But a strange girl named Emily is at the farm, too, and it soon becomes obvious that she is somehow related to a young woman who drowned on her wedding day in the 1800s. Is Emily a vampiric ghost? Are the hostile townsfolk all zombies? Or is Jessica losing her mind once again?",PG-13 (for terror/violence and some sensuality),"Classics, Horror, Mystery & Suspense","John D. Hancock, John Hancock",Paramount Pictures,89 minutes,"Zohra Lampert, Barton Heyman, Kevin O'Connor"
294,8680,Von Richthofen and Brown,N/A,50%,6,35%,70,"This film of the wartime exploits of Baron Von Richthoven, who was also known as the ""Red Baron,"" was a relatively lavish Corman-brothers production, and is directed by Roger Corman. The films airborne dogfight sequences are among its most notable features. Vintage World War I airplanes were used, and accidents during filming resulted in one death and several injuries. The evolution of airborne warfare from being a sporting game between gentlemen to its use as an instrument of total war is integral to the story. Von Richthoven (John Phillip Law), who becomes an air ace and an important German hero, was an early aeronautical rival of Hermann Goering (Barry Primus). So important was he to German morale that he was asked to retire from fighting, so that he could assume a position in the post-war German government. He refused, and was killed by a young Canadian (Don Stroud) in an airborne battle. Spookily enough, even though he died in the air, his plane is reputed to have landed intact.",PG,"Action & Adventure, Drama",Roger Corman,MGM,97 minutes,"John Phillip Law, Don Stroud, Barry Primus"
295,8681,Scars of Dracula,N/A,33%,6,43%,3178,"Youd think they would know better from their first glance at the foreboding stone exterior of the blood-sucking Counts castle, but apparently they didnt, for this young couple, who are looking for the young mans missing brother, walks right into Draculas lair. Christopher Lee plays Count Dracula in this gory and violent scare-maker.",R,"Art House & International, Classics, Horror, Mystery & Suspense",Roy Ward Baker,MGM,96 minutes,"Christopher Lee, Dennis Waterman, Jenny Hanley"
296,8682,Support Your Local Gunfighter,N/A,62%,13,60%,4553,"This Western action/comedy is told in the same tongue-in-cheek manner as its predecessor, Support Your Local Sheriff. Goldie (Marie Windsor), a madam, is a formidable woman, and Latigo Smith (James Garner) knows perfectly well that his disreputable ways will be trimmed considerably should she succeed in marrying him. Instead, he escapes from her and winds up in the town of Purgatory. The towns inhabitants have been expecting the arrival of Swifty Morgan (Chuck Connors), the famous gunfighter. All things being equal, Latigo is happy to be mistaken for Morgans sidekick, while Jug May (Jack Elam) impersonates Morgan himself.",G,"Action & Adventure, Classics, Comedy, Western",Burt Kennedy,United Artists,92 minutes,"James Garner, Suzanne Pleshette, Joan Blondell"
297,8683,Sweet Sweetback's Baadasssss Song,N/A,75%,20,48%,3412,"Produced, directed, written, scored by, and starring Melvin Van Peebles, this landmark ""blaxploitation"" film was as controversial as it was popular for its then X-rated story of one African-American mans triumph over the Man. After beating a couple of white cops he witnessed brutalizing a local black revolutionary, sex show performer Sweetback (Van Peebles) has to go on the run. As he flees through decrepit South Central Los Angeles, Sweetback demonstrates his formidable potency through sex as well as violence, evading the police manhunt by any means necessary. As Sweetback runs off into the sunset, however, Van Peebles warns that the story, like the 1960s racial strife, isnt over. ~ Lucia Bozzola, Rovi",R,"Action & Adventure, Classics, Drama, Mystery & Suspense",Melvin Van Peebles,Xenon,97 minutes,"Melvin Van Peebles, Simon Chuckster, Hubert Scales"
298,8688,Dr. Phibes Rises Again,N/A,63%,16,57%,6195,"The sequel to The Abominable Dr. Phibes, this film follows the quest of Dr. Anton Phibes (Vincent Price) to bring his dead wife back to life by retrieving a stolen Egyptian scroll that leads to a life-giving elixir. As Phibes races to obtain the elixir, he must fight off the sinister Biederbeck (Robert Quarry), who wants the potion for himself.","PG (adult situations/language, violence)","Action & Adventure, Art House & International, Classics, Comedy, Cult Movies, Horror, Science Fiction & Fantasy",Robert Fuest,American International Picture,88 minutes,"Vincent Price, Robert Quarry, Valli Kemp"
299,8689,Dracula A.D. 1972,N/A,22%,9,40%,4668,"Hammer Studios attempted to inject new blood into their Dracula series by setting their next installment in ultra-mod 70s London, where the Count is revived after 100 years by a gang of devil-worshipping swingers led by the not-so-cleverly-named Johnny Alucard (Christopher Neame), and later joined by Jessica (Stephanie Beacham), granddaughter of the legendary vampire hunter Dr. Van Helsing (Peter Cushing, returning to the role after more than a decade). After the group manages to resurrect the Count, he sets about the task of destroying the house of Van Helsing once and forever, leading to a battle in a de-sanctified cathedral. Despite some well-staged scenes, a thrilling prologue (involving a tense battle between Lee and Cushing aboard a runaway coach) and the presence of the stunning Caroline Munro, this is definitely one of the weaker entries in the series, and the script gives Lee very little to do with the hissing, red-eyed villain. Lee may have been bored with reprising the role altogether, as he would only return for one more sequel, The Satanic Rites of Dracula. ~ Cavett Binion, Rovi",PG,"Classics, Horror",Alan Gibson,Warner Bros. Pictures,95 minutes,"Stephanie Beacham, Marsha A. Hunt, David Andrews"
300,8694,Lady Sings the Blues,N/A,69%,13,87%,7984,"Diana Ross plays the magnificent, tragic song stylist Billie Holiday, who while writhing in a strait jacket in a prison cell, awaiting sentencing on drug charges, reflects on her turbulent life. Raped in her youth by a drunk (Adolph Caesar), then compelled to work as a domestic in a Harlem whorehouse, Holliday is encouraged to try for a singing career by the bordellos pianist (Richard Pryor). She rises as high as it is possible to go in the white-dominated show business world of the 1930s, but cant handle the pressure and turns to narcotics. The film takes several liberties with the 44-year existence of ""Lady Day."" Among the Billie Holiday standards performed by Ross are ""My Man,"" ""I Cried for You,"" ""Lover Man,"" ""Them There Eyes,"" and the title song.","R (adult situations/language, violence)","Classics, Drama, Musical & Performing Arts",Sidney J. Furie,Paramount Pictures,144 minutes,"Diana Ross, Billy Dee Williams, Richard Pryor"
301,8695,Payday,N/A,60%,5,75%,276,"While all the critics were doing nip-ups over Bruce Beresfords 1983 Tender Mercies, in which Robert Duvall played a burned-out Country & Western star, there were a straggling few who pointed out that much of the same ground had been covered in the 1972 ""sleeper"" Payday. The main difference was that, while Duvall finds redemption, the C&W singer in Payday, played by Rip Torn, starts out a heel and stays there. We follow Torn through 36 hours of a grueling concert tour from one fleapit to another. While there is a measure of pathos in Torns reduced circumstances, its hard to develop any real sympathy for him; after all, no one is forcing all those drugs and groupies on him, nor is anyone twisting his arm to be nasty and vituperative. Torns Oscar-calibre performance is evenly matched by the hand-picked supporting cast, including Michael C. Gwynne, Anna Capri and Elaine Heilveil. Payday is not for the viewer who thinks of Country-Western music only in the glamorized terms of Dolly Parton and Garth Brooks; for those who want more raw meat in their film fare, this little picture is highly recommended.",R,"Classics, Drama",Daryl Duke,Cinerama,102 minutes,"Michael Edwards, Rip Torn, Ahna Capri"
302,8696,Slither,"A slimy, B-movie homage oozing with affection for low-budget horror films, Slither is creepy and funny -- if you've got the stomach for it.",86%,140,63%,102850,"The sleepy town of Wheelsy could be any small town in America -- somewhat quaint and gentle, peopled with friendly folks who mind their own business. But just beneath the surface charm, something unnamed and evil has arrived...and is growing. No one seems to notice as telephone poles become clogged with missing pet flyers, or when one of the towns richest citizens, Grant, begins to act strangely. But when farmers livestock turn up horribly mutilated and a young woman goes missing, Sheriff Bill Pardy and his team, aided by Grants wife Starla, uncover the dark force laying siege to their town...and come face-to-face with an older-than-time organism intent on absorbing and devouring all life on Earth.","R (for strong brutal violence, pervasive language, some drug content and sexuality/nudity)","Comedy, Horror, Science Fiction & Fantasy",James Gunn (II),Universal Pictures,96 minutes,"Nathan Fillion, Elizabeth Banks, Gregg Henry"
303,8699,Charley Varrick,N/A,80%,10,82%,3138,"In this compact, fast-paced action thriller, a bank robber really messes up when he and his avaricious young partner accidentally knock over a Mafia-controlled New Mexico bank. As a result, the two find themselves pursued by a cold-blooded hit man who will not stop until he gets his men.",PG,"Action & Adventure, Drama, Mystery & Suspense",Don Siegel,Universal Pictures,111 minutes,"Walter Matthau, Joe Don Baker, Felicia Farr"
