,dataIndex,realTitle,criticsConcensus,tomatoMeter,tomatoCount,audienceScore,audienceCount,realSynopsis,rating,genreString,directedBy,studio,runTime,cast
58,44632,Atomic Blonde,Atomic Blonde gets enough mileage out of its stylish action sequences -- and ever-magnetic star -- to make up for a narrative that's somewhat less hard-hitting than its protagonist.,78%,344,64%,34429,"A high-stakes, global action-thriller that takes place in the city of Berlin, on the eve of the Walls collapse and the shifting of superpower alliances. Charlize Theron (""Mad Max: Fury Road"") portrays Lorraine Broughton, a top-level spy for MI6, who is dispatched to Berlin to take down a ruthless espionage ring that has just killed an undercover agent for reasons unknown. She is ordered to cooperate with Berlin station chief David Percival (James McAvoy of ""X-Men""), and the two form an uneasy alliance, unleashing their full arsenal of skills in pursuing a threat that jeopardizes the Wests entire intelligence operation.","R (for sequences of strong violence, language throughout, and some sexuality/nudity)","Action & Adventure, Drama, Mystery & Suspense",David Leitch,Focus Features,115 minutes,"Charlize Theron, James McAvoy, John Goodman"
59,44658,Aaron's Blood,N/A,60%,5,29%,32,"Aaron copes with his new life as a single father and the distant relationship he shares with his only child Tate. A timid hemophiliac, Tate is roughed up at school by the chief bully causing a massive nosebleed that lands him in the hospital fighting for his life. He makes a miraculous recovery after a necessary blood transfusion, but Aaron begins to notice progressively strange behaviors in his son. Faced with the grim possibility that his son could be becoming a vampire, Aaron enlists the help of a local vampire hunter and embarks on a frantic search to find the source of the infection to stop the transformation before its too late.",NR,"Horror, Mystery & Suspense",Tommy Stovall,Pasidg Productions Inc.,80 minutes,"James Martinez, Trevor Stovall, Farah White"
60,44662,Saving Banksy,N/A,100%,13,81%,493,"""Saving Banksy"" is the story of one misguided art collectors attempts to save a Banksy painting from destruction and the auction block. Featuring some of the worlds top street artists, this film poses the question ""What would you do if you owned a million dollar painting that the artist doesnt want sold?""",NR,Documentary,Colin M. Day,Parade Deck Films,80 minutes,"Anthony Lister, Ben Eine, Blek Le Rat"
61,44663,The Exception (The Kaiser's Last Kiss),The Exception (The Kaiser's Last Kiss) elegantly blends well-dressed period romance and war drama into a solidly crafted story further elevated by Christopher Plummer's excellent work and the efforts of a talented supporting cast.,75%,56,67%,3490,"A riveting World War II thriller that is filled with espionage and romance in equal measure, The Exception follows German soldier Stefan Brandt (Jai Courtney) as he goes on a mission to investigate exiled German Monarch Kaiser Wilhelm II (Christopher Plummer). The Kaiser lives in a secluded mansion in The Netherlands, and as Germany is taking over Holland, the countrys authorities are concerned that Dutch spies may be watching the Kaiser. As Brandt begins to infiltrate the Kaisers life in search of clues, he finds himself drawn into an unexpected and passionate romance with Mieke (Lily James), one of the Kaisers maids whom Brandt soon discovers is secretly Jewish. When Heinrich Himmler (Eddie Marsan), Head of the SS, decides to come for an unexpected visit with a large platoon of Nazis in tow, the stage is set for a breathtaking showdown, as secrets are revealed, allegiances are tested, and Brandt is forced to make the ultimate choice between honoring his country and following his heart.","R (for sexuality, graphic nudity, language and brief violence)","Art House & International, Drama",David Leveaux,A24 and DIRECTV,107 minutes,"Lily James, Jai Courtney, Eddie Marsan"
62,44666,Out of Time,A fun and stylish thriller if you can get past the contrivances.,64%,149,58%,58805,"Director Carl Franklin and actor Denzel Washington team up again (following 1995s Devil in a Blue Dress) for the crime thriller Out of Time. Washington stars as Matt Lee Whitlock, the well-respected chief of police in a quiet Florida community. While in the process of getting a divorce from fellow detective Alexandra (Eva Mendez), Matt engages in an affair with his high school sweetheart Anne (Sanaa Lathan). Unfortunately, Anne is married to the extremely jealous Chris (Dean Cain), a former pro football player who works as a security guard. After a major murder occurs in the community, Matt finds himself the main suspect. With the help of his medical examiner pal Chae (John Billingsley), Matt must solve the case before he is found guilty himself. Out of Time premiered at the 2003 Toronto Film Festival.","PG-13 (for sexual content, violence and some language)","Action & Adventure, Drama, Mystery & Suspense",Carl Franklin,MGM/UA,114 minutes,"Denzel Washington, Eva Mendes, Sanaa Lathan"
63,44674,Goon: Last of the Enforcers,"Seann William Scott remains as watchable as ever in the title role, but Goon: Last of the Enforcers repeats its predecessor's violent and profane formula to diminishing effect.",42%,59,41%,3491,"After one too many injuries, hockey enforcer Doug Glatt (Seann William Scott) is forced to give up his aspirations of going to the big show and settle into a buttoned down career as an insurance salesman at the urging of his pregnant wife Eva (Alison Pill). However, Doug cant resist the siren call of the Highlanders, so he sets course to reclaim his former glory.","R (for pervasive language, crude sexual content and bloody sports violence)",Comedy,Jay Baruchel,Momentum Pictures,N/A,"Seann William Scott, Alison Pill, Marc-Andre Grondin"
64,44678,Dunkirk,"Dunkirk serves up emotionally satisfying spectacle, delivered by a writer-director in full command of his craft and brought to life by a gifted ensemble cast that honors the fact-based story.",93%,442,81%,67964,"Acclaimed auteur Christopher Nolan directs this World War II thriller about the evacuation of Allied troops from the French city of Dunkirk before Nazi forces can take hold. Tom Hardy, Kenneth Branagh and Mark Rylance co-star, with longtime Nolan collaborator Hans Zimmer providing the score.",PG-13 (for intense war experience and some language),"Action & Adventure, Drama",Christopher Nolan,Warner Bros. Pictures,107 minutes,"Fionn Whitehead, Tom Glynn-Carney, Jack Lowden"
