,dataIndex,realTitle,criticsConcensus,tomatoMeter,tomatoCount,audienceScore,audienceCount,realSynopsis,rating,genreString,directedBy,studio,runTime,cast
0,44009,Despicable Me 3,Despicable Me 3 should keep fans of the franchise consistently entertained with another round of colorful animation and zany -- albeit somewhat scattershot -- humor.,58%,190,54%,78514,"Illumination, who brought audiences Despicable Me and the biggest animated hits of 2013 and 2015, Despicable Me 2 and Minions, continues the adventures of Gru, Lucy, their adorable daughters-Margo, Edith and Agnes-and the Minions in Despicable Me 3. Directed by Pierre Coffin and Kyle Balda, co-directed by Eric Guillon and written by Cinco Paul & Ken Daurio, the animated film is produced by Illuminations Chris Meledandri and Janet Healy, and executive produced by Chris Renaud. Joining Steve Carell and Kristen Wiig in Despicable Me 3 is Emmy, Tony and Grammy Award winner Trey Parker, co-creator of Comedy Centrals global phenomenon South Park and the Broadway smash The Book of Mormon. Parker voices the role of villain Balthazar Bratt, a former child star whos grown up to become obsessed with the character he played in the 80s, and proves to be Grus most formidable nemesis to date. The film will be released in theaters on June 30, 2017.",PG (for action and rude humor),"Animation, Comedy, Kids & Family","Kyle Balda, Pierre Coffin, Eric Guillon",Universal Pictures,90 minutes,"Steve Carell, Kristen Wiig, Trey Parker"
1,44020,We Are X,N/A,81%,26,87%,328,"From the production team behind the Oscar winning Searching for Sugar Man comes We Are X, a transcendent rock & roll story about X Japan, the worlds biggest and most successful band youve never heard of...yet. Under the enigmatic direction of drummer, pianist, composer, and producer Yoshiki, X Japan has sold over 30 million singles and albums combined--captivating such a wide range of admirers as Sir George Martin, KISS, Stan Lee, and even the Japanese Emperor--and pioneered a spectacle-driven style of visual rock, creating a one-of-a-kind cultural phenomenon. Chronicling the bands exhilarating, tumultuous and unimaginable history over the past three decades--persevering through personal, physical and spiritual heartache--the film culminates with preparations for their breathtaking reunion concert at New Yorks legendary Madison Square Garden. Directed by acclaimed documentarian Stephen Kijak (Stones in Exile, Scott Walker: 30 Century Man), We Are X is an astonishingly intimate portrait of a deeply haunted--but truly unstoppable--virtuoso and the music that has enthralled legions of the worlds most devoted fans.",R (for some language),Documentary,Stephen Kijak,Passion Pictures,95 minutes,"X (Japan), Yoshiki, Toshi"
2,44021,Rock Dog,"Rock Dog is amiable enough, but its second-tier animation and uninspired story add up to a movie whose meager charms are likely to escape all but the youngest and least demanding viewers.",47%,57,47%,3030,"For the Tibetan Mastiffs living on Snow Mountain, a dogs life has a simple riff: Guard a peaceful village of wool-making sheep from the thuggish wolf Linnux (Lewis Black) and his rabid pack. To avoid distractions, Mastiff leader Khampa (J.K. Simmons) forbids all music from the mountain. But when Khampas son Bodi (Luke Wilson) discovers a radio dropped by a passing airplane, it takes just a few guitar licks for his fate to be sealed: Bodi wants to be a rock n roll star. Yet that means defying his fathers wishes, heading to the city, and locating the legendary - and reclusive - musician Angus Scattergood (Eddie Izzard), who needs to write a new song and fast. If Bodi can put a band together, help Angus with his song, and defeat the wolves plot to take Snow Mountain, his life will be in tune. Bodi will become what hes always dreamed of being: More than a dog ... more than a Rock God... hell be a ROCK DOG!",PG (for action and language),"Animation, Comedy, Kids & Family",Ash Brannon,Summit Premiere,80 minutes,"J.K. Simmons, Luke Wilson, Eddie Izzard"
3,44035,The Levelling,N/A,94%,34,59%,450,"Somerset, England. Trainee veterinarian Clover Catto returns to the farm where she grew up after hearing news that her brother Harry has died in what appears to be a suicide. Finding the family home in a state of horrendous disrepair following the 2014 floods that devastated the area, Clover is forced to confront her father Aubrey about the farm, the livestock and, crucially, the details surrounding Harrys death. Clovers discoveries send her on an emotional journey of reckoning with her family, her childhood and herself.",R (for language and brief nudity),Drama,Hope Dickson Leach,Wellington Films,83 minutes,"Ellie Kendrick, David Troughton, Jack Holden"
4,44042,Tracktown,N/A,73%,15,47%,112,"Plumb Marigold (Alexi Pappas) is a famous but lonely distance runner preparing for the biggest race of her life: The Olympic Trials. But when an injury forces her to take an unexpected day off, Plumb wanders into a bakery where the aimless boy behind the counter catches her eye. In this story that captures the experience of a young Olympic hopeful, many of the actors are actual Olympic athletes -- including co-writer/director and lead actor Pappas.",NR,Drama,"Alexi Pappas, Jeremy Teicher",Orion Pictures & Samuel Goldwyn Films,89 minutes,"Chase Offerle, Rachel Dratch, Andy Buckley (II)"
5,44061,King Charles III,N/A,100%,9,45%,68,"An adaptation of the Broadway drama about Prince Charles ascension to the throne following the death of his mother, Queen Elizabeth II.",NR,Drama,Rupert Goold,N/A,88 minutes,"Oliver Chris, Richard Goulding, Charlotte Riley"
6,44083,Dead Awake,N/A,20%,10,18%,190,"From the creator of the iconic FINAL DESTINATION franchise comes the paralyzing thriller DEAD AWAKE. Kate Bowman (Jocelin Donahue) is a straight-laced social worker who finds herself plunged into a world of supernatural terror while investigating a series of mysterious deaths. Each victim suffered from a chilling condition known as sleep paralysis, a nightmarish assault on the senses that immobilizes its victims as they dream. As a terrifying entity begins to haunt Kates friends and loved ones, she must fight to stay awake to stop the nightmare shes unleashed!",NR,"Horror, Mystery & Suspense",Phillip Guzman,FilmRise,99 minutes,"Jocelin Donahue, Jesse Bradford, Lori Petty"
7,44128,A Family Man,"A Family Man has some worthy ideas, but they're bungled in a middle-of-the-road melodrama populated by thinly sketched -- and occasionally downright unlikeable -- characters.",13%,24,60%,768,"A Chicago personnel recruiter (Gerald Butler) is hungry to stay on top of his competitive profession, but when his son (Max Jenkins) is diagnosed with cancer, his priorities are called into question.",R (for language and some sexual content),Drama,Mark Williams (V),Vertical Entertainment,108 minutes,"Gerard Butler, Alison Brie, Willem Dafoe"
8,44129,Paris Can Wait (Bonjour Anne),Paris Can Wait's likable stars are ill-served by a film that lacks interesting ideas or characters and has little to offer beyond striking travelogue visuals.,47%,111,39%,2803,"When her director husband is occupied with work in Paris, an American woman takes a jaunt with his business associate, a charming Gallic rogue who is happy to squire her on a tour of some of the finest meals in Provence. The first feature directed by Eleanor Coppola, wife of Francis and director of the ""Apocalypse Now"" documentary ""Hearts of Darkness"".","PG (for thematic elements, smoking and some language)","Comedy, Romance",Eleanor Coppola,Sony Pictures Classics,92 minutes,"Diane Lane, Alec Baldwin, Arnaud Viard"
9,44130,The Wizard of Lies,"The Wizard of Lies doesn't really shed much new light on its fact-based story, but thanks to solid direction and a talented cast, it still proves consistently watchable.",74%,46,63%,1723,"Adaptation of journalist Diana B. Henriques account of financier Bernie Madoffs orchestration of one of the largest frauds in U.S. history that led to financial ruin for thousands of investors and, in the process, his own familys destruction.",NR,Drama,Barry Levinson,Tribeca Productions,133 minutes,"Robert De Niro, Michelle Pfeiffer, Alessandro Nivola"
10,44144,Longitude,N/A,80%,5,84%,505,"An outgrowth of a 1999 BBC documentary, the two-part British miniseries Longitude goes out on a creative limb by unfolding two parallel stories, each separated from the other by some 200 years. In one of the plot lines, Michael Gambon (who won one of the series many BAFTA awards) stars as real-life 18th century clockmaker John Harrison, whose invention of a ""marine chronometer"" would ultimately serve as the primary navigational guide for sailors of his era -- but not without a lot of sacrifice and frustration on Harrisons part. The second continuity takes place in the immediate post-WWI era, as Royal Navy officer (and shellshocked war veteran) Rupert Gould (Jeremy Irons) battles bureaucracy and ignorance to reinstate Harrisons longitudinal clocks for modern-day Naval use. As the action hopscotches between the two story lines, Harrison painstakingly assembles his chronometer and attempts to promote the device to the unresponsive powers-that-be, while Gould tries to carry on Harrisons work without losing his sanity in the process. Based on the book by Dava Sobel, Longitude was originally telecast over Britains Channel 4 on January 2 and 3, 2000, then was seen in America courtesy of the A&E cable network.",NR,"Action & Adventure, Drama, Television",Charles Sturridge,A & E,200 minutes,"Michael Gambon, Jeremy Irons, Ian Hart"
11,44162,The Beyond (...E tu vivrai nel terrore! L'aldilà),N/A,67%,21,76%,8759,"A young woman inherits an old hotel in Louisiana where after a series of supernatural accidents, she learns that the building was built over one of the entrances to Hell.",R,"Drama, Horror",Lucio Fulci,Rolling Thunder,88 minutes,"Catriona MacColl, David Warbeck, Cinzia Monreale"
12,44168,The Program,N/A,43%,21,80%,12015,"Eastern State University isnt particularly notable for anything except its football program. Lately, even that hasnt been doing too well, and the athletic staff led by Coach Winters (James Caan) are under considerable pressure by the administration and alumni to bring in a winning season. To do that, he has to recruit some able, promising young players out of high school. Its not too surprising to learn that he will do almost anything to get these kids, and its even less surprising that, as long as they keep producing on the field, he and the college will overlook almost any obnoxious behavior the boys can perpetrate to the limit of their ability.",R,"Action & Adventure, Drama",David S. Ward,Buena Vista,117 minutes,"James Caan, Halle Berry, Omar Epps"
13,44183,My Breakfast with Blassie,N/A,67%,9,67%,62,"Featuring an ultra low budget and a three-day shoot, the story concerns a wrestler (Fred Blassie) and his apprentice (Andy Kaufman) improvising dialogue and anecdotes over breakfast at a southern California diner. The film was intended as a spoof on My Dinner with Andre.",NR,"Comedy, Documentary","Linda Lautrec, Johnny Legend",Artist Endeavours,60 minutes,"Andy Kaufman, Freddie Blassie, Fred Blassie"
14,44189,Hair High,"Hair High isn't first-tier Plympton, but like the rest of the animator's work, this is an assuredly odd tale that should resonate with fans of strange cinema.",75%,20,72%,152,"As the prom draws near and the popular head cheerleader of Echo Lake High dumps her star quarterback boyfriend in favor of attending the dance with the biggest loser in school, the raging footballer plots murderous revenge in cult animation icon Bill Plymptons darkly satirical take on the teen tragedy radio hits and high-school melodramas of the 1950s and 60s. High-school sweethearts Cherri (Sarah Silverman) and Rod (Dermot Mulroney) are a match made in popularity heaven. When nerdy new student Spud (Eric Gilliland) makes the fateful mistake of offending both Cherri and Rod on his first day at Echo Lake High, his punishment is to serve as Cherris ""slave"" until both she and her brutish boyfriend decree that he has made up for his unintentional transgression. Though the mere sight of Spud at first makes Cherris skin crawl, the unlikely pair soon grow exceptionally close until, one day, love blossoms between them. Upon learning that his onetime sweetheart will now be attending the prom on the arm of the socially awkward Spud, Rod angrily forces their car off of the road on and into the icy waters of Echo Lake as the couple makes their way to the big dance. Though cunningly successful in thwarting attempts made by local authorities to locate the missing teens, Rod soon discovers that sometimes the dead have a curious way of exposing the crimes of their killers.",G,"Animation, Comedy, Horror, Romance",Bill Plympton,Plymptoons,78 minutes,"Dermot Mulroney, Zak Orth, Sarah Silverman"
15,44238,Kitten with a Whip,N/A,67%,9,34%,182,"In this exploitation film, a sadistic juvenile delinquent stabs a matron and sets fire to the reformatory where she has been staying. After busting out, she heads to the house of an aspiring politician. The voluptuous fugitive is difficult to resist, and soon she is busily destroying the mans life.",NR,"Action & Adventure, Classics, Drama, Mystery & Suspense",Douglas Heyes,Universal,83 minutes,"John Forsythe, Ann-Margret, Peter Brown"
16,44249,I Was a Teenage Werewolf,N/A,40%,10,18%,988,"I Was a Teenage Werewolf is a B-level cheapie that can most easily be summed up as a cross between The Wolf Man and Rebel Without a Cause. Michael Landon stars as Tony, a hot-headed teenager whose lightning-quick temper has led to social troubles and created concern from his father, his girlfriend Arlene (Yvonne Lime), and local lawman Detective Donovan (Barney Phillips). After belting his buddy Vic (Ken Miller) for no reason, Tony agrees to see Dr. Brandon (Whit Bissell), a psychologist who uses hypnosis to help his patients. In reality, Brandon is a mad scientist who has designs on regressing Tony to his most primal state using drugs and hypnosis. Not long after Tonys first session, a teen is killed by what the police believe is some kind of animal, but when Tony transforms in front of Arlene at their school, the truth comes to light: Tony is a werewolf. With the townsfolk paralyzed by fear, the police organize a manhunt, which the werewolf manages to evade. After returning to his human state, Tony heads back to the treacherous Dr. Brandon. The shrinks desire to witness Tony in his primal ""werewolf"" condition goes awry when the frothing Tony goes mad, leading to a violent conclusion.",NR,"Drama, Horror, Science Fiction & Fantasy","Gene Fowler Jr., Gene Fowler",American International Pictures,70 minutes,"Michael Landon, Yvonne Lime, Whit Bissell"
17,44264,Soultaker,N/A,0%,5,29%,1386,"Two young people brought to the edge of death find themselves dragged back by a mysterious stranger in this horror story. When four teenagers are seriously injured in an auto accident, a spectral man dressed in black (Joe Estevez) arrives to claim their souls. But it seems that the Soultaker has arrived too soon; as he tries to draw their spirits from their bodies, it becomes evident that two of the kids, Natalie (Vivian Schilling) and Zach (Gregg Thomsen), arent actually dead, but merely comatose and will soon recover. The Soultaker is determined to claim four souls, no matter how many have actually passed on, and he finds himself locked in a desperate struggle to take the other two victims with him, whether they like it or not. Vivian Schilling, who plays the female lead in Soultaker, also wrote the films screenplay.",PG-13,"Horror, Science Fiction & Fantasy",Michael Rissi,Victory Pictures Corporation,94 minutes,"Joe Estevez, Vivian Schilling, Gregg Thomsen"
18,44270,Kill Switch,N/A,10%,21,20%,881,"Acclaimed writer-director Tim Smit explodes on to the scene with his futuristic, VFX-heavy feature debut! KILL SWITCH charts the story of a pilot battling to save his family and the planet, based on Smits short Whats In The Box? Set in a future version of the world, the video game style plot follows an experiment for unlimited energy, harnessing parallel universes, which goes wrong. Chased by drones and soldiers, pilot and physicist Will Porter must race through an imploding world to get the Redivider box to a tower, which will save humanity, including his family, in the real world.",R (for language and some violence),"Drama, Science Fiction & Fantasy",Tim Smit,Filmnation/Saban,91 minutes,"Dan Stevens (IV), Bérénice Marlohe, Tygo Gernandt"
19,44271,The Bad Batch,"The Bad Batch has its moments, but it's too thinly written and self-indulgent to justify its length or compensate for its slow narrative drift.",47%,96,31%,2804,"The aforementioned girl is Arlen, (Suki Waterhouse), one of thousands of Americans deemed unacceptable to society, who is unceremoniously dumped into a hostile desert wasteland fenced off from civilized society. While wandering in her desert exile, she is captured by a savage band of cannibals and quickly realizes shell have to fight for her very existence in this human-eat-human world. With electrifying visuals, a score to die for and a stellar cast, Amirpour has created another cinematic chapter that is as uncategorizable as her first.","R (for violence, language, some drug content and brief nudity)",Drama,Ana Lily Amirpour,NEON,115 minutes,"Suki Waterhouse, Jason Momoa, Giovanni Ribisi"
20,44274,War for the Planet of the Apes,"War for the Planet of the Apes combines breathtaking special effects and a powerful, poignant narrative to conclude this rebooted trilogy on a powerful -- and truly blockbuster -- note.",94%,346,84%,56736,"In War for the Planet of the Apes, the third chapter of the critically acclaimed blockbuster franchise, Caesar and his apes are forced into a deadly conflict with an army of humans led by a ruthless Colonel. After the apes suffer unimaginable losses, Caesar wrestles with his darker instincts and begins his own mythic quest to avenge his kind. As the journey finally brings them face to face, Caesar and the Colonel are pitted against each other in an epic battle that will determine the fate of both their species and the future of the planet.","PG-13 (for sequences of sci-fi violence and action, thematic elements, and some disturbing images)","Action & Adventure, Drama, Science Fiction & Fantasy",Matt Reeves,20th Century Fox,140 minutes,"Andy Serkis, Woody Harrelson, Steve Zahn"
21,44279,Chronically Metropolitan,N/A,40%,10,39%,48,"A young writer from New York City (Shiloh Fernandez) returns home and tries to reconnect with his estranged ex-girlfriend (Ashley Benson), only to discover that shes engaged to someone else. To make matters worse, she still hasnt forgiven him for writing a short story based on her parents failed marriage. Meanwhile, his parents (Chris Noth and Mary-Louise Parker) are facing problems of their own. Xavier Manrique directed this comedy-drama, which co-stars Addison Timlin and Josh Peck.",NR,"Comedy, Drama",Xavier Manrique,The Film Community,90 minutes,"Shiloh Fernandez, Ashley Benson, Josh Peck"
22,44280,Sophie and the Rising Sun,N/A,64%,11,59%,146,"Set in the autumn of 1941 in Salty Creek, a willowy fishing village in South Carolina, the film tells the compelling story of two interracial lovers, Sophie, an artist who also fishes and sells crabs to the townfolk, the other an Asian gentleman, swept up in the tides of history. As World War II rages in Europe, Mr. Ohta, appears in the town badly beaten and under mysterious circumstances. Sophie, a native of Salty Creek, quickly becomes transfixed by Mr. Ohta and a friendship born of their mutual love of art blossoms into a delicate and forbidden courtship. As their secret relationship evolves the war escalates tragically. And when Pearl Harbor is bombed, a surge of misguided patriotism, bigotry and violence sweeps through the town, threatening Mr. Ohtas life. A trio of women, each with her own secrets - Sophie, along with the town matriarch and her housekeeper - rejects law and propriety, risking their lives with their actions.",R (for some sexuality and nudity),Drama,Maggie Greenwald,Monterey Media,105 minutes,"Julianne Nicholson, Takashi Yamaguchi, Margo Martindale"
23,44282,Kidnap,Kidnap strays into poorly scripted exploitation too often to take advantage of its pulpy premise -- or the still-impressive talents of its committed star.,38%,87,50%,13827,"A typical afternoon in the park turns into a nightmare for single mom Karla Dyson (Academy Award winner Halle Berry) when her son suddenly disappears. Without a cell phone and knowing she has no time to wait for police help, Karla jumps in her own car and sets off in pursuit of the kidnappers. A relentless, edge-of-your seat chase ensues, where Karla must risk everything to not lose sight of her son. In this tense, action-fueled thriller, directed by Luis Prieto and from the producers of SALT and TRANSFORMERS, one mothers heroic attempt to take back her son leads her to ask herself how far she will go to save her child.",R (for violence and peril),"Action & Adventure, Drama, Mystery & Suspense",Luis Prieto,Aviron Pictures,82 minutes,"Halle Berry, Sage Correa, Chris McGinn"
24,44294,Never So Few,N/A,40%,5,33%,1439,"In this gritty war drama, a philosophical American commander (Frank Sinatra) enlists the aid of Burmese jungle fighters to help him and his dwindling number of troops rally against the Japanese. The story is based on a Tom T. Chamales novel.",NR,"Action & Adventure, Classics, Drama",John Sturges,MGM Home Entertainment,124 minutes,"Frank Sinatra, Gina Lollobrigida, Peter Lawford"
25,44296,Neither Wolf Nor Dog,N/A,82%,17,95%,269,"A white author is summoned by a Lakota Elder who asks him to write a book about his perspective. After a blundering false start, he is all but kidnapped and sucked into a road trip through the heart of the contemporary Native American landscape.",NR,Drama,Steven Lewis Simpson,Inyo Entertainment,110 minutes,"Chief Dave Beautiful Bald Eagle, Christopher Sweeney, Richard Ray Whitman"
26,44301,How to Talk to Girls at Parties,"How to Talk to Girls at Parties has energy and ambition, but is ultimately too unfocused to do much with either -- or develop its themes into a cohesive whole.",47%,92,38%,748,"From the raucous dual imaginations of fantasy laureate Neil Gaiman (""American Gods,"" CORALINE) and glamrock multihyphenate John Cameron Mitchell (HEDWIG AND THE ANGRY INCH, SHORTBUS) comes the electrifying and singular pop extravaganza film, HOW TO TALK TO GIRLS AT PARTIES. Enn (Alex Sharp) is a shy suburban London teenager in 1977, sneaking out with his best friends to afterhours punk parties. One night they stumble upon a bizarre gathering of sexy teenagers who seem like they are from another planet. In fact, they are from another planet, visiting Earth to complete a mysterious rite of passage. That doesnt stop Enn from falling madly in love with Zan (Elle Fanning), a beautiful and rebellious alien teenager who, despite her allegiance to her strange colony, is fascinated by Enn. Together they embark on a delirious adventure through the kinetic punk rock world of 1970s London, inadvertently setting off a series of events that will lead to the ultimate showdown of punks vs. aliens, and test the limits of how far each of them will go for true love.","R (for language throughout, sexual content, some drug use and nudity)","Comedy, Science Fiction & Fantasy",John Cameron Mitchell,A24,102 minutes,"Elle Fanning, Nicole Kidman, Ruth Wilson"
27,44302,The Meyerowitz Stories (New and Selected),The Meyerowitz Stories (New and Selected) observes the family dynamic through writer-director Noah Baumbach's bittersweet lens and the impressive efforts of a remarkable cast.,93%,178,72%,5390,"The Meyerowitz Stories (New and Selected) stars Adam Sandler, Ben Stiller, Dustin Hoffman, Elizabeth Marvel, Grace Van Patten and Emma Thompson, and is the intergenerational tale of adult siblings contending with the influence of their aging father.",NR,"Comedy, Drama",Noah Baumbach,Netflix,N/A,"Adam Sandler, Ben Stiller, Dustin Hoffman"
28,44313,Hangar 10,N/A,14%,7,17%,130,"In this found-footage horror film, a group of researchers investigating the location of an alleged UFO sighting in Rendlesham Forest, England get more than they bargained for.",NR,"Horror, Mystery & Suspense, Science Fiction & Fantasy",Daniel Simpson,Newscope Films,83 minutes,"Robert Curtis, Abbie Salt, Danny Shayler"
29,44318,Becoming Bond,"Becoming Bond is an uproarious recreation of George Lazenby's colorful stint as Britain's greatest spy, evidencing that the gregarious Australian may be a greater raconteur than he was a 00.",76%,17,87%,105,"A unique documentary/narrative hybrid chronicling the stranger-than-fiction true story of George Lazenby, a poor Australian car mechanic who, through an unbelievable set of circumstances, landed the role of James Bond in ""On Her Majestys Secret Service"" (1969), despite having never acted a day in his life. Then after being offered the next six Bond films and a $1 million signing bonus, he turned it all down...",NR,"Comedy, Documentary",Josh Greenbaum,Hulu,92 minutes,"Josh Lawson, Kassandra Clementi, Jake Johnson (XVI)"
