,dataIndex,realTitle,criticsConcensus,tomatoMeter,tomatoCount,audienceScore,audienceCount,realSynopsis,rating,genreString,directedBy,studio,runTime,cast
30,44320,The Prisoner of Second Avenue,N/A,57%,7,66%,1079,"A lesser but still entertaining Neil Simon work, +The Prisoner of Second Avenue was adapted to film in 1974. Jack Lemmon takes over the role played on Broadway by Peter Falk: Mel is a New York-based advertising man who goes through hell when he loses his job. The gods seem to conspire against him as he tries to cope with his unemployed status; he is particularly depressed over the fact that he must now subsist on the income of his wife (Anne Bancroft). There are laughs in The Prisoner of Second Avenue, but its the laughter of desperation and despair; it might not be advisable to watch this film after a bad day at the office. Watch for Sylvester Stallone as the ""human punch line"" of an old urban legend about a pickpocket.",PG,"Classics, Comedy",Melvin Frank,Warner Home Video,98 minutes,"Jack Lemmon, Anne Bancroft, Gene Saks"
31,44326,Best Worst Thing That Ever Could Have Happened...,N/A,94%,18,77%,433,"Stephen Sondheim, Harold Prince, and George Furths much ballyhooed reverse chronology musical Merrily We Roll Along closed after just 16 performances in 1981 but gradually assumed legend status. This alternately heartbreaking and euphoric film focuses on the original cast members, then and now, and the special place this experience holds in their memories.",NR,Documentary,Lonny Price,Atlas Media Corporation,95 minutes,"Stephen Sondheim, Harold PrinceHarold Prince"
32,44330,Wakefield,"Thanks to a committed, powerhouse performance by Bryan Cranston, Wakefield is a fascinating character study of a decidedly unpleasant character.",74%,68,52%,6871,"In Robin Swicords adaptation of E.L. Doctorows short story, successful suburbanite commuter Howard Wakefield (Bryan Cranston) takes a perverse detour from family life: He vanishes without a trace. Hidden in the attic of his carriage house garage, surviving by scavenging at night, Howard secretly observes the lives of his wife (Jennifer Garner) and children and neighbors. WAKEFIELD becomes a fraught meditation on marriage and identity, as Howard slowly realizes that he has not in fact left his family, he has left himself.",R (for some sexual material and language),Drama,Robin Swicord,IFC Films,106 minutes,"Bryan Cranston, Jennifer Garner, Beverly D'Angelo"
33,44336,Whitney: Can I Be Me,"Whitney: Can I Be Me offers a sobering inside look at the tragic downfall of a brilliant performer, even as it leaves the audience yearning for deeper insight.",87%,76,63%,394,The life and career of Whitney Houston is explored.,NR,Documentary,"Nick Broomfield, Rudi Dolezal",Lafayette Films,103 minutes,"Whitney Houston, Bobby Brown, Bobbi Kristina Brown"
34,44337,Valerian and the City of a Thousand Planets,Valerian and the City of a Thousand Planets uses sheer kinetic energy and visual thrills to overcome narrative obstacles and offer a viewing experience whose surreal pleasures often outweigh its flaws.,47%,284,53%,27665,"VALERIAN AND THE CITY OF A THOUSAND PLANETS is the visually spectacular new adventure film from Luc Besson, the legendary director of The Professional, The Fifth Element and Lucy, based on the ground-breaking comic book series which inspired a generation of artists, writers and filmmakers. In the 28th century, Valerian (Dane DeHaan) and Laureline (Cara Delevingne) are a team of special operatives charged with maintaining order throughout the human territories. Under assignment from the Minister of Defense, the two embark on a mission to the astonishing city of Alpha-an ever-expanding metropolis where species from all over the universe have converged over centuries to share knowledge, intelligence and cultures with each other. There is a mystery at the center of Alpha, a dark force which threatens the peaceful existence of the City of a Thousand Planets, and Valerian and Laureline must race to identify the marauding menace and safeguard not just Alpha, but the future of the universe.","PG-13 (for sci-fi violence and action, suggestive material and brief language)","Action & Adventure, Drama, Science Fiction & Fantasy",Luc Besson,EuropaCorp / STXfilms,137 minutes,"Dane DeHaan, Cara Delevingne, Clive Owen"
35,44344,The Gracefield Incident,N/A,11%,9,15%,219,"Matthew Donovan, a video game editor, embeds an iPhone camera into his prosthetic eye to secretly record and document a weekend with friends in a luxurious mountain top cabin. The weekend takes a terrifying turn when a meteorite crashes the party forcing everyone to face the darkest, screaming nightmare while somehow connecting life, love, and loss in a twist of fear.","PG-13 (for sci-fi action/terror, accident images, language and some suggestive material)","Action & Adventure, Drama, Science Fiction & Fantasy",Mathieu Ratthe,Momentum Pictures,89 minutes,"Mathieu Ratthe, Kimberly Laferrière, Victor Andres Turgeon-Trelles"
36,44348,Long Strange Trip: The Untold Story of The Grateful Dead,"Like the Grateful Dead's best music, this documentary justifies its expansive running time -- and offers audiences a Long Strange Trip that's well worth taking.",100%,31,91%,1078,"The 30-year odyssey of the Grateful Dead was the most unlikely success story in rock n roll history. Famously averse to publicity and seemingly incapable of recording radio-friendly hits, they flouted music-industry convention by giving their live music away to a global network of tape traders and becoming the highest-grossing concert act in America through word of mouth alone. Directed by Amir Bar-Lev (The Tillman Story) and executive produced by Martin Scorsese (The Last Waltz), Long Strange Trip is the first full-length documentary to explore the fiercely independent vision, perpetual innovation, and uncompromising commitment to their audience that made the Bay Area band one of the most influential musical groups of their generation. Artfully assembling candid interviews with the band, road crew, family members and notable Deadheads, Bar-Lev reveals the untold history of the Dead and the freewheeling psychedelic subculture that sprouted up around it. The film also provides poignant insight into the psyche of late lead guitarist Jerry Garcia, whose disdain for authority clashed with his de facto leadership of the sprawling collective that kept the show on the road. With a soundtrack that captures some of the bands most dynamic live performances as well as unguarded offstage moments and never-before-seen interviews, footage and photos, Long Strange Trip explores the Deads singular experiment in radically eclectic music making. Much more than the ""behind the music"" backstory of an exceptionally talented and beloved group of musicians, the film is at once an inspiring tale of unfettered artistic expression, a heartfelt American tragedy, and an incisive history of the rise and fall of 20th-century counterculture.","R (for drug content throughout, language and some graphic nudity)",Documentary,Amir Bar-Lev,Abramorama,239 minutes,"Bob Weir, Jerry Garcia, Mickey Hart"
37,44383,Black Rose,N/A,13%,8,17%,48,A Russian Police Major (Alexander Nevsky) is enlisted by the LAPD to help solve a series of gruesome murders perpetrated against young women by a sadistic sociopathic killer on the mean streets of Hollywood.,NR,"Action & Adventure, Mystery & Suspense",Alexander Nevsky,ITN Distribution,100 minutes,"Alexander Nevsky, Kristanna Loken, Adrian Paul"
38,44388,Home of the Brave,"The ensemble cast works hard, but hammy direction and a script lacking in nuance ruins this movie's noble intentions.",23%,57,46%,22225,"As their tour of duty in Iraq draws to a close, four American soldiers learn that they are scheduled to embark on one final, fateful mission that will forever change their concept of war. Shortly after receiving the news that they will soon be reunited with their families back in the United States, a unit serving in Iraq is deployed on a humanitarian mission to deliver medical supplies to a remote Iraqi village. Upon arriving in the village, the unit is viciously ambushed and many lives are lost. Now, as the surviving members of the battalion return home and attempt to readjust to civilian life, the physical injuries and psychological scars sustained during that tragic event continue to take a heavy emotional toll on the war-torn soldiers. Samuel L. Jackson, Jessica Biel, and rapper-turned-actor 50 Cent star in an affecting psychological war drama from Academy Award-winning director Irwin Winkler. ~ Jason Buchanan, Rovi",R (for war violence and language),"Action & Adventure, Drama",Irwin Winkler,MGM,105 minutes,"Samuel L. Jackson, Jessica Biel, Brian Presley"
39,44393,Jeremiah Tower: The Last Magnificent,Jeremiah Tower: The Last Magnificent serves up a smorgasbord of documentary delights for foodie film fans -- and it's a pretty good watch for non-enthusiasts too.,83%,42,73%,292,"JEREMIAH TOWER: THE LAST MAGNIFICENT explores the remarkable life of Jeremiah Tower, one of the most controversial and influential figures in the history of American gastronomy. Tower began his career at the renowned Chez Panisse in Berkeley in 1972, becoming a pioneering figure in the emerging California cuisine movement. After leaving Chez Panisse, due in part to a famously contentious relationship with founder Alice Waters, Tower went on to launch his own legendary Stars Restaurant in San Francisco. Stars was an overnight sensation and soon became one of Americas top-grossing U.S. restaurants. After several years, Tower mysteriously walked away from Stars and then disappeared from the scene for nearly two decades, only to resurface in the most unlikely of places: New York Citys fabled but troubled Tavern on the Green. There, he launched a journey of self-discovery familiar to anyone who has ever imagined themselves to be an artist. Featuring interviews by Mario Batali, Anthony Bourdain, Ruth Reichl and Martha Stewart, this delicious documentary tells the story of the rise and fall of Americas first celebrity chef, whose brash personality and culinary genius has made him a living legend.",R (for language),Documentary,Lydia Tenaglia,The Orchard,102 minutes,"Jeremiah Tower, Anthony Bourdain, Mario Batali"
40,44421,Black Butterfly,N/A,42%,19,40%,554,"Outside a mountain town grappling with a series of abductions and murders, Paul (Antonio Banderas), a reclusive writer, struggles to start what he hopes will be a career-saving screenplay. After a tense encounter at a diner with a drifter named Jack (Jonathan Rhys Meyers), Paul offers Jack a place to stay - and soon the edgy, demanding Jack muscles his way into Pauls work. As a storm cuts off power to the isolated cabin, the two men begin a jagged game of one-upmanship that will bring at least one tale to an end. Antonio Banderas (Desperado, Haywire, The Skin I Live In), Jonathan Rhys Meyers (Match Point, Mission: Impossible III, ""The Tudors"") and Piper Perabo (The Prestige, Looper) star in this riveting adaptation of the acclaimed French thriller, Papillon Noir. Directed by Brian Goodman and written by Marc Frydman and Justin Stanley, Black Butterfly will be in theaters and on demand on May 26th.",R (for language),"Drama, Mystery & Suspense",Brian Goodman,Lionsgate Premiere,93 minutes,"Antonio Banderas, Jonathan Rhys Meyers, Piper Perabo"
41,44440,Frost (The Last International Playboy),N/A,29%,7,49%,2122,"Roswell star Jason Behr assumes the role of a New York City playboy who sinks into a deep depression after learning that his childhood love is engaged to another man. Still haunted by his mothers recent suicide, professional charmer Jack Frost (Behr) is shattered to discover that his one true love is about to take the plunge -- but not with him. As Jack begins spiraling into a self-destructive cycle of whisky and reckless behavior, his best friends Ozzy, Scotch, and Kate struggle to find a means of jarring their depressed pal back to reality. Strangely enough, it isnt Jacks grown-up friends who offer him the most useful relationship advice, but his 11-year-old neighbor, Sophie, whose unusually wise and thoughtful words have a special way of helping the self-absorbed urbanite shake off the nostalgia and excess that threaten to consume him.",R,"Comedy, Drama, Romance",Steve Clark,C Plus Pictures,95 minutes,"Jason Behr, Monet Mazur, Lucy Gordon"
42,44463,Assault of the Killer Bimbos,N/A,17%,6,47%,105,"Two go-go dancers, Peaches (Christina Whitaker) and Lulu (Elizabeth Kaitan), find themselves framed for the killing of their dance clubs owner. The dynamic duo decide to make a run for the Mexican border, while outsmarting various scumbag lawmen along the way.",R,Comedy,Anita Rosenberg,Full Moon,81 minutes,"Elizabeth Kaitan, Christina Whitaker, Tammara Souza"
43,44513,The Tracker,An engrossing drama.,88%,32,87%,1118,"Experimental director Rolf DeHeers film The Tracker depicts a controversial moment in the Australian justice system, in doing so taking on a popular topic among Australian filmmakers--the complicated and too often racist relationship between Aboriginals and locals. When an Aboriginal tracker (David Gulpilil) leads the manhunt for a fugitive native, a series of atrocities are performed on the ancient tribe by a sadistic policeman participating in the search party. The line between savage and civilian is blurred beyond recognition when Fanatic (Gary Sweet), the policeman, massacres a large group of peaceful Aboriginals. It eventually becomes clear that the tracker, who purposely keeps the Aboriginal a half-day ahead of the search party, is in control of the operation and has his own mysterious agenda. DeHeer takes a unique approach in the direction of this film; opting to show graphic paintings by artist Peter Coad during violent moments in lieu of filming bloody scenes among the actors. The drama itself is often contradicted by haunting, plaintive songs with lyrics written by DeHeer himself.",NR,"Art House & International, Documentary, Drama, Special Interest",Rolf de Heer,ArtMattan Productions,98 minutes,"Noel Wilton, Grant Page, Damon Gameau"
44,44528,Thunder Road,N/A,70%,10,63%,2176,"Robert Mitchum stars as a Korean war hero who returns to his hometown in Tennessee and takes over his familys bootleg moonshine business where he has to battle both the mob and federal agents. Not only did Mitchum star in the film, he wrote the story and the films theme song; Roberts son Jim plays his younger brother in the film. Thunder Road is widely considered the best movie about moonshine bootleggers, and its climatic car chase is one of the finest ever captured on film.",PG,"Action & Adventure, Classics, Drama, Mystery & Suspense",Arthur Ripley,MGM Home Entertainment,92 minutes,"Robert Mitchum, Gene Barry, James Mitchum"
45,44534,Sweet Virginia,"Smart and well-acted, Sweet Virginia delivers a tense, atmospheric thriller that transcends genre conventions even as it embraces them.",78%,55,60%,1254,"A mysterious stranger sends shockwaves through a close-knit community in this nerve-jangling slice of raw suspense. In the wake of a triple murder that leaves the residents of a remote Alaskan outpost on edge, tightly wound drifter Elwood (Christopher Abbott) checks into a motel run by Sam (Jon Bernthal), a former rodeo champion whose imposing physical presence conceals a troubled soul. Bound together by their outsider status, the two men strike up an uneasy friendship-a dangerous association that will set off a new wave of violence and unleash Sams darkest demons. Driven by tour de force performances from Christopher Abbott and Jon Bernthal, this precision crafted thriller pulses with an air of quivering dread. With Imogen Poots and Rosemarie Dewitt.","R (for violence, some strong sexuality, language, and drug use)","Drama, Mystery & Suspense",Jamie M. Dagg,IFC Films,93 minutes,"Jon Bernthal, Christopher Abbott, Imogen Poots"
46,44535,Mobile Homes,N/A,58%,19,39%,46,"A young mother drifts from one motel to the next with her intoxicating boyfriend and her 8-year-old son. The makeshift family scrapes by, living one hustle at a time, until the discovery of a mobile home community offers an alternative life.",NR,Drama,Vladimir de Fontenay,"Dark Star Pictures, Uncork'd Entertainment",105 minutes,"Imogen Poots, Callum Turner, Callum Keith Rennie"
47,44550,Harold And Lillian: A Hollywood Love Story,N/A,97%,31,90%,239,"Movie fans know the work of Harold and Lillian Michelson, even if they dont recognize the names. Working largely uncredited in the Hollywood system, storyboard artist Harold and film researcher Lillian left an indelible mark on classics by Alfred Hitchcock, Steven Spielberg, Mel Brooks, Stanley Kubrick, Roman Polanski and many more. Through an engaging mix of love letters, film clips and candid conversations with Harold and Lillian, Danny DeVito, Mel Brooks, Francis Ford Coppola and others, this deeply engaging documentary from Academy Award (R)-nominated director Daniel Raim offers both a moving portrait of a marriage and a celebration of the unknown talents that help shape the films we love.",NR,Documentary,"Daniel Raim, Francis Ford Coppola, Mel Brooks, Danny DeVito",Adama Films,100 minutes,"Lillian Michelson, Harold Michelson, Danny DeVito"
48,44551,The Journey,"The Journey's narrative deficiencies undermine a powerful fact-based story, but those problems are often offset by solid work from Colm Meaney and Timothy Spall.",69%,88,65%,549,"THE JOURNEY is the gripping account of how two men from opposite sides of the political spectrum came together to change the course of history. In 2006, amid the decades-long conflict in Northern Ireland, representatives from the two warring factions meet for negotiations. In one corner is Ian Paisley (Timothy Spall, Mr. Turner, Harry Potter), the deeply conservative British loyalist; in the other is Martin McGuinness (Colm Meaney, Hell on Wheels, Star Trek: Deep Space Nine), a former Irish Republican Army leader who has devoted his life to the cause of Irish reunification. Over the course of an impromptu, detour-filled car ride through the Scottish countryside, each begins to see the other less as an enemy, and more as an individual - a breakthrough that promises to at last bring peace to the troubled region. Driven by two virtuoso central performances and co-starring John Hurt, Freddie Highmore and Toby Stephens, THE JOURNEY, an IFC Films theatrical release, is a relevant reminder of how simple humanity can overcome political division.",PG-13 (for thematic elements including violent images and language),"Art House & International, Drama",Nick Hamm,IFC Films,94 minutes,"Timothy Spall, Colm Meaney, John Hurt"
49,44559,30 Years to Life,N/A,67%,9,67%,2157,"A handful of close friends, due to turn 30, discover that their dreams for the future are running headfirst into the realities of adulthood in this character-driven comedy-drama. Natalie (Melissa De Sousa) is a banker who is happy with her job, but is tired of being single, and her pursuit of a husband is taking her down several blind alleys in the world of dating. Joy (Erika Alexander) has developed a similar desire to settle down and get married, but while she has a long-term boyfriend, Leland (T.E. Russell), he isnt so sure he wants to make a lifetime commitment. Troy (Tracy Morgan) is a comic who has been on the verge of a career breakthrough for years, but hes started to wonder if his big break is ever going to arrive. Maleek (Allen Payne) is a white-collar executive who thinks life is passing him by, and is pondering giving up a stable career to start over as a male model. And Stephanie (Paula Jai Parker) is comfortable with her job in real estate, but shes not so comfortable with herself as she struggles with a weight problem shes had since childhood. 30 Years for Life marked the directorial debut for Vanessa Middleton, who previously distinguished herself as a television writer for such series as Cosby and Hangin With Mr. Cooper.",R (language and some sexuallity),Comedy,Vanessa Middleton,Kino International,110 minutes,"Erika Alexander, Melissa DeSousa, Tracy Morgan"
50,44578,Brain on Fire,N/A,13%,16,67%,737,"Brain on Fire follows Cahalan (Moretz), a rising journalist at the New York Post who mysteriously starts having seizures and hearing voices. As weeks go by and Susannah rapidly descends into insanity, she moves inexplicably from violence to catatonia. Following a series of outbursts, misdiagnoses and a prolonged hospital stay, a lucky last-minute intervention by one doctor finally gives her a diagnosis and hope to rebuild her life.","PG-13 (for thematic elements, brief language and partial nudity)",Drama,Gerard Barrett,Broad Green Pictures,95 minutes,"Chloë Grace Moretz, Richard Armitage, Thomas Mann"
51,44584,Drone,N/A,27%,11,25%,371,"Drone pilot and family man Neil (Sean Bean) has spent his career conducting deadly, covert missions overseas all from the comfort of his suburban hometown. When an enigmatic, Pakistani businessmen (Patrick Sabongui) shows up at his home seeking revenge, Neil must confront the consequences of his actions.",NR,Mystery & Suspense,Jason Bourque,N/A,91 minutes,"Sean Bean, Mary McCormack, Patrick Sabongui"
52,44595,Growing Up Smith (Good Ol' Boy),N/A,73%,11,80%,384,"When an Indian family moves to America in 1979 with the hope of living the American Dream, their 10-year-old-son, Smith, falls head-over-heels for the girl next door. With an American Dream of his own, Smith strives to become a ""good ol boy,"" propelling him and his family further away from their traditional ideals than ever before. GROWING UP SMITH is a heartfelt coming-of-age comedy about an irrepressibly-like-able 10-year-old boy from India who may possibly lose it all--including the love of his life--when his obsession for living the American Dream unexpectedly takes a wrong turn.",PG-13 (for some language and brief drug use),"Comedy, Drama, Kids & Family",Frank Lotito,Good Deed Entertainment,102 minutes,"Jason Lee, Anjul Nigam, Brighton Sharbino"
53,44600,I'll Take You There,N/A,43%,7,36%,82,"Former Hal Hartley collaborator Adrienne Shelly directs her second feature about a blind date gone horribly horribly awry. Still thoroughly depressed after his girlfriend dumped him three months ago, Bill (Reg Rogers) is coerced by his sister (Shelly) into going on a blind date with Bernice (Ally Sheedy). Bill is immediately underwhelmed by his cheerless date, and as the night grinds on, he bluntly tells her what he thinks. Instead of ending things, Bernice becomes obsessed with the man, telling him at one point that since the date, he has ""taken something away."" After trying more standard means to worm her way into his life, she takes drastic action; she pulls a gun on Bill and ushers him to her vintage Mercury. Soon Bill finds himself the unwilling accomplice to Bernices serial gunpoint robberies of boutiques. Meanwhile, she lambastes him for not being adequately respectful. Before long, Bill finds himself in upstate New York and out of his rut. Ill Take You There was screened at the 1999 Telluride Film Festival.",R (adult situations/language),"Art House & International, Comedy",Adrienne Shelly,First Look Pictures,93 minutes,"Reg Rogers, Ally Sheedy, John Pyper-Ferguson"
54,44602,AWOL,N/A,93%,15,56%,247,"A young woman Joey is in search of direction in her small town. A visit to an army recruiting office appears to provide a path, but when she meets and falls in love with Rayna that path diverges in ways that neither woman anticipates.",NR,Drama,Deb Shoval,Race Point Films,85 minutes,"Lola Kirke, Breeda Wool, Dale Soules"
55,44604,Shimmer Lake,N/A,60%,10,59%,487,An inventive crime thriller told backwards--reversing day by day through a week--following a local sheriffs quest to unlock the mystery of three small town criminals and a bank heist gone wrong.,NR,"Drama, Mystery & Suspense",Oren Uziel,Netflix,83 minutes,"Benjamin Walker, Rainn Wilson, Stephanie Sigman"
56,44624,What Happened to Monday,N/A,57%,35,67%,2955,"In a not so distant future, where overpopulation and famine have forced governments to undertake a drastic ""One Child Policy,"" seven identical sisters live a hide-and-seek existence pursued by the Child Allocation Bureau. The Bureau, directed by the fierce Nicolette Cayman (Glenn Close), enforces a strict family-planning agenda that the sisters outwit by taking turns assuming the identity of one person: Karen Settman (Noomi Rapace). Taught by their grandfather (Willem Dafoe) who raised and named them - Monday, Tuesday, Wednesday, Thursday, Friday, Saturday and Sunday - each can go outside once a week as their common identity, but are only free to be themselves in the prison of their own apartment. That is until, one day, Monday does not come home...",NR,"Action & Adventure, Drama, Mystery & Suspense, Science Fiction & Fantasy",Tommy Wirkola,Netflix,123 minutes,"Noomi Rapace, Willem Dafoe, Glenn Close"
57,44628,Son of Bigfoot,N/A,76%,21,40%,365,"Teenage outsider Adam sets out on an epic and daring quest to uncover the mystery behind his long-lost dad, only to find out that he is none other than the legendary Bigfoot! He has been hiding deep in the forest for years to protect himself and his family from HairCo., a giant corporation eager to run scientific experiments with his special DNA. As father and son start making up for lost time after the boys initial disbelief, Adam soon discovers that he too is gifted with superpowers beyond his imagination. But little do they know, HairCo. is on their tail as Adams traces have led them to Bigfoot!","PG (for action/peril, thematic elements and some language)","Action & Adventure, Animation, Kids & Family","Jeremy Degruson, Ben Stassen",DIRECTV and Viva Pictures,92 minutes,"Cinda Adams, Mari Devon, Kirk Thornton"
