,dataIndex,realTitle,criticsConcensus,tomatoMeter,tomatoCount,audienceScore,audienceCount,realSynopsis,rating,genreString,directedBy,studio,runTime,cast
343,15486,Creepshow 3,N/A,0%,6,11%,2818,"Diabolical demons take possession of the living, night-dwelling vampires lurch out from the shadows, vicious serial killers embark on an orgy of blood-drenched mayhem, and nightmare worlds come screaming into our reality as the Creepshow series continues with this collection of five shocking tales inspired by classic horror comics.",R,"Animation, Comedy, Horror, Science Fiction & Fantasy","Ana Clavell, James Glenn Dudelson",Creepy Film Productions,103 minutes,"AJ Bowen, Kris Allen, Stephanie Pettee"
344,15487,Knight & Day,"It's pure formula, but thanks to its breezy pace and a pair of charming performances from Tom Cruise and Cameron Diaz, Knight and Day offers some agreeably middle-of-the-road summer action.",52%,229,49%,198710,"A single girl en route to a family wedding gets swept up in a fight between a rogue government agent and the FBI in this globe-trotting action comedy from director James Mangold (Walk the Line, 3:10 to Yuma). June Havens (Cameron Diaz) is preparing to board a flight back home for her sisters wedding when she literally bumps into Roy Miller (Tom Cruise) in the middle of a busy airport. A few minutes later, theyre making small talk on the plane when June excuses herself to the bathroom, and all hell breaks loose in the fuselage. By the time June emerges Roy has killed everybody on board, including the pilots. After crash-landing the plane in a darkened cornfield, Roy tells June that she should expect a visit from government agents, but warns her that by cooperating with them she risks almost certain death. The following day, Roys prediction comes true when June is confronted by an imposing gang of government spooks who come under heavy fire while bombarding her with questions about her mysterious traveling companion. Suddenly, Roy is back, and hes once again whisking June away to safety. But what do the agents want, and why do they insist that Roy is the one to be feared, and not them? Before long the girl who never traveled far from home is off on a wild adventure that will take her from the tropics to Austria, France, and Spain. Somewhere amidst all of the confusion and gunfire, June begins to forge a bond with Roy. Unfortunately, its never quite clear whether her unpredictable protector is one of the good guys or the bad guys, and by the time Roy reveals that hes attempting to protect a valuable new energy source, theres no time for questions. Paul Dano, Viola Davis, Peter Sarsgaard, Maggie Grace, and Marc Blucas co-star.","PG-13 (for sequences of action violence throughout, and brief strong language)","Action & Adventure, Comedy",James Mangold,20th Century Fox,109 minutes,"Tom Cruise, Cameron Diaz, Peter Sarsgaard"
345,15492,Nightwatching,N/A,76%,17,61%,1510,In 1642 Amsterdam was the richest city in the Western World. It was the year that saw the great artist Rembrandt fall from riches into poverty by painting his masterpiece: The Nightwatch. Greenaways sinuous tale of murder and betrayal meticulously captures the incredible story.,"R (for strong sexual content, graphic nudity and language)","Art House & International, Drama",Peter Greenaway,Kasander Film Company,134 minutes,"Martin Freeman, Emily Holmes, Eva Birthistle"
346,15493,Fear City,N/A,67%,9,32%,1620,"When the female strippers at Matt Rossis (Tom Berenger) club begin to turn up dead, he enlists the aid of his ex-girlfriend (Melanie Griffith) and a local cop (Billy Dee Williams) in an attempt to catch the killer.","R (adult situations/language, nudity, violence)","Action & Adventure, Drama, Mystery & Suspense",Abel Ferrara,HBO Video,96 minutes,"Tom Berenger, Billy Dee Williams, Jack Scalia"
347,15496,The Karate Kid,"It may not be as powerful as the 1984 edition, but the 2010 Karate Kid delivers a surprisingly satisfying update on the original.",66%,208,67%,282989,"When a 12-year-old from Detroit moves to China with his mother and incurs the wrath of the class bully at his new school, he makes an unlikely ally in the form of his aging maintenance man, a kung fu master who teaches him the secrets to self-defense. Upon arriving at his new school, Dre Parker (Jaden Smith) develops a powerful crush on pretty classmate Mei Ying. The feeling is mutual, although the cultural divide between Dre and Mei Ying makes a friendship unlikely, and romance impossible. When cruel classmate and kung fu prodigy Cheng learns of Dres feelings for Mei Ying, he harasses and humiliates the young outsider in front of the entire school. With no one to turn to for help, Dre confides his fears in kindly maintenance man Mr. Han (Jackie Chan), a kung fu master who knows that serenity and maturity -- not punches and power -- are the true keys to mastering the martial arts. As Dre prepares to face down his intimidating tormentor, he begins to realize that the real fight is just beginning. ~ Jason Buchanan, Rovi","PG (for bullying, martial arts action violence and some mild language)","Action & Adventure, Drama, Kids & Family","Harald Zwart, John G. Avildsen",Sony Pictures,140 minutes,"Jaden Smith, Jackie Chan, Taraji P. Henson"
348,15498,Like Minds (Murderous Intent),N/A,38%,8,63%,2958,"A murder lifts the lid on some disturbing actions among the pupils at a well-respected school in this drama. Nigel (Tom Sturridge), a student at an exclusive British private school, has been found murdered, and police detective McKenzie (Richard Roxburgh) has been assigned to investigate. Alex Forbes (Eddie Redmayne), one of Nigels classmates who was known to have little fondness for him, is a prime suspect and has been brought in for questioning; however, he refuses to cooperate, and Sally Rowe (Toni Collette), a forensic psychiatrist working with the police, is brought in to talk to the boy. While Alex is initially no more helpful with Sally, in time shes able to find cracks in his resistance, and he begins to discuss his interest in the Knights Templar, a medieval Christian military order. As Alex shares his belief that the benefits of some actions can outweigh their wrongs, Sally learns more about the boy, and her research turns up some surprising facts - Nigel believed both he and Alex were descended from members of the Knights Templar, they may have been responsible for the death of a schoolmate in the interest of gaining mystical powers, and Alexs father (Patrick Malahide), also the headmaster at the school, has some troubling secrets of his own. Like Minds was the first feature film from writer and director Gregory J. Read.",PG-13,"Drama, Mystery & Suspense",Gregory J. Read,The Weinstein Company,109 minutes,"Eddie Redmayne, Tom Sturridge, Toni Collette"
349,15504,The Kids Are All Right,"Worthwhile as both a well-acted ensemble piece and as a smart, warm statement on family values, The Kids Are All Right is remarkable.",93%,222,74%,63549,"Two teenaged children get the notion to seek out their biological father and introduce him into the family life that their two mothers have built for them. Once the donor is found, the household will never be the same, as family ties are defined, re-defined, and re-re-defined.","R (for strong sexual content, nudity, language and some teen drug and alcohol use)","Comedy, Drama",Lisa Cholodenko,Focus Features,104 minutes,"Julianne Moore, Annette Bening, Mark Ruffalo"
350,15511,Batman: Under the Red Hood,N/A,100%,7,92%,11476,"A diabolical villain who seems to know Batmans every move sets out to clean up the streets of Gotham for good and destroy the caped crime-fighter in the process. Every night, Batman protects the citizens of Gotham from the shadows. But lately another vigilante has been prowling the streets, and his merciless methods are more frightening than reassuring. Now, as the Red Hood commences to exterminating the scum of the city with extreme prejudice, the Joker resurfaces to taunt his old nemesis by digging up some skeletons that were best left buried.",PG-13,"Action & Adventure, Animation",Brandon Vietti,WARNER BROTHERS PICTURES,76 minutes,"Bruce Greenwood, Jensen Ackles, Neil Patrick Harris"
351,15519,Winnebago Man,"Though it doesn't quite answer all of the questions it raises, Winnebago Man is nevertheless a fascinating, hilarious, and surprisingly poignant look at a geniunely colorful internet celebrity.",90%,62,80%,19105,"Jack Rebney is the most famous man youve never heard of -- an RV salesman whose hilarious, foul-mouthed outbursts circulated underground on VHS tapes in the 90s before turning into a full-blown Internet phenomenon in 2005. Today, the ""Winnebago Man"" has been seen by more than 20 million people worldwide, and is regarded as one of the first and funniest viral videos. Filmmaker Ben Steinbauer goes in search of Rebney -- and finds him living alone on a mountain top, unaware of his fame. Winnebago Man is a laugh-out-loud look at viral culture and an unexpectedly poignant tale of one mans response to unintended celebrity.",NR,"Comedy, Documentary, Special Interest",Ben Steinbauer,Kino Lorber,85 minutes,"Jack Rebney, Keith Gordon, Ghyslain Raza"
352,15530,Mr. Nobody,"Mr. Nobody's narrative tangles may bedevil as much as they entertain, but its big ambitions and absorbing visuals make for an intriguing addition to director Jaco Van Dormael's filmography.",67%,30,76%,25768,"A young boy stands on a station platform. The train is about to leave. Should he go with his mother or stay with his father? An infinity of possibilities rise from this decision. As long as he doesnt choose, anything is possible. Every life deserves to be lived. (c) Magnolia","R (for some sexuality/nudity , brief strong language and violent images)","Art House & International, Drama, Science Fiction & Fantasy, Romance",Jaco Van Dormael,Magnolia Pictures,155 minutes,"Jared Leto, Diane Kruger, Sarah Polley"
353,15534,The Silver Chalice,N/A,13%,8,19%,164,"Based on the novel by Thomas Costain, this epic follows the adventures of a Greek sculptor, Basil (Paul Newman), as he travels through a series of adventures and eventually winds up in Jerusalem where he meets up with Peter (Lorne Greene) who hires him to design a way of safely preserving the chalice used by Jesus at the Last Supper. This film was the screen debut of both Paul Newman and Lorne Greene.",NR,"Classics, Drama, Romance",Victor Saville,Warner Home Video,142 minutes,"Paul Newman, Virginia Mayo, Anna Maria Pier Angeli"
354,15537,Telstar (Telstar: The Joe Meek Story),Nick Moran's excellent portrait of an often forgotten pop legend is as eccentric and chaotic as its subject.,81%,27,69%,557,"Adapted from Nick Moran and James Hicks critically-lauded stage play, Telstar tells the remarkable tale of eccentric, London-based songwriter/producer Joe Meek (Con ONeill), whose innovative recording techniques ushered in a bold new era of rock n roll in the late 1950s. Tone deaf and musically illiterate, Meek nevertheless had a lifelong obsession with music and a knack for producing. Though Meeks tireless work ethic ensured a tumultuous relationship with his band, his ramshackle, apartment recording studio provided just enough space to record, and experiment with such cutting-edge techniques as sampling and distortion. Meanwhile, his landlady Mrs. Shenton does her best to put up with the racket, and his main backer Major Wilfred Banks (Kevin Spacey) provides the cash to produce such hits as ""Be-Bop-A-Lula"", "" Johnny Remember Me"", and, of course, ""Telstar"".",R,"Art House & International, Comedy, Drama, Musical & Performing Arts",Nick Moran,PreviewNetworks,117 minutes,"Con O'Neill, Kevin Spacey, Pam Ferris"
355,15540,Dinner for Schmucks,"It doesn't honor its source material -- or its immensely likable leads -- as well as it should, but Dinner for Schmucks offers fitfully nourishing comedy.",41%,189,42%,119457,"Tim, an up-and-coming executive, has just received his first invitation to the ""dinner for idiots,"" a monthly event hosted by his boss that promises bragging rights (and maybe more) to the exec that shows up with the biggest buffoon. Tims fiancée, Julie, finds it distasteful and Tim agrees to skip the dinner, until he bumps into Barry - an IRS employee who devotes his spare time to building elaborate taxidermy mouse dioramas - and quickly realizes hes struck idiot gold. Tim cant resist, and invites Barry, whose blundering good intentions soon sends Tims life into a frenzied downward spiral and a series of comic misadventures, threatening a major business deal, bringing crazy stalker ex-girlfriend, Darla, back into Tims life and driving Julie (or so Tim thinks) into the arms of another man.","PG-13 (for sequences of crude and sexual content, some partial nudity and language)",Comedy,Jay Roach,Paramount Studios,114 minutes,"Paul Rudd, Steve Carell, Zach Galifianakis"
356,15541,8: The Mormon Proposition,"It's unabashedly biased, but this look at the fight over gay marriage in California is impassioned and provocative.",64%,36,72%,997,"""8: THE MORMON PROPOSITION"" exposes the Mormon Churchs historic involvement in the promotion and passage of Californias Proposition 8 and the religions ongoing campaign against gay rights. The film takes place in California and Utah as Mormons, following their prophets call to action, wage spiritual warfare with money and misinformation against gay citizens, doing everything they can to deny them of marriage and the rights that come with it. ""8: THE MORMON PROPOSITION"" opens in theaters on June 18th, 2010, two years after the first gay marriages took place in California (June 17th, 2008). -- (C) Official Site",R (for some language/sexual references),"Documentary, Special Interest, Faith & Spirituality","Reed Cowan, Steven Greenstreet",Red Flag Releasing,78 minutes,"Dustin Lance Black, Gavin Newsom, Hal Sparks"
357,15544,Nanny McPhee Returns,"Emma Thompson's second labor of love with the Nanny McPhee character actually improves on the first, delivering charming family fare with an excellent cast.",76%,119,55%,51314,"A struggling mother receives some much-needed assistance tending to the family farm and raising a group of spirited children while her military husband is fighting overseas in this sequel to the whimsical 2005 fantasy comedy Nanny McPhee. Mrs. Isabel Green (Maggie Gyllenhaal) lives in a scenic valley with her two sons and one daughter. They each understand the importance of working together as a family, and things are going remarkably smoothly for the rural quartet until a pair of spoiled cousins arrives for an extended stay, effectively turning the quaint little farm into a virtual zoo. As the situation quickly gets out of hand, Nanny McPhee (Emma Thompson) suddenly appears on Isabels doorstep claiming that she can bring a much-needed sense of order to the out-of-control household. In time the mysterious helper does just that, using powerful magic to teach her young charges the importance of getting along, and gradually winning their trust in the process. But when the piglets escape from their sty, the contentious kids must work together to recover the family farms most valued assets, or risk losing everything their father worked so hard to build before he went off to fight in the war. Rhys Ifans and Maggie Smith co-star. ~ Jason Buchanan, Rovi","PG (for rude humor, some language and mild thematic elements)","Comedy, Kids & Family, Science Fiction & Fantasy",Susanna White,Universal Studios,109 minutes,"Emma Thompson, Maggie Gyllenhaal, Rhys Ifans"
358,15547,3 Needles,"In getting its message about the AIDS epidemic across, the film unfortunately sacrifices story and character.",34%,38,68%,2949,"""Three Needles"" is a drama that visits rural China, a plantation in South Africa, and Montreals porn industry, to tell three separate yet universal stories, rooted to struggles with the HIV pandemic. In China, Ping is a pregnant young woman running a black market blood collection scam that creates a mini epidemic in a rural village. In Montreal, Denys is a porn actor hiding his positive HIV status in order to continue working and supporting his mother--who herself goes to extreme lengths to provide for the familys future. And, in Africa, Sister Clara is a young novice nun, driven to convert the rapidly dying Africans to Catholicism before its too late; she makes a desperate bargain with a corrupt plantation owner to help prevent the spread of HIV in the region, bringing two nuns, who are of her same order, to accompany her on the journey.",R (adult situations),Drama,Thom Fitzgerald,Wolfe Releasing,127 minutes,"Olympia Dukakis, Chloë Sevigny, Sandra Oh"
359,15548,Olivier Olivier,N/A,87%,15,88%,481,"Olivier, the nine-year-old son of a country veterinarian, vanishes one afternoon on the way to his grandmothers house. The emotional aftermath of his disappearance sends his father packing from France to Africa and nearly destroys his mother, who clings to her remaining child, Nadine, and her devoted neighbor, Marcel. Several years later, having relocated to the city, the police investigator who handled the case meets a Paris rent boy whom he believes to be the missing Olivier. Once he returns to his rural home, the teenaged Olivier tries to assuage his mothers now-entrenched grief and heal the rift between his reunited parents. Meanwhile, he must overcome his brooding, adolescent sisters jealousy and doubts about his identity and reconcile his sleazy street life with his picturesque new surroundings. Questions about the tight-lipped Oliviers true motivations continue to crop up, however, threatening to send his mother over the edge for good.",R,"Art House & International, Drama",Agnieszka Holland,Films Antenne 2,110 minutes,"François Cluzet, Brigitte Roüan, Gregoire Colin"
360,15550,Taking Off,N/A,100%,8,84%,716,"A seriocomedic effort by Milos Forman depicting the plight of runaway children and their desperate parents, this is really a look a generational differences. Centering on a runaway girl, the story also tells the ways in which her flight has driven her parents into a new lifestyle that helps to shake up their staid lives.",R,Comedy,Milos Forman,Universal Pictures,92 minutes,"Lynn Carlin, Buck Henry, Linnea Heacock"
361,15553,The Town That Dreaded Sundown,N/A,68%,28,40%,3420,"65 years after a masked serial killer terrorized the small town of Texarkana, the so-called moonlight murders begin again. Is it a copycat or something even more sinister? A lonely high school girl, with dark secrets of her own, may be the key to catching him.","R (for brutal violence, grisly images, strong sexual content, and language)","Horror, Mystery & Suspense",Alfonso Gomez-Rejon,MGM,90 minutes,"Denis O'Hare, Addison Timlin, Veronica Cartwright"
362,15561,Human Desire,N/A,53%,15,74%,509,"After being fired by the railroad, Carl Buckley (Broderick Crawford) returns home, where his femme fatale wife Vicki (Gloria Grahame) initially sympathizes with his plight. However, she resists Carls plea to ask Mr. Owens (Grandon Rhodes), an old friend and major freight customer of the railroad, to intercede on his behalf. She finally relents, and they go to the city, where Vicki meets with Owens. When she is successful, Carl accuses her of having an affair with him. He forces Vicki to write a letter arranging to meet Owens on the train. Carl accompanies Vicki to Owenss compartment where he kills him and retrieves the letter to use against Vicki. Spotting Jeff Warren (Glenn Ford), an old railroad buddy and not wanting to be seen, Carl insists that Vicki distract Jeff. Vicki seduces him, beginning an affair in which she so bewitches Jeff that he agrees to kill her husband. An American version of Jean Renoirs version of Emile Zolas novel La Bete Humaine, Fritz Langs Human Desire is a tragic reminder that jealousy is a self-fulfilling prophecy.",NR,Drama,Fritz Lang,Columbia Pictures,90 minutes,"Glenn Ford, Gloria Grahame, Broderick Crawford"
363,15570,Shifty,N/A,96%,26,67%,995,"Inspired by writer/director Eran Creevys own teenage experiences, Shifty tells the tale of a man who returns to his old neighborhood on the outskirts of London, ostensibly to attend a party but more specifically to check up on an old friend. Its been a long time since Chris (Daniel Mays) left town, and now that hes finally returned, hes eager to check up on Shifty (Riz Ahmed), the lifelong friend he left behind. As it turns out, things arent going to well for Shifty; not only has he taken to dealing drugs supplied by local heavy Glen (Jason Flemyng), but the constant struggle to keep his activates secret from his self-righteous brother Rez (Nitin Ganatra) has resulted in some serious family tensions. Over the course of the next twenty-four hours, former best friends Chris and Shifty will not only confront the dark secrets that once drove Chris from town, but also work to free the desperate Shifty from a volatile situation that could spell danger for both of them. ~ Jason Buchanan, Rovi",R,"Action & Adventure, Art House & International, Drama, Mystery & Suspense",Eran Creevy,BBC Films,86 minutes,"Daniel Mays, Riz Ahmed, Jason Flemyng"
364,15576,Ramona and Beezus,"If Ramona and Beezus fails to capture the essence of its classic source material, it's sunny, sweet, and wholesome.",70%,90,71%,65247,"The adventures of young Ramona Quimby (newcomer Joey King) and her big sister Beezus (Selena Gomez) come to life in this all new film based on the best-selling books (over 30 million...and counting) by Beverly Cleary. Ramonas vivid imagination, boundless energy, and accident-prone antics keep everyone she meets on their toes. But her irrepressible sense of fun, adventure and mischief come in handy when she puts her mind to helping save her familys home. John Corbett (My Big Fat Greek Wedding) and Bridget Moynahan (I, Robot) also star as Ramona and Beezus parents, Robert and Dorothy Quimby, while Ginnifer Goodwin (Hes Just Not That Into You) portrays the girls Aunt Bea, opposite Josh Duhamel (Transformers) as Beas former flame, Hobart. Sandra Oh (Greys Anatomy) plays Ramonas third grade teacher, Mrs. Meacham. Elizabeth Allen (Aquamarine) directs from a screenplay by Laurie Craig and Nick Pustay. Denise Di Novi and Alison Greenspan produce for Fox 2000 Pictures and Walden Media. The cinematographer is John Bailey, ASC; Brent Thomas is the production designer; and Jane Moran is the editor. Co-producer is Brad Van Arragon. Music is by Mark Mothersbaugh, and the music supervisor is Julia Michels. -- (C) 20th Century Fox",G,"Comedy, Kids & Family",Elizabeth Allen,20th Century Fox,103 minutes,"Joey King, Selena Gomez, John Corbett"
365,15579,Charlie St. Cloud,"Zac Efron gives it his all, but Charlie St. Cloud is too shallow and cloying to offer much more than eye candy for his fans.",27%,124,60%,92336,"Accomplished sailor Charlie St. Cloud has the adoration of mother Claire and little brother Sam, as well as a college scholarship that will lead him far from his sleepy Pacific Northwest hometown. But, his bright future is cut short when a tragedy strikes and takes his dreams with it. After his high-school classmate Tess returns home unexpectedly, Charlie grows torn between honoring a promise he made four years earlier and moving forward with newfound love. And, as he finds the courage to let go of the past for good, Charlie discovers the soul most worth saving is his own.","PG-13 (for language including some sexual references, an intense accident scene and some sensuality)",Drama,Burr Steers,Universal Pictures,98 minutes,"Zac Efron, Charlie Tahan, Amanda Crew"
