,dataIndex,realTitle,criticsConcensus,tomatoMeter,tomatoCount,audienceScore,audienceCount,realSynopsis,rating,genreString,directedBy,studio,runTime,cast
0,14000,Days of Darkness,N/A,20%,5,66%,3267,A civil servant gradually regresses into a fantasy world while falling for a beautiful movie star (Diane Kruger) in director Denys Arcands (The Barbarian Invasions) dark comedy.,"R (for violence and gore, language including sexual references, and brief sexuality/nudity)","Comedy, Horror",Denys Arcand,Lionsgate Films,84 minutes,"Marc Labrèche, Diane Kruger, Sylvie Léonard"
1,14019,Alien Trespass,"An earnest attempt to parody campy 1950s sci-fi films, Alien Trespass eventually loses its charm among tedious dialogue and cheesy special effects.",36%,67,31%,11940,"Set in 1957, ""Alien Trespass"" chronicles a fiery object from outer space that crashes into a mountaintop in the California desert, bringing the threat of disaster to Earth. Out of the flying saucer escapes a murderous creature--the Ghota--which is bent on destroying all life forms on the planet. A benevolent alien from the spaceship, Urp, inhabits the body of Ted Lewis--a local astronomer--and with the help of Tammy, a waitress from the local diner, sets out to save mankind.",PG (for sci-fi action and brief historical smoking),"Comedy, Drama, Mystery & Suspense, Science Fiction & Fantasy",R.W. Goodwin,Roadside Attractions,90 minutes,"Eric McCormack, Jenni Baird, Dan Lauria"
2,14022,"Next Stop, Greenwich Village",N/A,80%,15,64%,506,"Director Paul Mazursky drew from his own formative experiences as a struggling New York actor in Next Stop, Greenwich Village. Lenny Baker plays Mazurskys alter ego, an aspiring Brooklyn-born thespian named Larry Lapinsky. When not parrying with his overprotective Jewish parents (Mike Kellin and Shelley Winters), Larry must contend with his ""method""-happy acting teacher Herbert (Michael Egan); with actress Anita (Lois Smith), who is forever threatening to kill herself over imagined slights; with head-in-the-clouds Greenwich-Village poet Robert (Christopher Walken); and with Bernstein (Antonio Fargas), a black homosexual with an identity problem. Larrys future is threatened when his girl friend Sarah (Ellen Greene) gets pregnant, one of several crises facing this star-crossed couple throughout the film. Keep an eye peeled for young Bill Murray, Joe Spinnell and Jeff Goldblum in minor roles.",R,"Comedy, Drama",Paul Mazursky,20th Century Fox Film Corporation,111 minutes,"Lenny Baker, Shelley Winters, Christopher Walken"
3,14023,Gigantic,"A clever, absorbing documentary about They Might Be Giants, a musical duo whose brainy, idiosyncratic brand of pop has earned them decades of cult success.",82%,45,89%,1000,"John Flansburgh and John Linnell are a pair of musicians who met when they were fellow junior-high misfits in the town of Lincoln, MA. Sharing a fondness for off-center pop music and absurdist humor, the pair decided to form a band, and later moved to Brooklyn, NY, in search of their big break. Adopting a rather unusual two-man lineup (guitar and accordion accompanied by a drum machine), the duo began performing as They Might Be Giants, and their shows were part concert, part performance art, and part edgy comedy. Slowly but surely, They Might Be Giants became one of the biggest bands on the alternative rock scene, and while they never threatened to break into the upper reaches of the Billboard charts, theyve managed to develop a loyal cult following, and after nearly 20 years together, are still recording and performing their one-of-a-kind songs on their own terms. Gigantic (A Tale of Two Johns) is a documentary which looks at the long and sometimes strange history of They Might Be Giants, featuring extensive interviews with Flansburgh and Linnell; thoughts from fellow musicians Frank Black and Syd Straw; endorsements from noted authors Dave Eggers, Gina Arnold, and Michael Azerrad; and readings of the groups lyrics from actors (and fans) Harry Shearer, Janeane Garofalo, Michael McKean, and Annette OToole.",NR,"Documentary, Musical & Performing Arts",AJ Schnack,Cowboy Pictures,102 minutes,"They Might Be Giants, Frank Black, Dave Eggers"
4,14028,Waterland,N/A,53%,15,61%,1743,"Based on the novel by Graham Swift, this drama follows the past and present crises of schoolteacher Tom Crick (Jeremy Irons), who attempts to resolve the problems in his own life and the apathy of his students by relating stories of his troubled childhood in the English Fens (a marshy region in Britain).",R,"Drama, Science Fiction & Fantasy",Stephen Gyllenhaal,Sony Pictures Home Entertainment,95 minutes,"Jeremy Irons, Ethan Hawke, Sinead Cusack"
5,14031,Bandslam,"Bandslam is an intelligent teen film that avoids teen film cliches, in an entertaining package of music and coming-of-age drama.",81%,102,64%,107613,"A gifted young singer-songwriter recruits the new kid in town to manage her fledgling rock band in this music-driven comedy starring Vanessa Anne Hudgens and Gaelan Connell. Charlotte Banks (Aly Michalka) has what it takes to be a true rock star, and with the battle of the bands approaching shes determined to win. Her chief opponent in the upcoming competition is none other than her egotistical ex-boyfriend Ben (Scott Porter). Ben may be cocky, but theres no denying his charisma when he takes the stage. With a little help from new arrival Will Burton (Connell), Charlottes band begins to develop a unique sound and starts writing some original songs. Meanwhile, as Will and singer/guitarist Sa5m (Hudgeons) start to make a love connection, disaster strikes, and the band is forced to choose between conceding the competition or standing tall and finally living up to their true potential.",PG (for some thematic elements and mild language),"Comedy, Drama, Musical & Performing Arts",Todd Graff,Summit Entertainment,111 minutes,"Alyson Michalka, Gaelan Connell, Scott Porter"
6,14033,Harvard Beats Yale 29-29,Harvard Beats Yale 29-29 is compelling viewing even though it spoils the score of the titular college football matchup - and even if you aren't a fan of the sport.,92%,38,76%,553,"Kevin Raffertys documentary Harvard Beats Yale 29-29 looks at this historic 1968 matchup between those two longtime college football rivals. Many recall that years edition of this annual grudge match as it was the first time in almost six decades that both schools were undefeated going into the game. The filmmakers utilize archival footage, and intercut it with new interview footage provided by many of those who played a part in that memorable game. ~ Perry Seibert, Rovi",PG,"Documentary, Sports & Fitness",Kevin Rafferty,Emerging Pictures,105 minutes,"Tommy Lee Jones, Brian Dowling, Vic Gatto"
7,14041,Paper Heart,"Equal parts charming and refreshing, Paper Heart is a quirky mockumentary led by the endearing Charlyne Yi.",60%,110,45%,44729,"Real-life sweethearts Michael Cera and Charlyne Yi star in a fictionalized version of their romance in this indie semi-documentary comedy, written by Yi. Playing themselves, Yi and Cera embark on a scripted version of their own story. In the movie, Yi has agreed to be the subject of a documentary about her quest to discover if love really exists, since shes never experienced it. As part of her participation in the project, she has a film crew follow her around throughout every new development in her love life -- which gets complicated when she starts dating fellow comedian Cera. This portion of the film is all narrative, and was written into the script, but also as part of the documentary, Yi travels the country interviewing various people about their opinions and experiences with love, and these portions of the film are real -- the interviewees are not actors. Melding truth and fantasy, Paper Heart uses equal parts comedy and realism to resolve the ultimate question of whether love is fact or fiction.",PG-13 (for some language),Comedy,Nicholas Jasenovec,Overture Films,89 minutes,"Charlyne Yi, Michael Cera, Jake Johnson (XVI)"
8,14046,Fighting,"Though Fighting has a likable lead performer, and the fight scenes are impressive, the paper-thin plot ultimately unravels.",40%,129,36%,765958,"Small-town boy Shawn MacArthur (Channing Tatum, G.I. Joe: The Rise of Cobra, Public Enemies) knows firsthand that every day in New York City is a struggle to survive. So when scam artist Harvey Boarden (Terrence Howard, Iron Man, Hustle & Flow) gives him a chance to be something more in the brutal underground world of bare-knuckle street-fighting, Shawn decides that he has something worth fighting for and puts everything on the line to win. Each knockout brings him closer to the life he?s always wanted, but also traps him in a dangerous web he can?t escape. Experience even more pounding action with this unrated version not seen in theaters!","PG-13 (for intense fight sequences, some sexuality and brief strong language)","Action & Adventure, Drama",Dito Montiel,Rogue Pictures,105 minutes,"Channing Tatum, Terrence Howard, Brian J. White"
9,14047,Tetro,"A complex meditation on family dynamics, Tetro's arresting visuals and emotional core compensate for its uneven narrative.",70%,107,69%,11723,"On the heels of the self-financed, modestly budgeted 2007 drama Youth Without Youth -- his first directorial outing after a ten-year hiatus -- filmmaker Francis Ford Coppola remains situated in the directors chair for this semi-autobiographical family drama concerning an artistic family of immigrants whose fierce rivalries span several generations. Vincent Gallo stars with newcomer Alden Ehrenreich, with Carmen Maura, Maribel Verdú, and Alden Ehrenreich rounding out the cast. ~ Jason Buchanan, Rovi","R (for language, some sexuality and nudity)","Drama, Mystery & Suspense",Francis Ford Coppola,American Zoetrope,127 minutes,"Vincent Gallo, Alden Ehrenreich, Carmen Maura"
10,14050,Side Street,N/A,83%,6,71%,529,"Farley Granger plays a casually larcenous New York City mailman who steals a shipment of money. Grangers excitement over this windfall turns to terror when he discovers that the money was part of a transaction between gangsters. Harassed by both crooks and cops, Granger lives to regret his impulsive theft--especially when it is tied in with a murder. The story is wrapped up in spectacular fashion with a climactic car chase. Farley Grangers costar in Side Street is Cathy ODonnell; both were on loan to MGM from Samuel Goldwyn, and both were banking on their previous successful teaming in RKOs They Live By Night.",NR,Drama,Anthony Mann,MGM,83 minutes,"Farley Granger, Cathy O'Donnell, Paul Kelly"
11,14051,Adoration,"A complex and thought-provoking work, Atom Egoyan's Adoration works well as both mystery and engaging drama.",63%,102,48%,2182,"Director Atom Egoyan explores the concept of cyberspace as a place for redemption in this drama about an adolescent boy named Simon (Devon Bostick) who reinvents his life on the Internet. Before long, Simons deeply personal journey provokes strong reactions from around the globe. Rachel Blanchard and Scott Speedman co-star. ~ Jason Buchanan, Rovi",R (for language),"Art House & International, Drama",Atom Egoyan,Sony Pictures Classics,100 minutes,"Arsinée Khanjian, Scott Speedman, Rachel Blanchard"
12,14052,Bronson,"Undeniably gripping, Bronson forces the viewer to make some hard decisions about where the line between art and exploitation lies.",76%,82,74%,17183,"In 1974, a misguided 19 year old named Michael Peterson decided he wanted to make a name for himself and so, with a homemade sawn-off shotgun and a head full of dreams he attempted to rob a post office. Swiftly apprehended and originally sentenced to 7 years in jail, Peterson has subsequently been behind bars for 34 years, 30 of which have been spent in solitary confinement. With an intelligent, provocative and stylized approach, ""Bronson"" (based on a true story) follows the metamorphosis of Mickey Peterson into Britains most dangerous prisoner, Charles Bronson.","R (for violent and disturbing content, graphic nudity, sexuality and language)","Action & Adventure, Drama",Nicolas Winding Refn,Magnolia Pictures,92 minutes,"Tom Hardy, Jonathan Phillips, Matt King"
13,14053,Feel the Noise,"Despite the different musical genre, Feel the Noise is as generic as any music-themed film that has come before it.",12%,26,42%,109102,"A 21-year-old aspiring hip-hop star from the Bronx is forced to put his career on hold when a gang of local thugs threatens his life and he is forced to seek refuge with his estranged father in Puerto Rico in this musical drama from producer Jennifer Lopez. Rob (Omarion Grandberry) is a New York City rapper who has gotten into hot water in his hometown, and now must flee to Puerto Rico. Upon arriving at his fathers home in the Caribbean commonwealth, Rob immediately forms a bond with his half-brother, Javi, who introduces his distant sibling to the seductive sounds of Reggaeton. Rob and Javis outwardly divergent musical tastes ultimately blend to form a unique new brand of hip-hop-flavored reggae, and they soon begin to gain a loyal following that ultimately leads them both back to New York City. Yet despite Robs growing popularity in the music industry, the gangsters back in the Bronx are still hell-bent on revenge, and willing to gun him down at the first chance they get. Is Robs newfound status as a high-profile musical innovator enough to make him bulletproof, or could it be that hes more vulnerable than ever now that hes up on-stage for all the world to see?","PG-13 (for sensuality and innuendos, violence, some drug use and language)",Drama,Alejandro Chomski,Tri-Star Pictures,89 minutes,"Rosa Arredondo, Omarion Grandberry, James McCaffrey"
14,14060,Vengeance Valley,N/A,100%,5,20%,912,"The old ""Cain and Abel"" plot device is redefined within Western terms in MGMs Vengeance Valley. Burt Lancaster stars as ranch-hand Owen Daybright, who has been raised as a son by rancher Arch Stroble (Ray Collins). Strobles natural son Lee (Robert Walker) has always been envious of Owen, who in turn has spent most of his life pulling Lee out of trouble and keeping the boys misdeeds a secret from the elder Stroble. When Lee fathers an illegitimate child, he tries to shift the responsibility on Owen, leading to a life-threatening confrontation with the vengeance-seeking brothers of the babys mother (Sally Forrest). Theres plenty more plot twists before virtue finally triumphs. Joanne Dru co-stars as Lees long-suffering wife Jen, who harbors a secret yen for Owen. Since lapsing into public domain, Vengeance Valley has shown up with increasing frequency on cable television; it has also been made available in a narrated version for the visually impaired.",PG,"Action & Adventure, Classics, Western",Richard Thorpe,MGM,83 minutes,"Burt Lancaster, Joanne Dru, Sally Forrest"
15,14072,Queen Kelly,N/A,100%,7,78%,960,"A young convent girl is seduced by a European nobleman, arousing the ire of his bride-to-be Queen and eventually finding herself exiled to a brothel in East Africa. Visually striking and perverse, Erich von Stroheims last silent, from which he was discharged by Gloria Swanson, was hastily completed by her with talkie sequences.",NR,"Classics, Drama",Erich von Stroheim,Kino International,113 minutes,"Gloria Swanson, Walter Byron, Seena Owen"
16,14078,It Might Get Loud,"An affectionate tribute to rock's most distinctive instrument, It Might Get Loud is insightful and musically satisfying.",79%,115,85%,18227,"Rarely can a film penetrate the glamorous surface of rock legends. It Might Get Loud tells the personal stories, in their own words, of three generations of electric guitar virtuosos--The Edge (U2), Jimmy Page (Led Zeppelin), and Jack White (The White Stripes). It reveals how each developed his unique sound and style of playing favorite instruments, guitars both found and invented. Concentrating on the artists musical rebellion, traveling with him to influential locations, provoking rare discussion as to how and why he writes and plays, this film lets you witness intimate moments and hear new music from each artist. The movie revolves around a day when Jimmy Page, Jack White, and The Edge first met and sat down together to share their stories, teach and play.","PG (for mild thematic elements, brief language and smoking)","Documentary, Musical & Performing Arts",Davis Guggenheim,Sony Pictures Classics,98 minutes,"Jack White, Robert Plant, Jimmy Page"
17,14083,Moonfleet,N/A,69%,13,69%,503,"In the 1750s, young orphan John Mohune (Jon Whiteley) arrives at the seaside Dorset village of Moonfleet seeking Jeremy Fox (Stewart Granger), a one-time ""friend"" of his late mother, to whom she has turned over care of the boy. Fox exudes an aura of class and bravado, along with an obvious love of life and the finer things it can offer, all of which combine to make him a beguiling presence to one and all, including the larcenous, decadent local nobility (George Sanders) and a band of cut-throats led by Elzevir Block (Sean McClory), to whom he has more than a passing acquaintance. In his innocence, John -- oblivious to the fact that Jeremy runs a murderous smuggling ring -- instantly accepts this man as a loyal friend (and, indeed, a man to be loved and trusted like a parent, precisely because his mother has consigned him to his care). And Jeremy, initially disdainful of the boy, finds himself moved by the latters willingness to love him and see his better nature, which does come out (with some resistance) under his coaxing, and reluctantly becomes his guardian. But there are too many nefarious goings on in and around Moonfleet, between smugglers and the authorities pursuing them, and the Mohune familys dark history, to keep John safe from danger. His life is placed at risk when he stumbles on the secret of old ""Redbeard,"" the Mohune patriarch who betrayed law and morality, selling his soul for a priceless diamond, which has long been believed lost. Before long, young John knows too much about the smugglers for their comfort, despite Jeremys protection -- and when he accidentally discovers a clue to the location of Redbeards diamond, even Jeremy cant resist the chance for that prize, even if he has to cheat the boy out of his birthright.",NR,"Action & Adventure, Drama",Fritz Lang,Warner Bros. Classics,89 minutes,"Jon Whiteley, Stewart Granger, George Sanders"
18,14088,Post Grad,"A lightweight, unambitious comedy, Post Grad features fine actors that can do little with its middling, uninspiring script.",8%,99,27%,188306,"Recent college graduate Ryden Malby (Gilmore Girls star Alexis Bledel) has just survived four years of higher education, but when shes forced to move back into her childhood home, the stress of dealing with her eccentric family, landing a job, and finding the right guy leaves her with precious little time to ponder where her life is truly heading. Shrek and Shark Tales co-director Vicky Jenson takes the helm for a comedy co-starring Michael Keaton, Carol Burnett, Zach Gilford, and Rodrigo Santoro, and produced by Ivan Reitman and Tom Pollock in collaboration with Joe Medjuck and Jeff Clifford. ~ Jason Buchanan, Rovi",PG-13 (for sexual situations and brief strong language),Comedy,Vicky Jenson,Fox Searchlight Pictures,88 minutes,"Alexis Bledel, Zach Gilford, Rodrigo Santoro"
19,14089,Goodbye Solo,"An original and thoughtful human drama, Goodbye Solo looks at relationships and loneliness while proving director Ramin Bahrani's is an important American voice.",94%,108,82%,4930,"Goodbye Solo is the story of Solo, a kindhearted 34-year-old Senegalese taxi driver in North Carolina. He is hired by William, a tough 70-year-old white southerner, to drive him in two weeks time to a mountaintop from which William plans to jump to his death. Solo decides to charm his way into becoming Williams friend, and this odd couples unexpected friendship grows. Now all Solo has to do is change the old mans mind before the two weeks are up.",R (for language),"Comedy, Drama",Ramin Bahrani,Roadside Attractions,91 minutes,"Red West, Souleymane Sy Savane, Carmen Levya"
20,14094,My Life in Ruins,"With stereotypical characters and a shopworn plot, My Life in Ruins is a charmless romantic comedy.",9%,125,44%,280152,"Georgia (Nia Vardalos) came to Greece to follow a man. A few years later, shes been cast aside -- alone and adrift in a foreign land. Eventually, her passion for history leads her to a job as a tour guide. But Georgia is bored, and has lost her ""kefi"" (Greek for mojo) to boot. When taciturn sasquatch Poupi (Alexis Georgoulis) replaces the regular driver at the last minute, the frazzled tour guide thinks that her luck has just hit rock bottom. Thankfully, Georgias latest batch of tourists is a more lively bunch than shes anticipated, and in between bouts with rival tour guide Nico (Alistair McGowan), she manages to form a genuine connection with wisecracking widower Irv (Richard Dreyfuss), a solo vacationer who maintains a jovial facade despite the fact that he misses his late wife dearly. With a little help from Irv, Georgia comes to realize that true love may be closer than she thinks -- if she could just recapture her kefi and open her eyes. ~ Jason Buchanan, Rovi",PG-13 (for sexual content),Comedy,Donald Petrie,Fox Searchlight Pictures,95 minutes,"Nia Vardalos, Richard Dreyfuss, Alexis Georgoulis"
21,14095,Troll 2,N/A,6%,18,44%,10286,"In this ultra-cheapo Italian knock-off a little boy tries to warn his family and friends that the evil trolls his late grandfather used to tell him about are real. Unfortunately, no one believes him and he and his sister are sent to the enigmatic town of Nilbog where nightmarish things begin to happen.",PG-13,"Comedy, Horror","Drake Floyd, Drago Floyd",MGM,95 minutes,"Michael Stephenson, George Hardy, Margo Prey"
22,14101,Good,"Though ambitious, Good stumbles in the transition from stage to screen, and Mortensen's performance isn't enough to cover its flaws.",32%,71,32%,41567,"John Halder explores his personal circumstances in a novel advocating compassionate euthanasia. When the book is unexpectedly enlisted by powerful political figures in support of government propaganda, Halder finds his career rising in an optimistic current of nationalism and prosperity. Yet, with Halders change in fortune, his seemingly inconsequential decisions potentially jeopardize the people in his life with devastating effects.",R (for language),Drama,Vicente Amorim,ThinkFilm,95 minutes,"Viggo Mortensen, Jason Isaacs, Jodie Whittaker"
23,14104,Taking Woodstock,"Featuring numerous 60s-era clichés, but little of the musical magic that highlighted the famous festival, Taking Woodstock is a breezy but underwhelming portrayal.",48%,182,47%,252396,"Its 1969, and Elliot Tiber, a down-on-his-luck interior designer in Greenwich Village, New York, has to move back upstate to help his parents run their dilapidated Catskills motel, The El Monaco. The banks about to foreclose; his father wants to burn the place down, but hasnt paid the insurance; and Elliot is still figuring how to come out to his parents. When Elliot hears that a neighboring town has pulled the permit on a hippie music festival, he calls the producers, thinking he could drum up some much-needed business for the motel. Three weeks later, half a million people are on their way to his neighbors farm in White Lake, N.Y., and Elliot finds himself swept up in a generation-defining experience that would change his life, and American culture, forever. The film features a standout ensemble cast and songs from a score of 60s musical icons, including The Grateful Dead, The Doors, Jefferson Airplane and Country Joe and the Fish -- plus a new recording of ""Freedom"" from Richie Havens.","R (for graphic nudity, some sexual content, drug use and language)","Comedy, Drama, Musical & Performing Arts",Ang Lee,Focus Features,121 minutes,"Henry Goodman, Demetri Martin, Emile Hirsch"
24,14106,If These Walls Could Talk,N/A,88%,8,74%,6129,"Covering 40 years, this anthology is about three disparate women coping with unexpected pregnancies. The first takes place in 1952 and centers on recently widowed Claire. The second takes place in 1974 when Barbara, who already has four kids, tackles another one. The last is 1996 when Christine contemplates abortion.",R,"Drama, Television","Cher, Nancy Savoca",HBO Video,95 minutes,"Cher, Demi Moore, Sissy Spacek"
25,14108,Halloween II,Halloween II picks up where its predecessor left off - and quickly wanders into a dead end that the franchise would spend decades struggling to find its way out of.,28%,39,63%,76965,"Shaken and injured from her battle with unkillable psycho Michael Myers, Laurie Strode is taken to the Haddonfield Hospital for observation, while Dr. Sam Loomis continues his desperate search for his monstrous patient. After slashing his way through the town, Myers manages to track Laurie to the hospital. Numerous night-shift employees are slaughtered in a variety of gruesome ways as Myers closes in on his fixation.",R,"Drama, Horror","John Carpenter, Rick Rosenthal",Universal Pictures,93 minutes,"Jamie Lee Curtis, Jeffrey Kramer, Charles Cyphers"
