,dataIndex,realTitle,criticsConcensus,tomatoMeter,tomatoCount,audienceScore,audienceCount,realSynopsis,rating,genreString,directedBy,studio,runTime,cast
110,14436,Wattstax,N/A,86%,22,89%,746,"The climactic concert of the seventh annual Watts Summer Festival, commemorating the 1965 riots, and featuring performances by Isaac Hayes, Luther Ingram, Richard Pryor, and many more.",R,"Documentary, Musical & Performing Arts, Special Interest",Mel Stuart,Columbia Pictures,98 minutes,"Richard Pryor, Albert King, Carla Thomas"
111,14440,A Film with Me in It,N/A,62%,13,60%,792,"Director Ian Fitzgibbon crafts this darkly comic tale, produced and set in Ireland, about a dissolute scriptwriter and a dejected actor who become unwittingly drawn into a labyrinthine mess when several people experience bizarre accidental deaths in their flat. Though the men didnt deliberately cause any of the incidents, they fear that they will be unfairly pegged as murderers if they relay information to the cops, and promptly set about disposing of the corpses in gruesome ways. Meanwhile, as the hapless victims of fate wage a valiant battle to take control of their bizarre situation, their gruff landlord makes an already tense situation absolutely unbearable. Dylan Moran, Mark Doherty, and Keith Allen star. ~ Jason Buchanan, Rovi",NR,"Comedy, Mystery & Suspense",Ian Fitzgibbon,Maximum Film Distribution,88 minutes,"Dylan Moran, Keith Allen, Amy Huberman"
112,14460,Home Movie,N/A,87%,38,73%,1601,"The old saying has it that a persons home is their castle, and this documentary takes a witty look at five unusual homes that have been designed to match the ideas and eccentricities of the people who own them. Ben Skora is a self-styled inventor who has tricked out his Illinois home with a variety of unusual gadgets, among them a nine-foot-tall robot. Linda Beach, an American actress who enjoyed a successful career in Japanese television, lives in a tree house in Hawaii that draws its power from a nearby waterfall. Bill Tragles home is also close to the water, as the Louisiana alligator rancher shows off his luxurious houseboat. Ed Pedan and his wife Diana Pedan have made a home out of an abandoned underground complex in Kansas, built and then abandoned by the American military. And Bob Walker and Francis Mooney designed their home not with their own needs in mind, but those of their 11 pet cats. Directed by Chris Smith, who previously made the acclaimed documentaries American Job and American Movie, Home Movie had its premiere at the 2001 Sundance Film Festival.",NR,"Documentary, Special Interest",Chris Smith,Cowboy Pictures,65 minutes,"Bill Tregle, Ben Skora, Darlene Satrinano"
113,14461,Sleep Dealer,Sleep Dealer's depth and energy are almost enough to overcome a shaky screenplay and pedestrian acting.,70%,33,50%,116324,"Mexico. The near future. Memo Cruz has always dreamed of leaving his tiny village and heading north. But, when he is ultimately forced to leave, Memo finds a future so bizarre--border walls, shantytowns, hi-tech factories, remote control drones and aqua-terrorists--that it looks a lot like today.",PG-13 (for some violence and sexuality),"Art House & International, Science Fiction & Fantasy",Alex Rivera,Maya Releasing,90 minutes,"Luis Fernando Pena, Leonor Varela, Jacob Vargas"
114,14465,The Blind Side,"It might strike some viewers as a little too pat, but The Blind Side has the benefit of strong source material and a strong performance from Sandra Bullock.",66%,201,85%,431713,"Taken in by a well-to-do family and offered a second chance at life, a homeless teen grows to become the star athlete projected to be the first pick at the NFL draft in this sports-themed comedy drama inspired by author Michael Lewis best-seller The Blind Side: Evolution of a Game. Michael Oher was living on the streets when he was welcomed into the home of a conservative suburban family, but over time he matured into a talented athlete. As the NFL draft approaches, fans and sports radio personalities alike speculate that Oher will be the hottest pick of the year. Sandra Bullock stars in a film written and directed by John Lee Hancock (The Rookie, The Alamo). ~ Jason Buchanan, Rovi","PG-13 (for one scene involving brief violence, drug and sexual references)","Comedy, Drama, Sports & Fitness",John Lee Hancock,Warner Bros. Pictures,129 minutes,"Sandra Bullock, Tim McGraw, Quinton Aaron"
115,14484,Planet 51,"Planet 51 squanders an interesting premise with an overly familiar storyline, stock characters, and humor that alternates between curious and potentially offensive.",22%,108,40%,357042,"Planet 51 is a galactic-sized animated alien adventure comedy revolving around American astronaut Captain Charles ""Chuck"" Baker, who lands on Planet 51 thinking hes the first person to step foot on it. To his surprise, he finds that this planet is inhabited by little green people who are happily living in a white picket fence world reminiscent of a cheerfully innocent 1950s America, and whose only fear is that it will be overrun by alien invaders...like Chuck! With the help of his robot companion ""Rover"" and his new friend Lem, Chuck must navigate his way through the dazzling, but bewildering, landscape of Planet 51 in order to escape becoming a permanent part of the Planet 51 Alien Invaders Space Museum.",PG (for mild sci-fi action and some suggestive humor),"Action & Adventure, Animation, Comedy, Kids & Family",Jorge Blanco,Sony Pictures/TriStar Pictures,91 minutes,"Dwayne Johnson, Jessica Biel, Justin Long"
116,14485,Me and Orson Welles,Me and Orson Welles boasts a breakout performance by Christian McKay and an infectious love of the backstage drama that overcomes its sometimes fluffy tone.,85%,156,61%,17889,"In a whirlwind week in 1937 in New York City, a young aspiring actor named Richard is thrown into the middle of Orson Welles Mercury Theatre Company on the eve of the opening of Welles historic staging of Shakespeares Julius Caesar. During this week he will find romance with a worldly older woman, becomes immersed in a creative experience few are afforded and learn the downside of crossing the imperious, brilliant Welles. Richard is about to grow up fast.",PG-13 (for sexual references and smoking),"Art House & International, Comedy, Drama",Richard Linklater,Freestyle Releasing,119 minutes,"Zac Efron, Claire Danes, Christian McKay"
117,14486,Objectified,N/A,81%,16,76%,1340,"A documentary that examines the complex relationship people have with manufactured objects and, by extension, the people who design them. Its a look at the creativity at work behind everything from toothbrushes to tech gadgets. Its about the designers who re-examine, re-evaluate and re-invent our manufactured environment on a daily basis. Its about personal expression, identity, consumerism, and sustainability.",NR,"Documentary, Musical & Performing Arts, Special Interest",Gary Hustwit,Plexifilm,76 minutes,"Jonathan Ive, Chris Bangle, Karim Rashid"
118,14488,Trucker,Excellent performances by Michelle Monaghan and Nathan Fillion and keenly-observed details of small town life elevate this otherwise predictable and inconsistent melodrama.,59%,37,58%,1542,"Michelle Monaghan stars as a self-reliant trucker forced to take on the responsibility of caring for her 11-year-old son when his father (Benjamin Bratt) ends up in the hospital in this independent drama from Plum Pictures. James Mottern directs from his own script, with Nathan Fillion, Joey Lauren Adams, and Jimmy Bennett set to co-star. ~ Jeremy Wheeler, Rovi","R (for some sexuality, language, brief drug use involving minors, and a sexual assault)",Drama,James Mottern,Monterey Media Inc.,93 minutes,"Michelle Monaghan, Nathan Fillion, Benjamin Bratt"
119,14494,Invictus,"Delivered with typically stately precision from director Clint Eastwood, Invictus may not be rousing enough for some viewers, but Matt Damon and Morgan Freeman inhabit their real-life characters with admirable conviction.",76%,242,75%,211891,"The film tells the inspiring true story of how Nelson Mandela joined forces with the captain of South Africas rugby team to help unite their country. Newly elected President Mandela knows his nation remains racially and economically divided in the wake of apartheid. Believing he can bring his people together through the universal language of sport, Mandela rallies South Africas underdog rugby team as they make an unlikely run to the 1995 World Cup Championship match.",PG-13 (for brief strong language),"Drama, Sports & Fitness",Clint Eastwood,Warner Bros. Pictures,134 minutes,"Morgan Freeman, Matt Damon, Tony Kgoroge"
120,14495,Carla's Song,N/A,86%,7,80%,2308,"Britains political firebrand Ken Loach goes to 80s Nicaragua, for a Contra-indicated romance between a political refugee and a Scots bus driver. Earnest, infuriating.",NR,"Drama, Romance",Ken Loach,Shadow Distribution,127 minutes,"Robert Carlyle, Salvador R. Espinoza, Oyanka Cabezas"
121,14497,Everybody's Fine,N/A,78%,9,87%,689,"In this moving Italian drama from filmmaker Giuseppe Tornatore--who had international success with his previous film Cinema Paradiso--an elderly Sicilian gentleman embarks upon a long journey across Italy to bring his five estranged, grown children back together again.",PG-13,"Art House & International, Comedy, Drama",Giuseppe Tornatore,Erre Produzioni,115 minutes,"Marcello Mastroianni, Michèle Morgan, Marino Cenna"
122,14498,Two Rode Together,N/A,80%,5,52%,787,"Guthrie McCabe (James Stewart) is the sheriff of a town near an army outpost. Lieutenant Gray (Richard Widmark) recruits Guthrie to help rescue the children of white settlers who have been kidnapped by the Comanche Indians. He agrees for two reasons. The first, local saloon owner Belle (Annelle Hayes) has her matrimonial eye on Guthrie. The second reason is the $500 per person reward for bringing the kidnapped victims back to the fort. The sheriff and the lieutenant ride off to meet the Indians in this film directed by John Ford.",G,Western,John Ford,Columbia Pictures,109 minutes,"James Stewart, Richard Widmark, Shirley Jones"
123,14499,Armored,This B-grade thriller has a good cast and director but is undone by plot holes and messy conclusion.,40%,55,31%,205084,"Vacancy director Nimród Antal helms the crime thriller Armored, starring Columbus Short as Ty, an armored truck guard who gets wrapped up in a heist scheme hatched by his godfather and mentor on the job, Mike (Matt Dillon). Along with a team that includes Laurence Fishburne, Jean Reno, and Skeet Ulrich, the group makes off with a shipment of 40 million dollars, but things start to unravel when one of them kills a homeless man as they stash the cash. Ty, who almost didnt sign on to the job but caved when his house was on the verge of foreclosure and his brother nearly taken out of his custody by Child Welfare, breaks from the plan and locks himself in one of the armored trucks until he figures out a way out of the deadly scenario. While Ty is trapped inside the truck with half of the loot, the rest of the crew has only so much time before theyre reported missing, bringing life-or-death decisions to a heist where no blood was to be spilled. Things get further complicated when a patrol officer (Milo Ventimiglia) comes snooping around the warehouse district where the crew has been hiding. ~ Jeremy Wheeler, Rovi","PG-13 (for sequences of intense violence, some disturbing images and brief strong language)","Drama, Mystery & Suspense",Nimród Antal,Sony/Screen Gems,88 minutes,"Matt Dillon, Jean Reno, Laurence Fishburne"
124,14500,Transylmania,N/A,0%,21,21%,2310,"A group of college students embarks on a wild, sexy and outrageous semester abroad at Razvan University. Located deep in the heart of the ""cursed land"" of Transylvania in a centuries-old castle, Razvan isnt your typical institution of higher learning. The black leather-clad professors, three-foot-tall dean, instruction in crucifix-wielding, and topless vampiresses lurking in dark corners are just the start. It seems Castle Razvan was the property of the feared Vampire King Radu in the Dark Ages and hes come back to reclaim it.","R (for crude and sexual content, nudity, drug use, language and some violence)",Comedy,"David Hillenbrand, Scott Hillenbrand",Full Circle Releasing,92 minutes,"James DeBello, Jennifer Lyons, Patrick Cavanaugh"
125,14501,Invaders from Mars,N/A,82%,11,55%,2760,"Originating during the science-fiction/Red-Scare boom of the 50s, Invaders From Mars is an entertaining little picture that holds up reasonably well. David MacLean (Jimmy Hunt) is a 12-year-old astronomy buff who is stunned to see a flying saucer landing in the sand pit beyond his backyard. His father, George (Leif Erickson), ventures out to look the next morning and mysteriously disappears. Davids mother, Mary (Hillary Brooke), worriedly calls police, but they are quickly swallowed up by the sand in the backyard. Later, George and the two cops return, but their personalities are markedly different having been taken over by the Martians. As David tries to find help, everyone around him comes under the frightening zombie-like spell. He finally encounters two believers in Dr. Blake (Helena Carter) and Dr. Kelston (Arthur Franz). Discovering Davids shocking story to be true, the doctors call in the military setting up a confrontation that escalates when David and Dr. Blake are taken captive within the Martian craft. The soldiers race to save the pair from the green menace leading to an explosive finale that involves bullets, grenades, TNT, and a spectacular alien ray gun that can melt stone.",NR,"Classics, Science Fiction & Fantasy",William Cameron Menzies,20th Century Fox Film Corporation,78 minutes,"Arthur Franz, Helena Carter, Leif Erickson"
126,14502,Link,N/A,25%,8,33%,1404,"Richard Franklin directed this horror film that plays like Jane Goodall in Gaslight. Elisabeth Shue is Jane Chase, a graduate student in zoology who volunteers to help Dr. Steven Phillip (Terence Stamp), a professor at the university, with his animal studies. Arriving at his mansion, she is greeted by Link, a orangutan dressed in a monkey suit. Jane gets to know Link and Dr. Phillips other chimp charges, Imp and Voodoo. One day Dr. Phillip goes to town, supposedly to sell Voodoo, but instead, Voodoo is found dead at the mansion. Link then proceeds to ignore Janes commands and starts pushing Imp around. When Dr. Phillips friend Bailey (Kevin Lloyd) arrives to take Voodoo away, Link becomes aggressive and chases Bailey away from the mansion. Jane later realizes Link is holding her prisoner in the mansion, not allowing her through the door and keeping the telephone away from her. Link is now out for blood, and the blood belongs to Jane.","R (adult situations/language, nudity, violence)","Art House & International, Horror, Mystery & Suspense",Richard Franklin,HBO Video,103 minutes,"Terence Stamp, Elisabeth Shue, Steven Pinner"
127,14503,Doghouse,"An amateurish, unfunny and unscary British horror-comedy that could be accused of misogyny.",48%,23,46%,4395,"This British horror comedy concerns a group of men suffering from midlife crises, who embark on a relaxing country weekend but wind up in a village overrun by psychotic and cannibalistic female creatures. ~ Nathan Southern, Rovi",NR,"Art House & International, Comedy, Horror",Jake West,Vertigo Films,89 minutes,"Danny Dyer, Noel Clarke, Stephen Graham"
128,14506,The Art Of Travel,N/A,63%,8,51%,732,"A man who planned to marry his high school sweetheart, buy a house with a white picket fence, and raise a family kisses his dreams of suburban bliss goodbye in order to travel through a hundred mile section of Central and South American jungle known as the Darien Gap in this adventure starring Christopher Masterson, Brooke Burns, Johnny Messner, and James Duval.",R (for language and some nudity),"Action & Adventure, Art House & International, Drama, Romance",Thomas Whelan,First Look Studios,100 minutes,"Brooke Burns, Tommy Savas, Bijou Phillips"
129,14515,Moonrise,N/A,100%,9,74%,265,"A man is taunted by home-town schoolmates after his fathers execution for murder, and he finds his only solace in his girlfriend. One youth pushes him over the edge, and he is forced to kill in self-defense. His girlfriend urges him to face the authorities, but he wants to flee.",PG,"Classics, Drama",Frank Borzage,Republic,90 minutes,"Dane Clark, Gail Russell, Ethel Barrymore"
130,14542,Make the Yuletide Gay,N/A,40%,5,63%,505,"An out-and-proud college student wrestles with revealing his true sexuality to his parents when he comes home for Christmas break and his boyfriend decides to pay him a surprise visit. At school, everyone knows that Olaf ""Gunn"" Gunnunderson is gay; at home, its a much different story. Bidding his boyfriend Nathan goodbye, Olaf heads home to find that his parents have fixed him up on a date with his old high school sweetheart Abby. When Nathan comes knocking unannounced, he cant quite believe that Olaf hasnt come out to his parents. Later, as the boys scramble to keep Olafs sexuality a secret from his parents, the conversations grow increasingly inquisitive and Olaf must decide whether to come out before the truth does.",NR,"Comedy, Gay & Lesbian",Rob Williams,TLA Releasing,89 minutes,"Keith Jordan, Adamo Ruggiero, Hallee Hirsh"
131,14549,Alice,N/A,22%,9,80%,186,"Director Nick Willing puts a new twist on Lewis Carrolls classic tale in this fantasy mini-series depicting Alice as a 21 year old women who ventures into Wonderland in search of a lost love. Almost immediately after presenting Alice (Catarina Scorsone) with an ornate family ring, handsome Jack Chase (Philip Winchester) is abducted by a pair of hulking brutes. Approached by a well-dressed man named White Rabbit (Alan Gray) who claims to know Jacks whereabouts, Alice follows the bearded stranger into a mirror and finds herself in a surreal new world of fantasy and wonder. When the Queen of Hearts (Kathy Bates) discovers her son bestowed a virtual stranger the ring that gives its owner power over the looking glass, its up to Alice to determine what she should do with it. Harry Dean Stanton, Tim Curry, Matt Frewer, and Colm Meany co-star. ~ Jason Buchanan, Rovi",NR,Science Fiction & Fantasy,Nick Willing,LionsGate Entertainment,184 minutes,"Caterina Scorsone, Kathy Bates, Philip Winchester"
132,14551,Avatar,"It might be more impressive on a technical level than as a piece of storytelling, but Avatar reaffirms James Cameron's singular gift for imaginative, absorbing filmmaking.",82%,310,82%,1382184,"""Avatar"" is the story of an ex-Marine who finds himself thrust into hostilities on an alien planet filled with exotic life forms. As an Avatar, a human mind in an alien body, he finds himself torn between two worlds, in a desperate fight for his own survival and that of the indigenous people.","PG-13 (for intense epic battle sequences and warfare, sensuality, language and some smoking)","Action & Adventure, Comedy, Mystery & Suspense, Science Fiction & Fantasy",James Cameron,20th Century Fox,162 minutes,"Zoe Saldana, Sam Worthington, Sigourney Weaver"
133,14552,Nine,"It has a game, great-looking cast, led by the always worthwhile Daniel Day-Lewis, but Rob Marshall's Nine is chaotic and curiously distant.",39%,206,37%,109384,"""Nine"" is a vibrant and provocative musical that follows the life of world famous film director Guido Contini as he reaches a creative and personal crisis of epic proportion, while balancing the numerous women in his life including his wife, his mistress, his film star muse, his confidant and costume designer, an American fashion journalist, the whore from his youth and his mother.",PG-13 (for sexual content and smoking),"Drama, Musical & Performing Arts, Romance",Rob Marshall,The Weinstein Co.,113 minutes,"Nicole Kidman, Marion Cotillard, Daniel Day-Lewis"
134,14557,Sherlock Holmes,"Guy Ritchie's directorial style might not be quite the best fit for an update on the legendary detective, but Sherlock Holmes benefits from the elementary appeal of a strong performance by Robert Downey, Jr.",69%,242,77%,769233,"The mysterious action-adventure, ""Sherlock Holmes"" staged by the renowned filmmaker Guy Ritchie for Warner Bros. Pictures and Village Roadshow Pictures. Robert Downey Jr., the legendary detective borrows its shape, and Jude Law plays Holmes reliable Mr Watson, of Sherlock Holmes as a doctor and war veteran actively supported.","PG-13 (for intense sequences of violence and action, some startling images and a scene of suggestive material)","Action & Adventure, Drama, Mystery & Suspense",Guy Ritchie,Warner Bros. Pictures/Village Roadshow,129 minutes,"Robert Downey Jr., Jude Law, Rachel McAdams"
135,14558,Crazy Heart,"Thanks to a captivating performance from Jeff Bridges, Crazy Heart transcends its overly familiar origins and finds new meaning in an old story.",90%,207,76%,124766,"Bad Blake is a broken-down, hard-living country music singer whos had way too many marriages, far too many years on the road and one too many drinks way too many times. And yet, Bad cant help but reach for salvation with the help of Jean, a journalist who discovers the real man behind the musician. As he struggles down the road of redemption, Bad learns the hard way just how tough life can be on one mans crazy heart.",R (for language and brief sexuality),"Drama, Musical & Performing Arts, Romance",Scott Cooper,Fox Searchlight Pictures,112 minutes,"Jeff Bridges, Maggie Gyllenhaal, Beth Grant"
136,14563,Uncertainty,"Uncertainty benefits from an evocative setting and likable leads, but its gimmicky gambit fails to pay off, fatally undermining its impact.",50%,26,33%,2482,"Responsibility clashes with freedom as a young New York City couple experiences two decidedly different holidays in this drama from filmmaking duo David Siegel and Scott McGehee (Suture, The Deep End). Its the Fourth of July, and Kate (Lynn Collins) and Bobby (Joseph Gordon-Levitt) are struggling to make a decision: do they stick with tradition and spend the weekend with Kates family, or do they set out on their own for a spontaneous adventure? After making their initial decision, an alternate narrative emerges to show just what would have happened had they chosen to do otherwise. While the decision-making process may seem mundane, the implications of each choice are profound. Sure, a holiday with the family doesnt seem nearly as exciting as an impromptu romantic trip, but that doesnt mean it will be any less dramatic. As the stories diverge and a ""what if"" scenario becomes reality, it soon becomes apparent how much one seemingly minor decision can ultimately affect the rest of our lives. ~ Jason Buchanan, Rovi",PG,Drama,"David Segel, Scott McGehee",IFC Films,101 minutes,"Joseph Gordon-Levitt, Lynn Collins, Assumpta Serna"
137,14566,Film Geek,"Charming despite its central character's unfortunate personality traits, Film Geek serves as a slight yet amusing calling card for writer-director James Westby.",64%,22,34%,910,"A socially inept video store clerk forges a tenuous friendship with a pretty downtown hipster after being fired from his job in Oregon-based director James Westbys quirky tale of geek love among the twenty-something set. Scotty Pelk (Melik Malkasian) may not be able to relate to his peers at the video store so well, but his knowledge of film is encyclopedic. A nuisance to the customers and an endless source of annoyance to his coworkers, Scotty takes solace in a friendly hipster named Niko (Tyler Gannon) after being unceremoniously fired the job that he loves. With his film website failing and no one but Niko to turn to, Scottys feeling for Niko begin to move beyond the realm of friendship and into the romantic despite the constant interference of Nikos obsessive ex-boyfriend Brandon - who isnt about to let the girl he loves end up with a video store reject who cant even find friends on the internet. But thanks to Niko, Scottys life is taking a turn for the better, and after experience what a small dose of confidence can do for a mans sense of self-worth Scotty is finally prepared to show just how far a deep love of film and a keen eye for criticism can actually get one in life.",R,Comedy,James Westby,First Run Features,72 minutes,"Melik Malkasian, Tyler Gannon, Matt Morris"
138,14569,Beyond a Reasonable Doubt,N/A,71%,17,55%,721,"A newspaper publisher convinces a writer to falsely produce circumstantial evidence in a murder investigation to incriminate himself, thus proving that such evidence is useless. His evidence is so convincing that he is unable to prove his innocence.",NR,"Drama, Mystery & Suspense",Fritz Lang,RKO Pictures,80 minutes,"Dana Andrews, Joan Fontaine, Sidney Blackmer"
