,dataIndex,realTitle,criticsConcensus,tomatoMeter,tomatoCount,audienceScore,audienceCount,realSynopsis,rating,genreString,directedBy,studio,runTime,cast
240,15053,Tillie's Punctured Romance,N/A,83%,6,44%,972,"This Keystone comedy, Charlie Chaplins 33rd, is the first feature-length comedy ever made and contributed to making Chaplin and his co-star Marie Dressler major stars. Chaplin plays a con artist (not the Tramp) who talks Tillie, an innocent country lass, into taking her fathers savings and running off to the city with him. Once there, he re-establishes his affair with the beautiful Mabel Normand, abandoning Tillie, who must begin working at a restaurant, while Charlie and Mabel spend her fathers money for new clothes. Meanwhile, Tillies millionaire uncle is reported to have died in a mountain-climbing accident. When the opportunistic Charlie learns that Tillie has just inherited three million dollars, he immediately rushes over to propose. She joyfully accepts, but is suspicious when she learns of her inheritance. Later, at a wedding gala at Tillies new mansion where Normand has begun working as a maid, Charlie sneaks off for a little tete-a-tete with the latter. Trouble erupts when Dressler catches them smooching. Suddenly all the slapstick craziness for which director Mack Sennett is famous erupts as Tillie grabs a pistol and begins chasing Charlie and Mabel, firing randomly. Just as the wayward Charlie is to be strangled to death, the ""late"" uncle suddenly appears and ejects all the celebrants. Charlie and Mabel, chased by Tillie, race out of the ruined mansion to a pier where they are followed by the ubiquitous Keystone Kops whom the uncle has summoned. Tillie ends up in the drink, and when rescued after numerous attempts, she rejects Charlie while consoling Mabel, saying, ""He aint no good to neither of us,"" as the Kops drag Charlie away.",NR,"Classics, Comedy","Charles Bennett, Mack Sennett",Keystone Film Company,73 minutes,"Charles Chaplin, Marie Dressler, Mabel Normand"
241,15054,The Runaways,"Viewers expecting an in-depth biopic will be disappointed, but The Runaways is as electric as the band's music, largely thanks to strong performances from Michael Shannon, Dakota Fanning, and Kristen Stewart.",69%,186,55%,86165,"The film follows two friends, Joan Jett and Cherie Currie, as they rise from rebellious Southern California kids to rock stars of the now legendary group that paved the way for future generations of girl bands. Joan and Cherie fall under the Svengali-like influence of rock impresario Kim Fowley, played by Michael Shannon, who turns the group into an outrageous success and a family of misfits. With its tough-chick image and raw talent, the band quickly earns a name for itself -- and so do its two leads: Joan is the bands pure rock n roll heart, while Cherie, with her Bowie-Bardot looks, is the sex kitten.","R (for language, drug use and sexual content -- all involving teens)","Comedy, Drama, Musical & Performing Arts",Floria Sigismondi,Apparition,107 minutes,"Kristen Stewart, Dakota Fanning, Michael Shannon"
242,15060,It! The Terror From Beyond Space,N/A,69%,16,44%,1083,"One of the best of the medium-budgeted science fiction flicks of the 1950s, It! The Terror from Beyond Space is set in ""the future"" (1973, to be exact). An rescue ship travels out to Mars to retrieve the only survivor of a space probe that has experienced some sort of cataclysm. That survivor, Col Ed Carruthers (Marshall Thompson) is accused of murdering his fellow crewmen. But Ed claims that the killer was a Martian monster, and hopes to prove his assertions by signing up for a second journey to the Red Planet. Before long, the crew members of this second expedition are being systematically killed off, and it looks as though Ed is up to his old tricks. As it turns out, however, Ed was telling the truth: there is a monster on board, the savage descendant of the once-mighty Martian civilization, who snuck on board when an irresponsible crew member left the door open. The monster stays alive by absorbing the vital body fluids of its victims-and there seems to be no way to stop this parasitic creature! If the plot of It! The Terror from Beyond Space seems vaguely familiar, it is because it was one of the primary inspirations for the 1979 sci-fi classic Alien.",NR,"Classics, Horror, Science Fiction & Fantasy",Edward L. Cahn,MGM,68 minutes,"Marshall Thompson, Shawn Smith, Kim Spalding"
243,15067,The Black Waters of Echo's Pond,N/A,22%,18,18%,1051,"Robert Patrick and Danielle Harris headline this satanic shocker about a group of friends who discover a malevolent board game that unleashes the forces of hell through pent-up emotions. It was supposed to be a relaxing getaway for nine close friends, a carefree trip to a private island far-removed from the cares of the real world. Upon arriving at their gorgeous Victorian home retreat, one member of the group discovers a bizarre game hidden beneath the basement stairwell. Before long the group is gathered around the table, eager to learn the rules and have some fun. But this is no ordinary game, because with each roll of the dice the seething anger that everyone struggles to suppress boils over into a diabolical rage of murder and bloodlust. ~ Jason Buchanan, Rovi","R (for bloody horror violence and gore, language, drug use and some sexuality/nudity)","Horror, Mystery & Suspense",Gabriel Bologna,Parallel Media,92 minutes,"Danielle Harris, James Duval, Nick Mennell"
244,15069,Razorback,N/A,67%,6,49%,2832,"Before he directed the cult classic Highlander (1986), music video creator Russell Mulcahy adapted this stylish, tongue-in-cheek horror film from the novel by Peter Brennan. Gregory Harrison stars as Carl Winters, a grief-stricken American husband who has come to a remote corner of Australia to seek answers in the death of his wife, a TV journalist who was investigating a story on kangaroo poaching. Carl meets Jake Cullen (Bill Kerr), a man obsessed with hunting down what he says is an enormous razorback boar that consumed his grandson. Although he was acquitted, most of the locals believe that Jake murdered the boy himself and invented the crazy story about a giant pig. Jake tells Carl that he believes the razorback is also responsible for his wifes death. At first skeptical, Carl becomes a believer when he encounters the beast. He and Jake track it to a dog food processing plant, where the owners are illegally butchering kangaroos for industrial use. The factory operators are also feeding the dog food to the gigantic razorback, increasing its size and carnivorous appetite. Joined by farmer Sarah Cameron (Arkie Whiteley), Carl and Jake set out to kill the powerful mutant. ~ Karl Williams, Rovi","R (adult situations/language, violence)","Art House & International, Horror","Russell Mulcahy, Arch Nicholson (II)",Warner Home Video,96 minutes,"Gregory Harrison, Arkie Whiteley, Bill Kerr"
245,15072,Until the Light Takes Us,N/A,46%,24,57%,898,"""Until The Light Takes Us"" tells the story of black metal. Part music scene and part cultural uprising, black metal rose to worldwide notoriety in the mid-nineties when a rash of suicides, murders, and church burnings accompanied the explosive artistic growth and output of a music scene that would forever redefine what heavy metal is and what it stands for to other musicians, artists and music fans world-wide. The film goes behind the highly sensationalized media reports of ""Satanists running amok in Europe"" to examine the complex and largely misunderstood principles and beliefs that led to this rebellion against both Christianity and modern culture. To capture this on film, directors Aaron Aites and Audrey Ewell moved to Norway and lived with the musicians for several years, building relationships that allowed them to create a surprisingly intimate portrait of this violent, but ultimately misunderstood, movement. The result is a poignant, moving story thats as much about the idea that reality is composed of whatever the most people believe, regardless of whats actually true, as it is about a music scene that blazed a path of murder and arson across the northern sky.",NR,"Documentary, Musical & Performing Arts, Special Interest","Aaron Aites, Audrey Ewell",Variance Films,93 minutes,"Varg Vikernes, Gylve ""Fenriz"" Nagell, Varg ""Count Grishnackh"" Vikernes"
246,15078,Waking Sleeping Beauty,"It doesn't probe as deep -- or tell as many hard truths -- as it could have, but Don Hahn's look at Disney's rebirth offers a fascinating and surprisingly candorous glimpse into the studio's past.",71%,51,80%,4273,"Walt Disney Pictures has been the leading name in animated filmmaking since the 1930s, but the studios crown was looking more than a little tarnished in the 1980s after a series of expensive commercial and critical disappointments such as The Fox and the Hound, The Black Cauldron, and The Great Mouse Detective. At that time, a handful of Disney executives were questioning the wisdom of continuing to make animated films, as the company was making more money in live-action movies, theme parks, and television. That changed when Roy Disney -- Walts nephew and the last figure from the studios Golden Age management team still on board -- teamed up with newly hired studio executives Michael D. Eisner and Jeffrey Katzenberg to restore their reputation for both quality and commercial appeal. With the success of Who Framed Roger Rabbit in 1988, the team sparked a new interest in animation on the big screen, and a string of smash hits that began with The Little Mermaid and Beauty and the Beast launched a new era of both acclaim and box-office success for the company. But those successes didnt come without behind-the-scenes conflict, and Don Hahn, a longtime producer at Disney, offers an inside look at the creative squabbles and battles amongst the management that came during Disneys climb back to the top of Hollywoods mountain in the documentary Waking Sleeping Beauty. Along with behind-the-scenes footage and rare personal artwork created by the studios animation staff (including some unflattering cartoons of their bosses), the film includes interviews with many key figures of this era in Disney history, and several people who enjoyed greater success after leaving the company, such as Tim Burton and John Lasseter. Waking Sleeping Beauty was an official selection at the 2009 Toronto International Film Festival. ~ Mark Deming, Rovi",PG (for some thematic elements and brief mild language),"Documentary, Television",Don Hahn,Walt Disney Pictures,86 minutes,"Don Bluth, Tim Burton, John Lasseter"
247,15082,The Case for Christ,"The Case for Christ shouldn't be dismissed, but like many faith-based productions, it's better at preaching to the choir than reaching the unconverted.",59%,27,92%,24,"A hard-driving journalist, Lee Strobel was exactly where he expected to be at work: on top. His award-winning investigative reporting recently earned him a promotion to legal editor at the ChicagoTribune. But things werent going nearly as well at home where his wife Leslies newfound faith in Christ went against everything Lee believed-or didnt believe-as an avowed atheist. Utilizing his journalistic and legal training, Lee begins a quest to debunk the claims of Christianity in order to save his crumbling marriage. Chasing down the biggest story of his career, Lee comes face-to-face with unexpected results that could change everything he knows to be true. Based on Lee Strobels award-winning bestselling book and starring Mike Vogel, Erika Christensen, Faye Dunaway, and Robert Forster, THE CASE FOR CHRIST opens in theaters April 7. Its an ideal Easter-season movie for anyone who has ever pondered the existence of God ... and what role He could play in their lives.","PG (for thematic elements including medical descriptions of crucifixion, and incidental smoking.)",Drama,Jon Gunn,Pure Flix,112 minutes,"Mike Vogel, Erika Christensen, Robert Forster"
248,15084,Hot Millions,N/A,60%,5,74%,421,"This comedy finds a veteran crook turning to modern computer technology to steal money from various companies. Even before he is released from jail Caesar (Peter Ustinov) is planning his high-tech heist. He cons American executive Klemper (Karl Malden) and sets up three bogus companies to receive funds from the corporate office. Klempers faithful assistant Gnatpole (Bob Newhart) is suspicious and investigates the unusual activities. Smith (Robert Morley) gives Caesar the computer lesson that puts him on the fast track to thievery. Caesar marries Patty (Maggie Smith), who surprises her husband by earning more money than her crooked spouse by honest means. Cesar Romero is the smiling customs official who lets Caesar pass through with a bagful of money from the crime while Klempers jar of instant coffee falls under suspicion.",G,Comedy,Eric Till,MGM,105 minutes,"Peter Ustinov, Maggie Smith, Karl Malden"
249,15085,Desperate Journey,N/A,67%,9,67%,129,"Errol Flynn are the on-screen spark plugs in this bracing propaganda yarn, which relies on the personalities of its casts as well as the lively direction of Raoul Walsh to overcome the improbabilities of its plot. In 1942, a lone RAF bomber flying deep into Germany (just inside the old Polish border) is shot down after completing its mission. The skipper is killed, and left in command is Flight Lieutenant Terry Forbes (Errol Flynn), an Australian who plans on leaving damage behind on the ground so the Germans remember him, even if he doesnt make it back to England. The rest of the crew consists of brash American bombardier Johnny Hammond (Ronald Reagan), bookish Canadian navigator Jed Forrest (Arthur Kennedy), wide-eyed Flight Sergeant Lloyd Hollis (Ronald Sinclair), the son of a World War I hero, and First World War veteran Kirk Edwards (Alan Hale, Sr.). Theyre captured in short order, and brought before Luftwaffe Major Otto Baumeister (Raymond Massey) for interrogation -- they not only manage to escape, but gather some information vital to the Allied war effort. Now they only have to figure out how to cross most of Germany and Holland, avoiding capture along the way by a mix of sheer daring, blind luck, and assistance from two anti-Nazi Germans (Nancy Coleman, Albert Bassermann) -- and just when it seems that all of the odds have turned against them, they find themselves faced with a German plot to wipe out a major part of London, and one last opportunity to get home.",NR,"Action & Adventure, Classics, Drama",Raoul Walsh,Warner Bros. Pictures,108 minutes,"Errol Flynn, Ronald Reagan, Raymond Massey"
250,15086,Death at a Funeral,"Death At A Funeral is a rousing British farce, with enough slapstick silliness to overcome its faults.",62%,131,79%,65043,"A dysfunctional British family gathers for the patriarchs funeral. Tensions rise, old conflicts are uncovered and, when a man arrives saying hes the dead mans gay lover and threatens blackmail, drastic measures are taken.",R (for language and drug content),"Comedy, Drama",Frank Oz,MGM,90 minutes,"Matthew MacFadyen, Keeley Hawes, Andy Nyman"
251,15089,Diary of a Wimpy Kid,"Unlike its bestselling source material, Diary of a Wimpy Kid fails to place a likable protagonist at the center of its middle-school humor -- and its underlying message is drowned out as a result.",53%,107,49%,103436,"Meet the kid who made ""wimpy"" cool in a family comedy based on the best-selling illustrated novel Diary of a Wimpy Kid by Jeff Kinney, the first in a series that has thus far sold 24 million copies. ""Diary of a Wimpy Kid"" chronicles the adventures of wise-cracking pre-teen Greg Heffley, who must somehow survive the scariest time of anyones life: middle school.",PG (for some rude humor and language),"Comedy, Kids & Family",Thor Freudenthal,20th Century Fox,93 minutes,"Zachary Gordon, Robert Capron, Rachael Harris"
252,15090,Skin,"Skin could stand to go a bit deeper below its surface, but a worthy story and a committed performance from Jamie Bell make this timely drama well worth a watch.",77%,74,84%,280,"A white supremacist reforms his life after falling in love but saying goodbye to his skinhead life isnt a clean process. He must betray his former gang and work alongside the FBI in order to remove the body ink that has represented his identity for so long, as well as the burden of the gangs crimes he has carried.","R (for disturbing violent content, pervasive language, some sexuality, and brief drug use)",Drama,Guy Nattiv,A24,110 minutes,"Jamie Bell, Danielle MacDonald, Bill Camp"
253,15093,The Tender Trap,N/A,67%,6,56%,497,"Max Shulman and Robert Paul Smiths Broadway hit The Tender Trap is transformed into a beguiling Frank Sinatra film vehicle. Sinatra plays a Manhattan showbiz agent, Charlie Y. Reader, who enjoys the attentions of several willing young ladies. At an audition, Charlie meets aspiring actress Julie Gillis (Debbie Reynolds), who is so determined to land a husband that shes already set the date. She goes out with Charlie for a short while, then announces that she wont marry him until he gives up all his other girls. Charlie, who hasnt said word one about marriage and whod been preparing to give Julie the brush-off, is startled by her ultimatum -- so much so that he genuinely falls in love with her, which (we can safely assume) was her intention all along. A complication involving Charlies former amour Sylvia Crewes (Celeste Holm) and his best friend Joe McCall (David Wayne) paves the way for the films slightly offbeat denouement. In addition to scoring at the box office, The Tender Trap yielded a hit song (written by Sammy Cahn and Jimmy Van Heusen), which would remain a part of Frank Sinatras repertoire for the rest of his life. ~ Hal Erickson, Rovi",NR,"Classics, Comedy, Musical & Performing Arts, Romance",Charles Walters,WARNER BROTHERS PICTURES,111 minutes,"Debbie Reynolds, Frank Sinatra, David Wayne"
254,15098,Decision Before Dawn,N/A,100%,6,71%,337,"With the Third Reich disintegrating, several members of the German army are defecting to the Americans and offering their services as spies. US officer Gary Merrill trusts none of these last-minute ""converts"", but German prisoner Oskar Werner seems to be sincere. Werner insists that by helping the Americans, he is saving Germany from destruction. Merrill sends Werner behind enemy lines for counter-espionage with an American officer (Richard Basehart), who still isnt convinced that the German expatriate means what he says. At several critical junctures, it seems as though Werner had been lying about his mission, but at the last moment he saves Baseharts life at the cost of his own...but was this act of bravery intentional? A thoughtful World War II drama, Decision Before Dawn was filmed on location in Europe. Watch for a young and sickly-looking Klaus Kinski as an overeager defector.",NR,"Action & Adventure, Classics, Drama, Mystery & Suspense",Anatole Litvak,20th Century Fox Film Corporation,119 minutes,"Richard Basehart, Oskar Werner, Gary Merrill"
255,15102,Disgrace,"Featuring outstanding performances from John Malkovich and newcomer Jessica Haines, Disgrace is a disturbing, powerful drama.",83%,60,62%,2100,"Set in Cape Town, a twice-divorced literature professor retreats to his daughters farm after having an impulsive affair with a student.","R (for sexual content, nudity, some violence and brief language)","Art House & International, Drama",Steve Jacobs,Maximum Film Distribution,118 minutes,"John Malkovich, Paula Arundell, Eric Ebouaney"
256,15104,Aria,N/A,50%,12,47%,2270,"An international collection of well-known directors contributed to this compilation film, each fashioning a short film inspired by an aria from a famous opera. The approaches vary broadly, from the playful abstraction of Jean-Luc Godards segment, which illustrates Armide with exercising body-builders, to the more literal approach of Franc Roddam, who transports Tristan und Isoldes story to modern-day Las Vegas. A particular stand-out is Julian Temples take on Rigoletto, which recasts Verdi as the accompaniment to a contemporary Southern California sex farce.","R (adult situations/language, nudity, violence)","Art House & International, Comedy, Drama, Musical & Performing Arts, Special Interest","Nicolas Roeg, Jean-Luc Godard, Robert Altman, Ken Russell, Bruce Beresford, Julien Temple, Bill Bryden, Derek Jarman, Franc Roddam, Charles Sturridge",Academy Entertainment,90 minutes,"John Hurt, Theresa Russell, Jack Kyle"
257,15111,A Summer In Genoa,"Michael Winterbottom's tale of grief and mourning, though frustrating in places, is intelligent filmmaking with superb central performances.",77%,44,41%,2301,"In the wake of a family tragedy, an English ex-patriot living in the United States decides to relocate himself and his daughters to Italy, only to discover that grief has followed them overseas when the youngest girl proves unable to move past her acute emotional pain. An Englishman at heart, Joe (Colin Firth) now lives a happy life with his wife and daughters in the United States. Their happy existence is turned upside down in an instant, however, when his wife is driving their daughters home one day and becomes momentarily distracted from the road. Later, as Joe and his daughters attempt to contend with the thick fog of grief hanging over their household, the loving father surmises that a change of scenery may be in order; accepting a teaching job in Italy in hopes that it will help them contend with their bereavement. For teenage daughter Kelly (Willa Holland), at least, the move works miracles: though Kelly was sullen and withdrawn back home, she seems awakened by the endless possibilities that the future may hold in Europe - even entering into a clandestine romance with a handsome Italian boy. Kellys younger sister Mary (Perla Haney-Jardine), unfortunately, is another case entirely. Despite her fathers most valiant efforts to assuage her grief, Mary just doesnt seem capable of shaking the loss. Meanwhile, as Joe rekindles an old friendship with a university colleague (Catherine Keener), his family soaks in the marvelous medley of medieval, Renaissance, and contemporary influences of the scenic, northern Italian city.","R (for language, some sexuality and drug use)",Drama,Michael Winterbottom,Entertainment One,93 minutes,"Monica Bennati, Colin Firth, Hope Davis"
258,15113,Scarecrows,N/A,44%,9,37%,1198,"A suspenseful and chilling exercise in supernatural horror, this film opens with some speedy exposition during a mood-setting opening credits sequence, inter-cut with radio news reports of a violent paramilitary-style robbery on the Camp Pendleton payroll carried off by a thuggish team of commandos. Making their escape by hijacking a cargo plane -- along with its pilot and his teenage daughter -- the robbers are betrayed by one of their own number, Bert (B.J. Turner), who parachutes with the crate of stolen loot over a Florida cornfield. The team makes a landing in the same field, filled with eerie scarecrow effigies, and begins to sweep the area in search of their defector, working their way toward an abandoned farmhouse. Once there, the team members find themselves cut off from their means of escape by a band of living scarecrows, who stalk and kill the commandos one by one, gutting them and stuffing their bodies with straw; the victims then return to life as scarecrows themselves, joining their undead comrades and closing in on the rapidly dwindling group of survivors. Tightly paced and consistently tense, this low-budget film has slick production values (making it appear more expensive than it probably was) and only falters in some laughably overwrought performances. Taking a cue from Night of the Living Dead, director William Wesley eschews any definite explanation for the supernatural goings-on, instead relying on a nightmare logic that adds to the paranoid atmosphere.",R,Horror,William Wesley,Effigy Films,80 minutes,"Ted Vernon, David Campbell, Michael David Simms"
259,15130,Chained Heat,N/A,56%,9,45%,301,"Carol (Linda Blair) is sexually exploited both by the authorities and by the inmates during her 18-month stay in prison, in this ""B""-grade softcore film with touches of violence throughout. Two female leaders of the prisoners, Ericka (Sybil Danning) and Duchess (Tamara Dobson), are at each others throats, a prurient warden (John Vernon) has a hot tub next to his desk, his corrupt assistant Taylor (Stella Stevens) runs a drugs and prostitution ring, and to make matters confusing, Taylors lover is having an affair with Ericka. No wonder there is a prison breakout; everyone needed fresh air.",R,"Action & Adventure, Drama","Paul Nicolas, Paul Nicholas",Jensen Farley Pictures,97 minutes,"Linda Blair, John Vernon, Sybil Danning"
260,15131,Cyrus,"While it may strike some viewers as slight, Cyrus is a successful hybrid of mainstream production values and the mumblecore ideals of directors Jay and Mark Duplass.",80%,155,53%,44604,"Directed by mumblecore stalwarts Jay and Mark Duplass, Cyrus stars John C. Reilly as John, a middle-aged lonely divorced guy who, as the film opens, gets dragged to a party by his remarried ex-wife (Catherine Keener) -- who remains his best friend. After a few clumsy, drunken passes at a variety of women, John encounters Molly (Marisa Tomei), an attractive single-mom who finds Johns social awkwardness appealing. They hit it off, and quickly begin a tender new relationship. Problems soon arise in the form of Cyrus (Jonah Hill), Mollys twentysomething son, who has an off-puttingly close relationship to his mom. Soon the jealous Cyrus sets about trying to break them up, and John must figure out how to deal with this unhinged and unexpected rival.",R (for language and some sexual material),Comedy,"Jay Duplass, Mark Duplass",Fox Searchlight,91 minutes,"John C. Reilly, Jonah Hill, Marisa Tomei"
