,dataIndex,realTitle,criticsConcensus,tomatoMeter,tomatoCount,audienceScore,audienceCount,realSynopsis,rating,genreString,directedBy,studio,runTime,cast
226,11494,Black Christmas,"A gratuitous remake of the 1974 slasher, Black Christmas pumps out the gore and blood with zero creativity, humor, or visual flair.",15%,62,38%,137879,"Billy, a young boy, was abused by his mother as a child. His mother cheated on Billys father, and eventually killed the man, while keeping Billy in the attic--for good, while she was with her lover and starting a ""new"" family. As Billys mother fell pregnant with a daughter and treated her with the love he had never experienced, Billy came out of the attic after years and brutally murdered his mother and her lover. Cut to present day, a group of six sorority sisters consisting of Kelli, Dana, Lauren, Megan, Heather, Melissa and their house mother, who now live in Billys childhood home, find themselves being harassed by threatening and intimidating mystery phone calls during Christmas Break. As one of the girls goes missing, they begin being murdered one by one by no other than Billy.","R (for strong horror violence and gore, sexuality, nudity and language)","Horror, Mystery & Suspense",Glen Morgan,MGM,84 minutes,"Katie Cassidy, Michelle Trachtenberg, Kristen Cloke"
227,11495,Happily N'ever After,"Happily N'Ever After has none of the moxy, edge, or postmodern wit of the other fairy-tales-gone-haywire CG movie it so blatantly rips off.",4%,80,34%,244328,"Cinderellas wicked stepmother has tipped the balance of power toward the dark side in Fairy Tale Land, and now its up to the put-upon princess to restore order and ensure that good triumphs in an animated adventure featuring the voices of Sarah Michelle Gellar, Freddie Prinze Jr., Sigourney Weaver, and George Carlin. For years, the Wise Wizard has worked hard to ensure that the scales of good and evil were always well-balanced, but as with any hard worker the Wise Wizard needs a relaxing vacation every once in a while. When the Wise Wizard goes on holiday, his faithful assistants Munk and Mambo make the crucial mistake of allowing Cinderellas wicked stepmother, Frieda, come into possession of their masters magical staff. With time fast running out before Frieda casts a shadow of darkness and sorrow over Fairy Tale Land, Cinderella must now awaken from her romantic dreams to take on her fearsome stepmother with a little help from her best friend, Rick, and a virtual army of heroic dwarves and fairies. ~ Jason Buchanan, Rovi",PG (for some mild action and rude humor),"Animation, Comedy, Kids & Family, Science Fiction & Fantasy",Paul J. Bolger,Lionsgate,87 minutes,"Sarah Michelle Gellar, Freddie Prinze Jr., Andy Dick"
228,11496,Home of the Brave,"The ensemble cast works hard, but hammy direction and a script lacking in nuance ruins this movie's noble intentions.",23%,57,46%,22225,"As their tour of duty in Iraq draws to a close, four American soldiers learn that they are scheduled to embark on one final, fateful mission that will forever change their concept of war. Shortly after receiving the news that they will soon be reunited with their families back in the United States, a unit serving in Iraq is deployed on a humanitarian mission to deliver medical supplies to a remote Iraqi village. Upon arriving in the village, the unit is viciously ambushed and many lives are lost. Now, as the surviving members of the battalion return home and attempt to readjust to civilian life, the physical injuries and psychological scars sustained during that tragic event continue to take a heavy emotional toll on the war-torn soldiers. Samuel L. Jackson, Jessica Biel, and rapper-turned-actor 50 Cent star in an affecting psychological war drama from Academy Award-winning director Irwin Winkler. ~ Jason Buchanan, Rovi",R (for war violence and language),"Action & Adventure, Drama",Irwin Winkler,MGM,105 minutes,"Samuel L. Jackson, Jessica Biel, Brian Presley"
229,11497,Code Name: The Cleaner,"Code Name: The Cleaner is a limp action/comedy flick that alternates between lame, worn-out jokes and cheesy martial arts.",4%,83,38%,38619,"Jake, a janitor and seemingly regular guy, has no idea who he is after being hit over the head by mysterious assailants. When he finds himself unexpectedly entangled in a high-level government conspiracy, Jake and his pursuers begin to believe that he is an undercover agent who subconsciously holds a key piece of information that could expose an arms deal involving the CIA and FBI.","PG-13 (for sexual content, crude humor and some violence)","Action & Adventure, Comedy",Les Mayfield,New Line Cinema,91 minutes,"Lucy Liu, Cedric the Entertainer, Nicollette Sheridan"
230,11498,Stomp the Yard,"While Stomp the Yard contains impressive musical and dance numbers, it loses its momentum during the intervening soap opera-style subplots.",25%,89,82%,467987,"DJ is a troubled youth from Los Angeles attending the historically black Truth University in Atlanta, Ga. When adapting to his new environment proves difficult, DJ finds solace in joining a struggling fraternity where he begins implementing his street-style dance moves in an attempt to help the step team win the coveted National Step Show Championship. Before long DJ becomes the competing fraternitys main rival, while trying to pursue his new love interest, deal with his own troubled past and learn the true meanings of brotherhood and fraternity along the way.","PG-13 (for a scene of violence, some sexual material and language)",Drama,Sylvain White,Screen Gems,114 minutes,"Columbus Short, Harry J. Lennix, Meagan Good"
231,11499,Miss Potter,A charming biopic that maintains its sweetness even in sadder moments.,67%,129,68%,332605,This biography of childrens author Beatrix Potter explores how she overcame a domineering mother and the chauvinism of Victorian England to become a best-selling author.,PG (for brief mild language),Drama,Chris Noonan,MGM,92 minutes,"Renée Zellweger, Ewan McGregor, Emily Watson"
232,11503,American Pie 5: The Naked Mile,N/A,0%,5,61%,213860,"Upon realizing that he may be the first in his family to ever graduate from high school with his virginity intact, Erik Stifler sets out on a mission to slip between the sheets with a girl before slipping into his cap and gown. In order to accomplish his libidinous goal, however, Erik will first have to find a willing partner; and what better place to find a woman whose ready and willing to help him maintain family tradition than at the world famous Naked Mile? Who knows, with a little advice from Jims open-minded father (Eugene Levy), there may be some hope for Erik yet.","R (for pervasive strong sexual content and crude humor, nudity, language, drinking and some drug use - all involving teens)",Comedy,Joe Nussbaum,Universal Studios Home Video,102 minutes,"John White, Jessy Schram, Candace Kaye Kroslak"
233,11507,David and Bathsheba,N/A,83%,6,31%,414,"David and Bathsheba is a respectable, slightly stodgy cinematic adaptation of the Old Testament story. King David (Gregory Peck), much beloved by his subjects and a war hero of long standing, falls victim to the sins of the flesh when he falls in love with Bathsheba (Susan Hayward), the wife of Uriah (Kieron Moore), one of Davids most trusted soldiers. His downfall begins when David orders Uriah into a suicidal battle, knowing that this will clear the way for his relationship with Bathsheba. His infatuation leads him to neglect his kingdom and his people, and invokes the wrath of God. Only after his land has been devastated by Gods hand does David offer atonement. The films lavish production values compensate ever so slightly for the long-winded script. David and Bathsheba was the last major ""flat-screen"" Biblical epic; it was filmed in 1951 B.C. -- Before Cinemascope.",NR,"Classics, Drama, Romance, Faith & Spirituality",Henry King,20th Century Fox Film Corporation,116 minutes,"Gregory Peck, Susan Hayward, Raymond Massey"
234,11508,Old Joy,"A serene, melancholy beauty permeates this meditative portrait of deep friendship and faded glory.",85%,91,71%,5553,"""Old Joy"" is the story of two old friends, Kurt and Mark, who reunite for a weekend camping trip in the Cascade mountain range east of Portland, Oregon. It is a minimalist story of friendship, loss and alienation in the Bush era. For Mark, the weekend outing offers a respite from the pressure of his imminent fatherhood; for Kurt, it is part of a long series of carefree adventures. As the hours progress and the landscape evolves, the twin seekers move through a range of subtle emotions, enacting a pilgrimage of mutual confusion, sudden insight, and recurring intimations of spiritual battle. When they arrive at their final destination, a hot spring in an old growth forest, they must either confront the divergent paths they have taken or somehow transcend their growing tensions in an act of forgiveness and mourning.",NR,Drama,Kelly Reichardt,Kino International,73 minutes,"Daniel London, Daniel A. Lomino, Will Oldham"
235,11510,Venus,"Audiences may attend to witness Peter O'Toole's Oscar-worthy performance, but they'll also be treated to a humane, tender exploration of maturing with both dignity and irreverence.",89%,151,74%,11451,"An aging pair of veteran English actors whose success never quite took hold finds their quiet existence suddenly interrupted by the arrival of one of the mens precocious grandnieces in director Roger Michells affectionate comedy drama. Maurice (Peter OToole) and Ian (Leslie Phillips) may still land the occasional paying gig -- Maurice has recently been cast as a corpse in a popular television drama -- but for the most part, their days are spent cataloging their ailments over meals at their favorite café. Though the arrival of Ians grandniece Jessie doesnt immediately set so well with her curmudgeonly great uncle, Maurice takes an immediate liking to the girl, and makes it a mission to expose the youngster to some of the bustling capitols best-known sights. As the newly invigorated septuagenarian does his best to teach the wide-eyed youngster a thing or two about life, he soon comes to realize just how little he truly knows about the subject at such a late point in life.","R (for language, some sexual content and brief nudity)","Comedy, Drama, Romance",Roger Michell,Miramax Films,95 minutes,"Peter O'Toole, Jodie Whittaker, Vanessa Redgrave"
236,11519,Primeval,"Primeval is a low-quality horror film, which due to the inane political messages does not even qualify as campy fun.",19%,57,32%,64240,"An American news crew travels to one of the most remote locations on the planet in hopes of capturing the savage serial killer rumored to have claimed over 300 lives in this white-knuckle horror-thriller starring Dominic Purcell and Orlando Jones, and based on actual events. As the intrepid documentarians cautiously make their way upriver, they soon find that the brutality inflicted on man by his own kind pales in comparison to the relentless viciousness of mother natures most resilient predator. ~ Jason Buchanan, Rovi","R (for strong graphic violence, brutality, terror, and language)","Action & Adventure, Drama, Horror, Mystery & Suspense",Michael Katleman,Buena Vista Pictures,94 minutes,"Dominic Purcell, Brooke Langton, Orlando Jones"
237,11520,Alpha Dog,"A glossy yet unflinching portrait of violent, hedonistic teenagers. Bruce Willis and Sharon Stone chew the scenery, while Justin Timberlake gives a noteworthy performance.",54%,144,67%,422521,"Frankie is a Los Angeles drug dealer. He comes from a good family, owns his home, several cars and enjoys partying with his friends. Frankie is 19. When his friend Jake welches on a debt, Frankie and his boys kidnap Jakes 15-year-old brother Butch and hold him as a marker. Even though Butch has numerous chances to escape, he doesnt. Hes enjoying partying with them, losing his virginity and having a good time -- until something goes horribly wrong.","R (for pervasive drug use and language, strong violence, sexuality and nudity)","Drama, Mystery & Suspense",Nick Cassavetes,Universal Studios,118 minutes,"Emile Hirsch, Justin Timberlake, Anton Yelchin"
238,11521,The Hitcher,"Its journey is never quite as revelatory as it could be, but The Hitcher stands as a white-knuckle vision of horror, bolstered by Rutger Hauer's menacing performance.",61%,36,74%,43784,"This routine slasher film is greatly enhanced by the ethereal quality of its evocative cinematography and a haunting score that foretells pending doom. Otherwise, the pendulum swings between car crashes and slasher killings all the way through until the predictable end. Jim Halsey (C. Thomas Howell) stops to pick up serial murderer John Ryder (Rutger Hauer) on a long haul through Texas while driving a Cadillac to its destination. Before he gets the car back up to 65 again, Jim realizes he has a wacko for a passenger and throws him out. Revenge is in store as the crazed Ryder starts killing off anyone Jim meets along his way. Desperate for help, Jims flight from the killer becomes a flight from the police as well, since they think he is responsible for the trail of deaths that follow in his wake.",R,"Action & Adventure, Drama, Horror, Mystery & Suspense",Robert Harmon,Tri-Star Pictures,98 minutes,"C. Thomas Howell, Rutger Hauer, Jennifer Jason Leigh"
239,11531,The Wendell Baker Story,"The Wendell Baker Story is a lackadaisical comedy of quirky characters and situations, but ultimately the lazy narrative bores instead of charms.",40%,42,40%,16329,"Owen, Luke, and Andrew Wilson combine their fraternal filmmaking talents to tell the character-driven tale of a small-time con man who gets a fortuitous shot at redemption while working in a run down retirement community. Wendell Baker (Luke Wilson) is a con man whose large heart betrays his criminal mind. Confident to a fault and consistently cool-headed, Baker is the kind of grifter whos always quick with a comeback and never lets the law get in the way of making a quick buck. When Wendell is busted for selling counterfeit Texas drivers licenses to undocumented Mexican migrant workers, he coasts through his prison sentence with the same unflappable attitude that made him the perfect swindler in the outside world. In order to pass the time behind bars without causing waves, mellow convict Wendell buries his nose in books about hotel management checked out from the prison library. Upon release the optimistic ex-con is distraught to discover his girlfriend Dorren (Eva Mendes) has taken up with a quick-tempered grocer (Will Ferrell) and his former partner Reyes (Jacob Vargas) has been forced into retirement by his law-abiding wife. Looking to put his hotel management know-how to good use and determined to win Doreen back, Wendell soon takes a job at the Shady Grove retirement hotel. Little does Wendell realize that scheming Shady Grove head nurse Neil King (Owen Wilson) has been dabbling in fraudulent Medicare payments and forced labor, and has no qualms about pinning his crimes on the carefree ex-convict. Now, if benevolent knave Wendell has any hope of turning the tables on his unscrupulous nemesis and proving that nice guys dont always finish last, hell have to enlist the aid of fed-up Shady Grove residents Boyd (Seymour Cassel), Skip (Harry Dean Stanton), and Nasher (Kris Kristofferson), who are all more than willing to strike back at their casually cruel caretaker.",PG-13 (for some crude and sexual humor and language),"Comedy, Drama","Luke Wilson, Andrew Wilson",ThinkFilm,102 minutes,"Luke Wilson, Eva Mendes, Owen Wilson"
240,11537,Bridge to Terabithia,"Bridge to Terabithia is a faithful adaptation of a beloved children's novel and a powerful portrayal of love, loss, and imagination through children's eyes.",85%,158,70%,468472,"""Bridge to Terabithia"" is a fantasy/adventure story of friendship, family and the power of imagination Jess Aarons is an outsider at school and even in his own family. Jess has trained all summer to become the fastest kid in his middle school class but his goal is unexpectedly thwarted by the new girl in school, Leslie Burke who competes in the ""boys only"" race and wins. Despite their awkward introduction, the two outsiders quickly become best friends. Leslie loves to tell stories of fantasy and magic. Jess loves to draw, but until he met Leslie, it was something he kept to himself. Leslie opens a new world of imagination for Jess. Together they create the secret kingdom of Terabithia, a magical place only accessible by swinging on an old rope over a stream in the woods near their homes. There, the friends rule the kingdom, fight the Dark Master and his creatures and plot against the school bullies. Thanks to his friendship with Leslie, Jess is changed for good. Brimming with fantastical creatures, palaces and beautiful forests, the world of Terabithia is brought to life.","PG (for thematic elements including bullying, some peril and mild language)","Action & Adventure, Kids & Family, Science Fiction & Fantasy",Gabor Csupo,Buena Vista,94 minutes,"Josh Hutcherson, AnnaSophia Robb, Zooey Deschanel"
241,11538,Beer League,N/A,27%,15,58%,23981,"An unemployed, alcoholic thirtysomething who still lives with his mother and cant seem to muster the motivation to turn his life around finds that alls fair in love and softball when his team is threatened with ejection from the league in a raunchy sports comedy starring Howard Stern Show regular Artie Lange. For the sluggers from Eds Bar and Swill, the weekly trip to the local diamond is more about drinking and roughhousing than it is about such technicalities as hitting home runs and striking out the opposing team. When their favorite pastime is threatened by the ultra-competitive athleticism of the leagues villainous perennial champions -- led by local gym owner and current mayoral candidate Manganelli (Anthony de Sando) -- this motley group of hard-drinking sportsmen must make one final push for the pennant and end their unprecedented losing streak if they hold out any hope of making it to another season. Ralph Macchio, Seymour Cassel, and Laurie Metcalf co-star, and longtime Saturday Night Live contributor Frank Sebastiano makes his directorial debut.","R (for non-stop language including sexual references, sexuality, nudity and drug use.)",Comedy,Frank Sebastiano,Echo Bridge Entertainment,86 minutes,"Artie Lange, Ralph Macchio, Anthony DeSando"
242,11540,Killer of Sheep,"By turns funny, sad, and profound, Killer of Sheep offers a sympathetic and humane glimpse into inner-city life.",97%,77,84%,4685,"Set in the Watts area of Los Angeles, a slaughterhouse worker must suspend his emotions to continue working at a job he finds repugnant, and then he finds he has little sensitivity for the family he works so hard to support.",NR,"Art House & International, Drama",Charles Burnett,Milestone Film,90 minutes,"Henry G. Sanders, Henry Sanders, Angela Burnett"
243,11542,Dirty Sanchez: The Movie,N/A,40%,5,74%,12187,"MTV Films Europe and Vertigo Films partner to bring the Jackass-flavored MTV Europe series to the screen as director Jim Hickey follows a group of four daredevils who are challenged by the devil to discover and endure the seven deadly sins. A raunchy world tour of depravity and hilarity, Dirty Sanchez: The Movie combines the extreme stunts of Johnny Knoxville and company with a narrative structure by telling the tale of a stunt gone horribly awry. When an attempt to crash a car through a caravan results in the death of Dainton, Joycey, Pancho, and Pritchard, the fearless foursome are sent straight into deepest depths of hell. It seems that Satan wants to check their credentials before they are allowed to carry on with their reckless lifestyles, and now in order to return to their familiar plane of reality they must embark on a global tour of sin and debauchery. From confronting ""anger"" in Moscow to greeting ""gluttony"" in San Miguel and challenging ""lust"" in Bangkok, the boys all set out to greet and conquer the very sins that mankind has struggled against since the beginning of time. If they win, their prize is immortality and global domination; if they lose, they must bend to the will of Satan himself. With such stomach turning stunts as beer enema shotguns and liposuction drinking games, Dirty Sanchez: The Movie is not for the faint of heart.","R (for extremely rude and dangerous stunts throughout, sexual content, nudity and pervasive language)",Comedy,Jim Hickey,Vertigo Films,96 minutes,"Lee Dainton, Dan Joyce, Mike Locke"
244,11543,Shadows in the Sun,N/A,43%,7,60%,3166,"Dawsons Creek star Joshua Jackson stars as Jeremy, a British book editor and aspiring writer seeking a new lease on life, in Shadows in the Sun, an uplifting drama from ABC Family. Sent by his employer to Tuscany to elicit a new book from dried-up (and cantankerous) exiled author Weldon Parrish Harvey Keitel, Jeremy soon finds himself smitten with Weldons daughter Isabella (Claire Forlani) and gradually connects with Weldon despite the mans initial resistance. Soon, the two men begin encouraging each other to write as romance flowers between Jeremy and Isabella.",NR,"Comedy, Drama",Brad Mirman,Studio Eight Productions,94 minutes,"Joshua Jackson, Harvey Keitel, Claire Forlani"
245,11546,49 Up,"The latest installment in this remarkable series, 49 Up is a satisfying continuation of Michael Apted's singular sociological and cinematic experiment.",97%,65,87%,27414,"""49 Up"" is the seventh film in a series of landmark documentaries that began 42 years ago when UK-based Granadas ""World in Action"" team, inspired by the Jesuit maxim ""Give me the child until he is seven and I will give you the man,"" interviewed a diverse group of seven-year-old children from all over England, asking them about their lives and their dreams for the future. Michael Apted, a researcher for the original film, has returned to interview the ""children"" every seven years since, at ages 14, 21, 28, 35, 42 and, now again, at age 49. In this latest chapter, more life-changing decisions are revealed, more shocking announcements made and more of the original group take part than ever before, speaking out on a variety of subjects including love, marriage, career, class and prejudice.",NR,"Documentary, Musical & Performing Arts, Special Interest, Television",Michael Apted,ITV,135 minutes,"Bruce Balden, Jacqueline Bassett, Symon Basterfield"
246,11547,Waitress,"Sweet, smart, and quirky, Waitress hits the right, bittersweet notes through this romantic comedy through its witty script and a superb performance by Keri Russell.",90%,172,74%,410309,"A woman trapped in a life from which she dreams of escape, Jennas secretly hopes to save enough money from her waitressing job to leave her overbearing and controlling husband. She is a sharp, sassy woman with a gift for making unusual pies whose recipes are inspired by the trials, tribulations and circumstances of her life. An unwanted pregnancy changes the course of events giving her an unexpected confidence via letters to her unborn baby.","PG-13 (for sexual content, language and thematic elements)","Comedy, Drama, Romance",Adrienne Shelly,Fox Searchlight Pictures,107 minutes,"Keri Russell, Nathan Fillion, Cheryl Hines"
247,11549,Neverwas,N/A,14%,7,65%,4058,"A man seeks to unlock the mysteries of his familys tragic past in this drama. Zach Riley (Aaron Eckhart) is a psychiatrist who has resigned a prestigious position at a major university to take a job at the Millwood Clinic, a private residential facility run by one Dr. Reed (William Hurt). Riley tells Reed he was inspired to come to Millwood by the case of a family friend who was a patient there years before, but what Riley doesnt mention is the person in question was his father, T.L. Pierson (Nick Nolte), a successful but reclusive childrens author whose book ""Neverwas"" became a remarkable critical and popular success. For all his talent and success, Pierson was haunted by mental illness and drug addiction, and after leaving Millwood he committed suicide, with young Zach finding the body. Ever since, his mother (Jessica Lange) has been bitter and blamed Zach for Piersons death, and hes come to Millbrook looking for answers and closure regarding his dad. While working with the patients at Millwood, Riley strikes up a friendship with Gabriel (Ian McKellen), a charming older man with a poor connection to reality who was friendly with Pierson when they were both in treatment there; Riley also renews his childhood friendship with Maggie Blake (Brittany Murphy), a Millwood intern who was powerfully affected by ""Neverwas"" when she was young. Neverwas is the first feature film from writer and director Joshua Michael Stern.",PG-13 (for thematic issues),"Drama, Mystery & Suspense",Joshua Michael Stern,Senator Film,102 minutes,"Aaron Eckhart, Ian McKellen, Brittany Murphy"
248,11554,Catch and Release,"A romantic dramedy with boring, stock characters and contrived situations.",22%,133,55%,206147,"After losing her husband in a tragic accident that occurred during his bachelor party, a would-be widow (Jennifer Garner) struggles to sort through the many secrets he kept from her as she adjusts to her new life. Erin Brockovich screenwriter Susannah Grant makes her directorial debut with a romantic comedy starring Juliette Lewis, Kevin Smith, and Timothy Olyphant.","PG-13 (adult situations/language, sex)","Comedy, Drama, Romance",Susannah Grant,Sony Pictures Entertainment,111 minutes,"Jennifer Garner, Timothy Olyphant, Sam Jaeger"
