,dataIndex,realTitle,criticsConcensus,tomatoMeter,tomatoCount,audienceScore,audienceCount,realSynopsis,rating,genreString,directedBy,studio,runTime,cast
0,11000,Nacho Libre,"At times hilarious, but other times offensive, Director Jared Hess is unable to recapture the collective charisma of his Napoleon characters, instead relying on a one-joke concept that runs out of steam. Sure to entertain the adolescents, however.",40%,164,54%,417235,"Jared Hess (of Napoleon Dynamite fame) directs this bizarre comedy starring Jack Black as Nacho, a young man who works as a cook in the Mexican monastery where he was raised. When the institution faces a financial crisis, Nacho decides that he must come to the aid of the house of God (as well as the beautiful young nun who has recently joined the order) by competing in the local Lucha Libre tournament. Donning a spandex outfit, mask, and cape, Nacho becomes a hero for the ages -- but can he win the heart of a woman of the cloth? ~ Cammila Albertson, Rovi","PG (for some rough action, and crude humor including dialogue)","Comedy, Documentary, Kids & Family",Jared Hess,Paramount Pictures,100 minutes,"Jack Black, Héctor Jiménez, Ana de la Reguera"
1,11001,The Lake House,"The plot of The Lake House is a little too convoluted, and the film fails to pull off the sweeping romance it aims for.",36%,154,73%,429898,"A lonely doctor who once occupied an unusual lakeside home begins exchanging love letters with its newest resident, a frustrated architect. When they discover that theyre actually living two years apart, they must try to unravel the mystery behind their extraordinary romance before its too late.",PG (for some language and a disturbing image),"Drama, Romance",Alejandro Agresti,Warner Bros. Pictures,98 minutes,"Keanu Reeves, Sandra Bullock, Shohreh Aghdashloo"
2,11002,Click,"This latest Adam Sandler vehicle borrows shamelessly from It's A Wonderful Life and Back To The Future, and fails to produce the necessary laughs that would forgive such imitation.",33%,170,66%,874713,"A workaholic architect, frustrated in his job but determined to make a better life for his family, is bestowed with a powerful universal remote that allows him more control over his life than he ever knew possible in director Frank Coracis high-concept fantasy comedy. On the surface, Michael Newman (Adam Sandler) seems to have it all, yet with all the demands forced upon him by his ungrateful boss (David Hasselhoff), Michael finds that setting aside time to spend with his loving wife, Donna (Kate Beckinsale), and two picture-perfect children, Ben (Joseph Castanon) and Samantha (Tatum McCann), has grown increasingly difficult. When a frustrating bout with the television remote leads the overworked husband and father to a nearby Bed, Bath & Beyond in search of a universal remote with the power to control all of his electronic devices, a curious peek into the back room leads Michael into the company of eccentric employee and talented inventor Morty (Christopher Walken). It seems that Morty has created a device that will not only allow Michael complete control over his television and stereo, but his entire life as well. As Michael discovers that the remarkable device has the power to muffle the barks of the family dog, zoom himself past an irritating quarrel with his wife, and even allow him to travel back and forth through time to different points in his life, the rush of being able to skip straight to the good parts in life soon leaves him feeling as if hes missing out on the total experience. Only when Michael begins to realize that the he has lost control of his life and the remote is now programming him does he finally learn that life is as much about the moments hed rather forget as it is the moments he will always remember. ~ Jason Buchanan, Rovi","PG-13 (for language, crude and sex-related humor, and some drug references.)","Comedy, Kids & Family",Frank Coraci,Sony Pictures Releasing,107 minutes,"Adam Sandler, Kate Beckinsale, Christopher Walken"
3,11007,The Devil Wears Prada,"A rare film that surpasses the quality of its source novel, this Devil is a witty expose of New York's fashion scene, with Meryl Streep in top form and Anne Hathaway more than holding her own.",75%,194,76%,571742,"Andrea is a small-town girl in her first job out of college, who tries to navigate the waters of the high-powered fashion magazine world -- while surviving her impossibly demanding new boss, Miranda Priestly.",PG-13 (for some sensuality),"Comedy, Drama",David Frankel,20th Century Fox,110 minutes,"Meryl Streep, Anne Hathaway, Stanley Tucci"
4,11008,Pirates of the Caribbean: Dead Man's Chest,Gone is Depp's unpredictability and much of the humor and originality of the first movie.,53%,226,72%,1847651,"Captain Jack Sparrow is caught up in another tangled web of supernatural intrigue. Although the curse of the Black Pearl has been lifted, an even more terrifying threat looms over its captain and scurvy crew: it turns out that Jack owes a blood debt to the legendary Davy Jones, Ruler of the Ocean Depths, who captains the ghostly Flying Dutchman, which no other ship can match in speed and stealth. Unless the ever-crafty Jack figures a cunning way out of this Faustian pact, he will be cursed to an afterlife of eternal servitude and damnation in the service of Jones. This startling development interrupts the wedding plans of Will Turner and Elizabeth Swann, who once again find themselves thrust into Jacks misadventures, leading to escalating confrontations with sea monsters, very unfriendly islanders, flamboyant soothsayer Tia Dalma and even the mysterious appearance of Wills long-lost father, Bootstrap Bill. Meanwhile, ruthless pirate hunter Lord Cutler Beckett of the East India Trading Company sets his sights on retrieving the fabled ""Dead Mans Chest."" According to legend, whoever possesses the Dead Mans Chest gains control of Davy Jones, and Beckett intends to use this awesome power to destroy every last Pirate of the Caribbean once and for all. For times are changing on the high seas, with businessmen and bureaucrats becoming the true pirates--and freewheeling, fun-loving buccaneers like Jack and his crew threatened with extinction.","PG-13 (for intense sequences of adventure violence, including frightening images)","Action & Adventure, Comedy, Science Fiction & Fantasy",Gore Verbinski,Buena Vista,151 minutes,"Johnny Depp, Orlando Bloom, Keira Knightley"
5,11009,"You, Me and Dupree","A rather generic entry into the arrested development subgenre, with themes borrowed from other more successful and funnier films. Dupree wears out its welcome.",20%,166,50%,448175,"A man is being driven crazy by his shiftless best friend, just as the layabout starts making nice with his wife and neighbors in this comedy. Carl and Molly (Matt Dillon and Kate Hudson) are a thirtysomething couple who have just gotten married and are settling down into a cozy new home in a quiet neighborhood. While Carl and Molly are happy with their new digs, Carls best friend, Randy Dupree (Owen Wilson), is not content with his living arrangements. Dupree has all but made a career out of avoiding work, responsibility, and commitment, and while his charm usually manages to keep him afloat, when he loses his job, his apartment, and his car. Carl cant bear to see Dupree in such dire circumstances, and tells Dupree he can stay on their couch until he can get things straightened out. But while Carl was expecting Dupree to stay for a few days, it soon becomes obvious to both him and Molly that their guest has no intention of moving out anytime soon, and while the likable freeloader starts working his charm on Molly, their neighbors, and their friends, Carl soon finds himself at the end of his rope with his best man and childhood buddy. You, Me and Dupree also stars Amanda Detmer, Seth Rogen, and Michael Douglas as Mollys father. ~ Mark Deming, Rovi","PG-13 (for sexual content, brief nudity, crude humor, language and a drug reference)",Comedy,"Anthony Russo, Joe Russo",Universal Pictures,109 minutes,"Owen Wilson, Kate Hudson, Matt Dillon"
6,11011,Lady in the Water,"A far-fetched story with little suspense and unconvincing scenarios, Lady In The Water feels contrived, pretentious, and rather silly.",25%,212,49%,419561,"A modest building manager named Cleveland Heep rescues a mysterious young woman from danger and discovers she is actually a narf, a character from a bedtime story who is trying to make the treacherous journey from our world back to hers. Cleveland and his fellow tenants start to realize that they are also characters in this bedtime story. As Cleveland falls deeper and deeper in love with the woman, he works together with the tenants to protect his new fragile friend from the deadly creatures that reside in this fable and are determined to prevent her from returning home.",PG-13 (for some frightening sequences),"Drama, Mystery & Suspense, Science Fiction & Fantasy",M. Night Shyamalan,Warner Bros. Pictures,109 minutes,"Paul Giamatti, Bryce Dallas Howard, Jeffrey Wright"
7,11012,My Super Ex-Girlfriend,My Super Ex=Girlfriend is an only sporadically amusing spoof on the superhero genre that misses the mark with a nerd-turned-superwoman who embodies sexist clichés.,40%,130,31%,366719,"A regular guy finds out just how hard breaking up can truly be when attempting to call it quits with a clingy female crime fighter who doesnt want to let love die in director Ivan Reitmans super-powered romantic comedy. Matt Saunders (Luke Wilson) was looking for love when he first met pretty brunette Jenny Johnson (Uma Thurman), and at the time it seemed as if he may had finally actually found it. Jenny isnt just your typical girl, though, because despite her outwardly normal appearance she is actually a powerful superhero dedicated to ridding the streets of crime. Her outward strength betrays a deep-rooted insecurity, too, and when Jenny begins to become a bit too possessive for Matts laid-back taste, the troubled boyfriend does his best to end the relationship amicably. They say that breaking up isnt easy to do, however, and when your girlfriend is a superhero, that sentiment holds twice the truth as it does under any normal circumstances. Matt is determined to get on with his life, though, and as his budding romance with beautiful co-worker Hannah (Anna Faris) begins to get serious, jealous Jenny scornfully slips into G-Girl mode to prove that hell hath no fury like a woman superhero scorned.","PG-13 (for sexual content, crude humor, language and brief nudity)","Comedy, Drama, Science Fiction & Fantasy",Ivan Reitman,20th Century Fox,95 minutes,"Uma Thurman, Luke Wilson, Anna Faris"
8,11018,See No Evil,"See No Evil is packed with cliches from countless other teen slasher films, making for a predictable, scare-free waste of time.",9%,58,50%,116573,"A ragtag group of juvenile delinquents assigned the task of cleaning up an abandoned hotel find out just how deadly community service can be when they are stalked by a monstrous, four-hundred-pound maniac with a grudge in director Gregory Darks wrestling-infused survival horror flick. It was a mere four years ago that seven-foot menace Jacob Goodnight (WWE superstar Kane) was shot in the head and left for dead by a local police officer. But Jacob wasnt going down that easy. With a steel plate subsequently attached to his skull and ten razor-sharp fingernails ready to scrape grey matter from the skulls of his victims, Jacob retreated to the abandoned Blackwell Hotel, where he resided in the darkened, rotting hallways while planning his ultimate revenge. As fate would have it, Jacob wouldnt have to go far to satiate his raging bloodlust, though, and as the unsuspecting teens make their way through the crumbling corridors of the once-luxurious inn guided by the very same policeman who fired that misguided bullet years earlier, the notorious killer sharpens his nails, stalks his prey, and prepares for a little payback. ~ Jason Buchanan, Rovi","R (for strong gruesome violence and gore throughout, language, sexual content and some drug use)","Horror, Mystery & Suspense",Gregory Dark,Lionsgate Films,84 minutes,"Glenn 'Kane' Jacobs, Christina Vidal, Rachel Taylor"
9,11020,Lady in the Lake,N/A,60%,10,51%,1275,"Robert Montgomery is the director and star of the film noir mystery Lady in the Lake, adapted for the screen by source novelist Raymond Chandler. Montgomery plays detective Philip Marlowe, a private eye who just wants to publish his own crime stories. Kingsby Publications editor Adrienne Fromsett (Audrey Totter) meets with Marlowe, but offers him a job as a detective instead of a writer. She wants him to find the missing wife of her boss, Mr. Kingsby (Leon Ames). (Adrienne wants them to proceed with their divorce so she can marry Kingsby herself.) Marlowe accepts the job and goes looking for clues at the home of the wifes sometime lover, Chris Lavery (Dick Simmons). When Marlowe gets knocked out and picked up for drunk driving, he decides to drop the case. He is drawn back in, however, when Adrienne suggests that Kingsbys wife is responsible for the murder of a mysterious lady in the lake. Lloyd Nolan and Tom Tully play two police detectives also on the case. Lady in the Lake is remembered as being filmed with a subjective camera -- almost entirely from Marlowes point of view -- and subsequently hyped by an MGM ad campaign. ~ Andrea LeVasseur, Rovi",NR,"Classics, Drama, Mystery & Suspense",Robert Montgomery,Warner Home Video,105 minutes,"Robert Montgomery, Audrey Totter, Lloyd Nolan"
10,11022,Who Killed the Electric Car?,"A searing indictment of big business and greed, Who Killed The Electric Car? is a well-tuned doc that simultaneously entertains and enrages.",89%,106,84%,43176,"An investigation into the death and resurrection of the electric car, as well as the role of renewable energy and sustainable living in our countrys future.",PG (for brief mild language),"Documentary, Musical & Performing Arts",Chris Paine,Sony Pictures Classics,90 minutes,"Greg ""Gadget"" Abbot, David Freeman, Dave Barthmuss"
11,11027,Career Opportunities,N/A,38%,16,37%,7109,"An irresponsible young man finds employment as a night-shift janitor at a department store. During his shift, he finds a young woman in the store after hours who is the daughter of a wealthy and abusive man and the two dream of impulsively heading for California together. Before they can leave, however, the store is broken into by thieves and they react accordingly.",PG-13 (adult situations/language),Comedy,Bryan Gordon,MCA Universal Home Video,83 minutes,"Frank Whaley, Jennifer Connelly, Dermot Mulroney"
12,11028,Hollow Man 2,N/A,20%,5,16%,9379,"A volunteer soldier and feared assassin find that the blessing of invisibility begets the curse of insanity in director Claudio Fähs action-packed sequel to Paul Verhoevens 2000 sci-fi thriller. When skilled mercenary Michael Griffin (Christian Slater) disappears to the eyes of the world, the world is about to become a very dangerous place. A seasoned killer who isnt afraid to take a life or two, Griffin will go to any lengths necessary to find the serum that will save his life and punish the scientists and government agents responsible for his transparent transformation. Now, with a trained killer set loose on the streets and time running out for the molecular biologist who holds the secret to Griffins condition, its up to fearless Seattle police detective Frank Turner (Peter Facinelli) to put his skills to the test and capture a killer who can literally vanish into thin air.","R (for violence, some sexuality/nudity and language.)","Action & Adventure, Horror, Science Fiction & Fantasy","Claudio Faeh, Claudio Fäh",Sony Pictures Home Entertainment,91 minutes,"Christian Slater, Laura Regan, Peter Facinelli"
13,11029,Chuck Berry: Hail! Hail! Rock 'n' Roll,N/A,88%,16,95%,514,"Hail! Hail! Rock n Roll features a concert organized to celebrate the 60th birthday of Chuck Berry. The show was filmed in Berrys hometown of St. Louis, MO, in 1987. Highly respected by fellow musicians and music fans alike, many consider Berry to be the father of rock & roll. Fellow musicians paying musical homage to Berry on his birthday include: Bo Diddley, Little Richard, Roy Orbison, The Everly Brothers, Eric Clapton, Linda Ronstadt, Keith Richards, and Bruce Springsteen.",PG,"Documentary, Musical & Performing Arts",Taylor Hackford,Universal Pictures,121 minutes,"Bo Diddley, Chuck Berry, Roy Orbison"
14,11034,High School Musical,"High School Musical is brazenly saccharine, but it makes up for it with its memorable show tunes, eye-popping choreography, and appealing cast.",63%,19,74%,470923,"The captain of the East High basketball team and the key member of the academic club shock the student body by teaming to audition for the upcoming school musical in a Disney Channel Original Movie thats all about being yourself and following your dreams. Troy (Zac Efron) is best known as the player who keeps the East High basketball team on the scoreboard. Of course, life isnt always about athletics, though, and as Troy slam-dunks on the boards, beautiful and brainy Gabriella (Vanessa Anne Hudgens) is raising the reputation of East High as the key member of the schools successful academic team. Despite their outgoing natures, no one would ever peg Troy and Gabriella as theater types. When word gets out that this popular pair has secretly chosen to reach for the stars and try their luck on the stage, the students of East High are about to learn an important lesson in teamwork while gearing up for a musical performance that will have their audience dancing in the aisles.",G,"Comedy, Drama, Musical & Performing Arts",Kenny Ortega,Walt Disney Pictures,98 minutes,"Zac Efron, Vanessa Hudgens, Ashley Tisdale"
15,11036,Drawing Restraint 9,"Some of the images are striking, if confusing, but the film is unbearably slow and tedious.",60%,47,68%,2687,"Shot in Nagasaki Bay on board the Japanese whaling ship Nisshin Maru. The relationship between self-imposed resistance and creativity, a theme that symbolically tracks through the construction and transformation of a vast sculpture of liquid vaseline, called The Field, which is molded, poured, bisected and reformed on the deck of the ship over the course of the film. Barriers hold form in place, and when they are removed, the film tracks the descent of form into states of sensual surrender and formal atrophy. This shift in the physical state of the sculpture is symbolically mirrored through the narrative of the guests, two occidental visitors to the ship.",NR,"Science Fiction & Fantasy, Special Interest",Matthew Barney,IFC Films,143 minutes,"Matthew Barney, Björk, Susil Osoma"
16,11037,Crossing the Bridge: The Sound of Istanbul,"Infused with cultural and political concerns, this film weaves together a rich tapestry of musical styles that celebrate the diversity that makes up contemporary Turkish life.",89%,36,87%,4183,"The rich musical heritage of the Turkish metropolis located between the Orient and the Occident comes to the screen in director Fatih Akins cinematic tribute to Istanbuls thriving music scene. In bringing both historic and recent expressions of Istanbuls unique legacy of music to the screen in a documentary that strives to both inform and entertain, Akin offers compelling insight into both the creative history of the city as well as the lives of the individuals who populate it.",NR,"Documentary, Musical & Performing Arts, Special Interest",Fatih Akin,Strand Releasing,90 minutes,"Alexander Hacke, Safiye Ayla, Cem Karaca"
17,11038,I Am A Sex Addict,"I Am a Sex Addict takes a penetrating look at troublesome compulsions, although its unsurprisingly self-indulgent focus may test the limits of some viewers.",63%,32,57%,13941,"On the eve of his third wedding, documentary filmmaker Caveh Zahedi bravely turns the camera on himself to explore his decade-long addiction to sex in an autobiographical tale of personal peccadillo featuring animation from Waking Life artist Bob Sabiston and featuring a rare film appearance by French porn legend Rebecca Lord. His previous marriages destroyed by his obsession with prostitutes and his many intimate relationships sabotaged by his unwavering commitment to the concept of open relationships, Zahedi boldly bares his soul before the camera to offer a comic look at the life of one man who truly cant get enough. ~ Jason Buchanan, Rovi",R,"Art House & International, Comedy, Documentary, Drama, Special Interest",Caveh Zahedi,IFC First Take,99 minutes,"Caveh Zahedi, Rebecca Lord, Emily Morse"
18,11040,Forever Mine,N/A,29%,7,42%,1551,"Writer/director Paul Schrader explored his well-documented interest in film noir with this modern-day crime story. A horribly disfigured man named Manuel Esquema (Joseph Fiennes) is called upon to help out Mark Brice (Ray Liotta), a former city councilman in a wealthy New York community. Brice has been accused of some serious financial irregularities, and Esquema is the sort of ""fixer"" who might be able to make his problems go away. Mark, however, doesnt recognize Esquema as the former Alan Ripley, who was working as a towel boy at the Florida resort where Mark and his wife Ella (Gretchen Mol) were honeymooning shortly after their marriage. Alan became obsessed with Ella the moment he saw her, and before long the two were engaged in a torrid affair. Ripley urged Ella to leave Mark for him, but she refused; Ripley followed them to New York, and when Ella eventually confessed her infidelity to Mark, he responded by shooting off half of Alans face. Alan survives and builds a new (and sinister) life for himself, but when Mark hires Esquema to help him, the former Alans obsession with Ella blooms anew. Forever Mine was screened in competition at the 1999 Toronto Film Festival.","R (adult situations/language, violence)","Art House & International, Comedy, Drama, Mystery & Suspense",Paul Schrader,"MGM Pictures, Inc.",115 minutes,"Joseph Fiennes, Ray Liotta, Gretchen Mol"
19,11041,The War Within,"The War Within attempts to get into the mind of a terrorist, and the result is believable and unsettling.",72%,57,64%,881,"The drama The War Within attempts to put a human face on a suicide bomber. Ayad Akhtar plays Hassan, a student from Pakistan matriculating in Paris. He is arrested for being a possible terrorist, and his brutal handling puts him in the mood for revenge when he eventually gets released. He becomes involved in a terrorist organization and eventually makes his way to the United Sates in order to carry out a bombing plot. When the other members in the plan are arrested, Hassan begins living with an old friend of his who lives a normal American life. Hassan begins to question his desire to go through with the bombing plot when he sees the happiness of his old friend.",R,"Art House & International, Drama",Joseph Castelo,Magnolia Pictures,100 minutes,"Ayad Akhtar, Nandana Sen, Firdous Bamji"
20,11044,Beyond the Rocks,N/A,86%,14,63%,314,"In this romantic melodrama, a beautiful young gold digger (Gloria Swanson) marries a much older man for his wealth and then falls in love with a handsome adventurer (Rudolph Valentino). The affair quickly heats up and before it goes too far the woman realizes her errant ways and decides to return to her husband. She then writes each man a letter explaining her decision. Unfortunately before they are delivered, a jealous woman steals them and switches the contents. The husband is so shocked and upset that he goes on safari to Africa. Both Swanson and Valentino follow him to beg forgiveness. They arrive just as her husband, whose party was attacked by outlaws, lay dying. Before he expires, he gives the lovers his blessings.",NR,"Classics, Drama, Romance",Sam Wood,Paramount Pictures,85 minutes,"Gloria Swanson, Rudolph Valentino, Edythe Chapman"
21,11047,Stoned,"Poorly cast and sloppily assembled, Stoned turns one of rock 'n' roll's most darkly fascinating mysteries into a cinematic tragedy all its own.",14%,49,45%,22416,"This is the tale of debauched 1960s rock icon, Brian Jones, the charismatic guitarist who co-founded the Rolling Stones but was fired in 1969. A few weeks later he was found dead at the bottom of his swimming pool.","R (for drug use, sexuality, nudity and language)",Drama,Stephen Woolley,Screen Media Films,97 minutes,"Leo Gregory, Paddy Considine, David Morrissey"
