,dataIndex,realTitle,criticsConcensus,tomatoMeter,tomatoCount,audienceScore,audienceCount,realSynopsis,rating,genreString,directedBy,studio,runTime,cast
112,11253,Gabrielle,Patrice Chéreau's exquisite rendering of Joseph Conrad's The Return brings underlying passions to surface in a long-suffering marriage.,74%,54,55%,16677,"The events that overwhelm a middle-aged, seemingly happily married couple. The arrogant, bourgeois M. Hervey descends from a train into the teeming bustle of the city. While on his way home, he reflects on the sturdiness of his life: the success he has made of it, and the fortress of security he has built around himself. It is not long before his self-satisfaction is rudely shattered when he discovers a letter from his wife, Gabrielle, waiting for him on his sideboard. The contents of the message will crumble that security and plunge him into newfound feelings of vulnerability, abandonment and betrayal. Husband and wife find themselves engaged in a parry-and-thrust of emotions that change mid-sentence and stretch their ability to function and live in the same house.",G,"Art House & International, Drama, Romance",Patrice Chéreau,IFC First Take,90 minutes,"Isabelle Huppert, Pascal Greggory, Raina Kabaivanska"
113,11254,Trust the Man,"What aspires to be a sophisticated, unconventional romantic comedy turns out to be a contrivance-filled pretender to other, better films of its genre.",28%,102,35%,25619,"This comedy follows the romantic escapades of two couples -- a successful actress and her stay-at-home husband and her slacker younger brother and his aspiring novelist girlfriend -- as they search for love in the midst of careers, family, infidelity and the ever-daunting search for Manhattan street parking.",R (for language and sexual content),"Comedy, Drama, Romance",Bart Freundlich,Fox Searchlight Pictures,128 minutes,"David Duchovny, Julianne Moore, Billy Crudup"
114,11255,Sherrybaby,Maggie Gyllenhaal delivers riveting performance as a recovering drug addict in a depressing and not entirely believable movie.,75%,67,57%,37565,"An emotionally stunted ex-convict whose recent release from prison finds her attempting to form a relationship with her young daughter finds that redemption doesnt come easy in this emotional family drama, the feature debut of award-winning documentary filmmaker Laurie Collyer. When Sherry Swanson (Maggie Gyllenhaal) was sentenced to three years in prison on a drug-related robbery conviction at the age of 22, she had just given birth to a daughter named Alexis (Ryan Simpkins). Placed in the care of Sherrys brother, Bobby (Brad William Henke), and sister-in-law, Lynette (Bridget Barkan), while her mother was behind bars, young Alexis has grown into an affectionate young girl eager to reconnect with the mother she has never met. Though Sherry at first seems determined to stay on the straight and narrow, increasingly infrequent visits to Alexis and a troubling revelation about her family past soon begin to lead the protective Lynette to take a stand in protecting the vulnerable youngster. Later, when compassionate 12-step veteran Dean (Danny Trejo) makes an effort to help Sherry become the mother she longs to be, the troubled ex-con is faced with the choice of truly living up to her word or potentially losing her daughter forever. ~ Jason Buchanan, Rovi","R (for strong sexuality, nudity, language and drug content)",Drama,Laurie Collyer,IFC,96 minutes,"Maggie Gyllenhaal, Giancarlo Esposito, Bridget Barkan"
115,11257,Idiocracy,Idiocracy delivers the hilarity and biting satire that could only come from Mike Judge.,76%,46,60%,64885,"In 2005, average in every way private Joe Bowers (Luke Wilson) is selected to take part in a secret military experiment to put him in hibernation for a year along with a woman named Rita (Maya Rudolph). The slumbering duo is forgotten when the base they are stored on is closed down and are left in stasis until 2505. When they finally wake up, they discover the average intelligence of humans has decreased so much that Joe is now the smartest man in the world.",R (for language and sex-related humor),"Action & Adventure, Comedy, Science Fiction & Fantasy",Mike Judge,20th Century Fox,104 minutes,"Luke Wilson, Maya Rudolph, Dax Shepard"
116,11258,Jesus Camp,"Evangelical indoctrination is given an unflinching, even-handed look in this utterly worthwhile documentary.",87%,104,80%,67557,"The youngest foot soldiers for the Lord are shown in their native environment in this documentary. Becky Fischer is a childrens pastor who runs ""Kids on Fire,"" a summer camp for evangelical Christian children in North Dakota. Fischer believes in the political and moral importance of a Christian presence in America, and uses her camp to reinforce the religious training most of her charges are already receiving at home (the majority of the campers are home-schooled by their parents). Using video games, animated videos, and group activities to help put her message across, Fischer encourages the kids to pray for George W. Bush and his Supreme Court appointees while urging them to help ""take back America for Christ."" For the most part, the children seem reasonably ordinary beyond the fact they pray with uncommon fervor and sometimes speak in tongues. Along with Fischer and her cohorts, Jesus Camp features interviews with Ted Haggard, an evangelist and advisor to George W. Bush, and Mike Papantonio, a Christian talk-show host who believes the right-wing slant of many Christian evangelists is taking the church into a dangerous direction. Jesus Camp was directed by Heidi Ewing and Rachel Grady, who previously made the acclaimed The Boys of Baraka. ~ Mark Deming, Rovi",PG-13 (for some discussions of mature subject matter),"Documentary, Musical & Performing Arts, Faith & Spirituality","Heidi Ewing, Rachel Grady",Magnolia Pictures,86 minutes,"Pastor Becky Fischer, Levi, Mike Papantonio"
117,11260,The Crusades,N/A,100%,5,44%,192,"The Holy Wars are given the usual overblown Cecil B. DeMille treatment in The Crusades. It all begins in the 12th-century AD, when Jerusalem falls into the hands of the Saracens, and the Christians are slaughtered or sold into slavery. A holy man known as The Hermit (C. Aubrey Smith) rallies the rulers of England and Europe to launch a Crusade to reclaim Jerusalem in the name of Christianity. Among those embarking upon this massive undertaking is Englands King Richard the Lion-Hearted (played as a swaggering roughneck by Henry Wilcoxon), who finances his knights by marrying wealthy French princess Berengaria (Loretta Young) sight unseen. Saladin (Ian Keith), the elegant and well-spoken ruler of the Saracens, attempts to stave off the crusaders by kidnapping Berengaria and holding her hostage. Sensing that he can never win against so formidable a collection of foes, Saladin eventually opens the gates of Jerusalem to all but Richard the Lion-Hearted, with whom he has a personal score to settle. In the films most memorable scene, the fundamental difference between the boorish Richard and the cultured Saladin is demonstrated when the Saracen ruler delicately cleaves Berengarias silk scarf in twain with his gleaming sword. It took a great deal of nerve to depict the films hero as a thuggish brute and the nominal villain as the most sympathetic character in the story, but DeMille gets away with it in The Crusades, and still has time left over to deliver his usual quota of thrills, pageantry, convoluted history and campy dialogue. And yes, that is Ann Sheridan as a Christian captive in the opening scenes.",NR,"Action & Adventure, Classics, Drama",Cecil B. DeMille,Paramount Pictures,123 minutes,"Henry Wilcoxon, Loretta Young, Ian Keith"
118,11262,Pretty Poison,N/A,100%,6,71%,956,"Easygoing but psychotic Dennis (Anthony Perkins) is released from jail, where he has served a sentence for his complicity in a suspicious death. Wandering through a small, working-class New England town, Dennis befriends apparently normal high school A-student Sue Ann (Tuesday Weld). He fills her head with lies about his imaginary career as a secret agent. She is thrilled, and makes up her mind to join him in his further adventures. This jet-black ""whos manipulating who?"" seriocomedy was adapted by Lorenzo Semple Jr. from Stephen Gellers novel She Let Him Continue. ~ Hal Erickson, Rovi",R,"Classics, Drama, Mystery & Suspense, Romance",Noel Black,Fox,89 minutes,"Anthony Perkins, Tuesday Weld, Beverly Garland"
119,11263,The Fountain,"The Fountain -- a movie about metaphysics, universal patterns, Biblical symbolism, and boundless love spread across one thousand years -- is visually rich but suffers from its own unfocused ambitions.",52%,205,74%,261881,"Requiem for a Dream director Darren Aronofsky switches gears from drug-induced urban malaise to abstract science fiction with this time-tripping symbolic tale of a mans thousand-year quest to save the woman he loves. Moving between representational stories and images, this meditation on life and death focuses on the concept of the mythical Tree of Life that is said to bestow immortality to all who drink of its sap. In one of the films allegorical timelines, a 16th century Spanish conquistador played by Hugh Jackman sets out to find the tree in order to save his queen (Rachel Weisz) from the Inquisition. Another conceptual story finds Jackman centuries later, struggling with mortality as a modern-day scientist desperately searching for the medical breakthrough that will save the life of his cancer-stricken wife, Izzi. The third and most abstract concept finds Jackman as a different incarnation of the same character-idea, this time questing for eternal life within the confines of a floating sphere transporting the aged Tree of Life through the depths of space. Even more avant-garde than his breakthrough film Pi, The Fountain finds Aronofsky almost completely abandoning conventional story structure in favor of something more cinematically abstract. Though the film was originally slapped with an R by the MPAA, Aronofsky and co. re-edited it to conform to a PG-13 rating. ~ Jason Buchanan, Rovi","PG-13 (for some intense sequences of violent action, some sensuality and language)","Drama, Science Fiction & Fantasy",Darren Aronofsky,Warner Bros. Pictures,95 minutes,"Hugh Jackman, Rachel Weisz, Ellen Burstyn"
120,11267,A Boy Named Charlie Brown,N/A,95%,20,86%,327683,"Charlie Brown and his fellow Peanuts make their feature film debut in this animated comedy that is based on Charles Schultz long-lived cartoon strip. The story centers on a national spelling bee. Lucky Charlie Brown is so excited that he is selected to participate in it, but will he be able to overcome his chronic bad-karma and actually win?",G,"Animation, Kids & Family",Bill Melendez,Cinema Center 100 Productions,86 minutes,"Peter Robbins, Pamelyn Ferdin, Glenn Gilger"
121,11268,"Snoopy, Come Home",N/A,93%,14,84%,3437,"This second feature film based on Charles Schultzs charming, unpretentious Peanuts comic strip is a vast improvement over the first film, A Boy Named Charlie Brown (it doesnt have the Rod McKuen music, for one thing). Snoopy, Come Home centers upon the adventures of Charlie Browns pet beagle, Snoopy, and his tiny, yellow pal, Woodstock. When Snoopys original owner Lila is hospitalized, the two take-off to comfort her. Back home, Charlie Brown is being ribbed by his friends because of the revelation that Snoopy had a previous owner (""Youve got a used dog, Charlie Brown!"" one child cries). All of this leads up to a fateful decision for Snoopy -- which owner will Snoopy choose to live with?",G,"Animation, Comedy, Drama, Kids & Family",Bill Melendez,National General Pictures,80 minutes,"Chad Webber, Robin Kohn, Stephen Shea"
122,11271,City for Conquest,N/A,80%,5,76%,576,"This filmization of Aben Kandels novel City for Conquest stars James Cagney as a truck driver-turned-boxer. As Cagney rises to the top in the ring, his ex-girlfriend Ann Sheridan forms a dance act with Anthony Quinn. Blinded during a fight by acid-tinged boxing gloves, Cagney tries to exact revenge on the gangster who arranged the ""accident,"" but is wounded in the melee. Now physically handicapped as well as visually challenged, Cagney becomes the manager of a New York newsstand through the kindness of his former manager Donald Crisp. Cagney uses his earnings to finance the musical education of his violinist brother Arthur Kennedy. Years later, a jilted Sheridan is reunited with Cagney at his newsstand, as both of them listen to the radio debut of Kennedys first symphony. Upon its reissue in 1948, the film then ends abruptly (as do several preceding scenes) in order to fit a 98 minute running time; the original 1940 release ran 106 minutes.",NR,"Classics, Drama",Anatole Litvak,WARNER BROTHERS PICTURES,106 minutes,"James Cagney, Ann Sheridan, Arthur Kennedy"
123,11274,The Long Voyage Home,N/A,100%,10,71%,680,"Four one-act plays by Eugene ONeill form the basis of John Fords World War II drama about the lives of merchant seamen. John Wayne stars as Ole Olsen, a young Swede attempting to get home as the rest of his crew prepares for shore leave; when he is drugged and kidnapped by the members of a rival ship, battle ensues.",NR,"Classics, Drama",John Ford,Criterion Collection,105 minutes,"John Wayne, Thomas Mitchell, Ian Hunter"
124,11275,Not as a Stranger (Morton Thompson's Not as a Stranger),N/A,13%,8,54%,254,"Ambitious but impecunious medical student Lucas Marsh (Robert Mitchum) marries the older and (in this film, at least) not especially attractive Kristina Hedvigson (Olivia de Havilland) so that she can pay his tuition fees. Kristina loves Lucas, but he loves nothing but his work. Emotionally shutting himself off from everyone -- including best friend, Alfred Boone (Frank Sinatra), and drunken dad, Job Marsh (Lon Chaney Jr.) -- Lucas survives his training and goes to work as the assistant to tough but tender small-town medico Dr. Runkleman (Charles Bickford). He enters into an affair with wealthy Harriet Lang (Gloria Grahame) (watch for the symbolism-laden tryst in the horse barn!), obliging Alfred, now a big-city doctor, to try to patch up his pals marriage. But Lucas feels nothing and needs no one because hes come to think of himself as the perfect physician, incapable of making an error. When Lucas fails to revive his mentor Dr. Runkleman during heart surgery (a genuine heart is used in the ""massage"" close-ups), the young doctor suddenly realizes that hes not infallible after all. He wanders aimlessly through town, finally returning to his wife and collapsing into her arms, sobbing ""Help me! Please help me!"" Cameo players range from Broderick Crawford as a Jewish doctor denied entry into medicines upper circles to Carl Switzer as a bug-eyed patient. The film was adapted from the best-selling novel by Morton Thompson. ~ Hal Erickson, Rovi",NR,"Classics, Drama","Stanley Kramer, Frank Kramer",United Artists,135 minutes,"Robert Mitchum, Frank Sinatra, Olivia de Havilland"
125,11278,Everyone's Hero,Everyone's Hero is such a predictable and bland tale that it'll appeal mostly to little kids; others seeking something in Pixar's league are looking in the wrong ballpark.,42%,69,44%,76599,"A young boy finds himself at an extraordinary crossroads: He has a chance to be a hero--and make a difference against incredible odds--or he can play it safe. With faith in himself instilled by his family, he teams up with a sassy young girl and some off-the-wall sidekicks and embarks on a sometimes perilous, often funny, cross-country quest. In the process, he restores his familys honor, befriends the worlds biggest sports superstar and reveals the hero within.",G,"Action & Adventure, Animation, Comedy, Kids & Family","Christopher Reeve, Dan St. Pierre, Colin Brady, Daniel St. Pierre",20th Century Fox,87 minutes,"Jake T. Austin, Raven-Symoné, Whoopi Goldberg"
126,11279,Gridiron Gang,"The role of probation officer Sean Porter fits Dwayne ""The Rock"" Johnson like a glove; however, the execution is so cliched, the youths' stories (based on real events), fail to inspire.",43%,101,81%,286837,"The true story of the football team that proved sometimes second chances can make a difference comes to the screen in director Phil Joanous tale of self-respect and social responsibility on the gridiron. Sean Porter (The Rock) is a detention camp probation officer who oversees the inmates at Camp Kilpatrick in Los Angeles and isnt willing to simply write off the violent offenders who have been placed in his care. Though their prospects for the future are decidedly bleak, Porter is convinced that if he can just get through to his adolescent inmates they may finally be able to turn their lives around and make amends for the mistakes of their past. When Porters proposal of forming a high-school-level football team at Camp Kilpatrick meets with skepticism and resistance in the highest ranks, the determined coach puts his career on the line to prove that even convicted criminals can acquire the tools needed to build a brighter future when given the proper motivation and the means of doing so. Inspired by filmmaker Jac Flanders 1993 documentary of the same name, Gridiron Gang features a screenplay penned by In the Line of Fire scribe Jeff Maguire, and features a supporting cast that includes Leon Rippy, Kevin Dunn, and Detroit-born rapper-turned-actor Xzibit.","PG-13 (for some startling scenes of violence, mature thematic material and language)","Action & Adventure, Drama",Phil Joanou,Sony Pictures,120 minutes,"Xzibit, L. Scott Caldwell, Leon Rippy"
127,11282,Wonder Man,N/A,100%,9,85%,1502,"In this film, Danny Kaye appears as timid librarian Edwin Dingle and Edwins extroverted twin brother, nightclub entertainer Buzzy Bellew. When Buzzy witnesses a gangland shooting, he himself is rubbed out. Before long, Edwin is visited by Buzzys ghost, who persuades his bookish brother to bring the mobsters to justice.",G,"Classics, Comedy, Drama, Musical & Performing Arts, Science Fiction & Fantasy",H. Bruce Humberstone,Embassy Home Entertainment,98 minutes,"Danny Kaye, Virginia Mayo, Vera-Ellen"
128,11284,Streamers,N/A,56%,9,46%,343,"Based on the virulently antimilitary play by David Rabe, Streamers is set in a basic-training barracks. Matthew Modine is among the raw recruits who alternate between strutting around like bantam cocks to snivelling like frightened children. To test one anothers manhood, the recruits indulge in violent physical and verbal game playing. Special attention is given those whose skin color or outlook on life is at odds with the ""standards"" of the group.",R,Drama,Robert Altman,United Artists,118 minutes,"Matthew Modine, Michael Wright, Mitchell Lichtenstein"
129,11286,Lemming,"A creepy psychological thriller, with superb performances and natural tension flowing from every frame, Lemming is a worthy successor to Dominik Moll's With A Friend Like Harry.",73%,48,62%,7240,"Alain Getty, a brilliant young home automation engineer, and his wife Benedicte having recently arrived in a new town, invite Alains boss Richard Pollock and his wife Alice to dinner. The encounter does not leave the young couples harmony unscathed. The discovery of a mysterious rodents corpse blocking the waste pipe of their kitchen sink does nothing to help and portends the bursting of irrationality into a hitherto orderly life.",NR,"Art House & International, Drama",Dominik Moll,Celluloid Dreams,129 minutes,"Charlotte Gainsbourg, Laurent Lucas, Charlotte Rampling"
130,11287,Taxidermia,"Surreal and visually striking, Taxidermia is, at times, graphic and difficult to watch, but creatively touches on disturbing subjects with imagination and wit.",81%,47,76%,6201,"""Taxideremia"" contains three generational stories, about a grandfather, a father, and a son, linked together by recurring motifs. The dim grandfather, an orderly during World War Two, lives in his bizarre fantasies; he desires love. The huge father seeks success as a top athlete -- a speed eater -- in the post-war pro-Soviet era. The grandson, a meek, small-boned taxidermist, yearns for something greater: immortality. He wants to create the most perfect work of art of all time by stuffing his own torso. Historical facts and surrealism become intertwined as magical realism, like in the works of Gabriel García Marquez or the Hungarian writer Lajos Parti Nagy; the script is based on two of the latters stories. Palfi added the third story, that of the grandson the taxidermist.",NR,"Art House & International, Comedy, Drama, Horror",György Pálfi,Regent Releasing,91 minutes,"Csaba Czene, Gergo Trocsanyi, Marc Bischoff"
131,11294,Piccadilly,N/A,86%,21,75%,538,A scullery maid turned nightclub performer steals the screen -- and the leading man -- from her rival.,NR,"Classics, Drama","E.A. Dupont, Ewald André Dupont",British International Pictures,92 minutes,"Gilda Gray, Anna May Wong, Jameson Thomas"
132,11296,Apocalypto,"Apocalypto is a brilliantly filmed, if mercilessly bloody, examination of a once great civilization.",66%,198,79%,442461,"""Apocalypto"" is a heart stopping mythic action-adventure set against the turbulent end times of the once great Mayan civilization. When his idyllic existence is brutally disrupted by a violent invading force, a man is taken on a perilous journey to a world ruled by fear and oppression where a harrowing end awaits him. Through a twist of fate and spurred by the power of his love for his woman and his family he will make a desperate break to return home and to ultimately save his way of life.",R (for sequences of graphic violence and disturbing images),"Action & Adventure, Classics, Drama",Mel Gibson,Buena Vista,138 minutes,"Rudy Youngblood, Dalia Hernandez, Jonathan Brewer"
133,11297,Household Saints,N/A,50%,12,73%,688,"Household Saints is a leisurely-paced portrait of three different generations of working-class, New York-based, Italian women. Carmela Santangelo (Judith Malina) is an elderly immigrant whose son (Vincent DOnofrio) wins a wife, Catherine Falconetti (Tracey Ullman), during a pinochle game. The pair have a daughter, Teresa (Lili Taylor), who becomes obsessed with religion, eventually believing that she will become the bride of Christ.","R (adult situations/language, nudity, sex)","Comedy, Drama, Faith & Spirituality",Nancy Savoca,Sony Pictures Home Entertainment,124 minutes,"Tracey Ullman, Vincent D'Onofrio, Lili Taylor"
134,11298,Raintree County,N/A,11%,9,53%,650,"In this film, Elizabeth Taylor stars as a spoiled Southern belle who falls in love with pacifistic Indiana youth Montgomery Clift. Though Clift is engaged to Eva Marie Saint, what Taylor wants, Taylor gets, and she isnt above using the dirtiest of deceptions to win Clifts affections.",PG-13 (nothing objectionable),"Classics, Drama, Romance",Edward Dmytryk,MGM Home Entertainment,175 minutes,"Montgomery Clift, Elizabeth Taylor, Eva Marie Saint"
135,11299,Flyboys,A poorly scripted history-rewriting exercise with mediocre acting and unconvincing CGI battle scenes.,33%,128,67%,88481,"As World War I rages in Europe and Allied forces in France, Italy, and England find their resolve quickly diminishing due to the overwhelming force of the German juggernaut, a handful of brave American soldiers volunteer to join their French counterparts in learning to fly and fighting for freedom from above as the true story of the legendary Lafayette Escadrille comes to the screen in a breathtaking war adventure from Academy Award-winning director Tony Bill and famed producer Dean Devlin. They have come from all over the United States, ready and willing to put their lives on the line despite their countrys initial pledge to not get involved with the all-consuming war that rages throughout Europe. Few could have foreseen the challenges faced by the worlds first fighter pilots, however, and upon arriving at their aerodrome in France, the aspiring aviators are assigned to a new squadron under the command of war-ravaged Captain Thenault (Jean Reno) and battle-weary American pilot Reed Cassidy -- the sole survivor of his devastated former air brigade. With little encouragement from their fellow aviators and nothing to drive but their unifying goal of taking to the skies and offering up their lives in the name of freedom, the determined airmen of the Lafayette Escadrille set out to make history by embarking on the adventure of a lifetime. James Franco, Martin Henderson, and David Ellison star in a script penned by Phil Sears, Blake T. Evans, and David S. Ward.",PG-13 (for war action violence and some sexual content),"Action & Adventure, Drama",Tony Bill,MGM,140 minutes,"James Franco, Martin Henderson, David Ellison"
