,dataIndex,realTitle,criticsConcensus,tomatoMeter,tomatoCount,audienceScore,audienceCount,realSynopsis,rating,genreString,directedBy,studio,runTime,cast
312,11698,Nomad,N/A,6%,16,40%,6719,"Czech New Wave leader Ivan Passer picks up the torch originally ignited by Russian director Sergei Bodrov to bring Central Asias first-ever event film to the light of the silver screen. Penned by Russian screenwriter Rustam Ibragimbekov, Nomad tells the tale of 18th-century Kazak military strategist Ablai Khan -- a forward-thinking visionary whose efforts to unify his country eventually helped to define Kazakhstans borders. Warned by a mystical Kazak warrior named Oraz (Jason Scott Lee) that a child who will unite the warring local tribes and free his people is about to be born, invading Jungar leader Galdan Ceren (Doskhan Zholzhaxynov) -- whose soldiers are currently occupying Kazakhstan -- instructs his assassins to target Mansur (Kuno Becker), the son of a local sultan. After being saved from a grim fate by none other than Oraz, Mansur is raised to become a fearless warrior whose vision of a unified Kazak state drives him to fulfill the ancient prophecy. Tirelessly training alongside his best friend Erali (Jay Hernandez), Mansur leaps into action when love interest Gaukhar (Ayanat Yesmagambetova) is abducted by malevolent Jungar swordsman Sharish (Mark Decascos). Originally set to be helmed exclusively by Passer, Nomad was finished by director Bodrov after a production hiatus threw the fate of the film into question and the European production partner Wild Bunch stepped in to help assure that the film was eventually completed.",R (for violence),"Classics, Drama","Ivan Passer, Sergey Bodrov, Talgat Temenov",The Weinstein Co.,112 minutes,"Kuno Becker, Jay Hernandez, Jason Scott Lee"
313,11719,The Tarnished Angels,N/A,100%,9,70%,401,"In this film, Robert Stack is a disillusioned WWI ace eking out a living as a barnstorming pilot/parachutist during the early 1930s. New Orleans newspaperman Rock Hudson runs across Stack at a two-bit carnival. He becomes fascinated with Stacks fall from grace and latches onto him.",NR,"Action & Adventure, Drama",Douglas Sirk,Universal Pictures,91 minutes,"Rock Hudson, Robert Stack, Dorothy Malone"
314,11721,Blades of Glory,Thanks to the spirited performances of a talented cast - particularly Will Ferrell and Jon Heder as rivals-turned-teammates -- Blades of Glory successfully spoofs inspirational sports dramas with inspired abandon.,70%,185,68%,1402983,"Will Ferrell, Jon Heder, and Will Arnett headline this high-concept comedy concerning two male figure-skating rivals aching to compete despite having been banned from the sport. Their medals stripped after getting into a highly publicized fight at the World Championships, star figure skaters Chazz Michael Michaels (Ferrell) and Jimmy MacElroy (Heder) are barred from ever competing in the sport again. Upon discovering a loophole that will allow them to perform together in the pairs figure skating category, the two athletes determine to put their differences aside in order to pursue their gold medal aspirations. Amy Poehler, Jenna Fischer, Craig T. Nelson, and Rob Corddry co-star. ~ Jason Buchanan, Rovi","PG-13 (for crude and sexual humor, language, a comic violent image and some drug references)",Comedy,"Will Speck, Josh Gordon",Paramount Pictures,93 minutes,"Will Ferrell, Jon Heder, Will Arnett"
315,11724,Are We Done Yet?,Are We Done Yet? plays it way too safe with generic slapstick and uninspired domestic foibles.,8%,92,39%,21,"Having decided to ditch the city in favor of the suburbs, a newly formed family purchases a quaint ""fixer-upper"" that proves to be more trouble than they could have ever anticipated in a rollicking family comedy thats half sequel to Are We There Yet?, and half remake of Mr. Blandings Builds His Dream House. Nick (Ice Cube) and Suzanne (Nia Long) have tied the knot, and now the couple is looking for a suitable home in which to raise their family. What better place to bring up adolescents Lindsey (Aleisha Allen) and Kevin (Philip Daniel Bolden) than a quiet house in the suburbs? Despite their outward excitement at the prospect of moving into their very own home, the family soon discovers that dreams dont come easy as eccentric contractor Chuck Mitchell (John C. McGinley) clashes with the head of the family while forming a frustratingly close bond with his wife and two step-children. As the promising fixer-upper begins to pose a serious threat to the burgeoning familys bank account, Nick gradually begins to realize that the suburban dream doesnt come cheap.",PG (for some innuendos and brief language),Comedy,Steve Carr,Sony Pictures,92 minutes,"Ice Cube, Nia Long, John C. McGinley"
316,11725,The Reaping,"It may feature such accomplished actors as Hilary Swank and Stephen Rea, but The Reaping also boasts the apropos tagline ""What hath God wrought?"" It's schlocky, spiritually shallow, and scare-free.",8%,134,49%,78980,"A former Christian missionary, who lost her faith after her family was tragically killed, has since become a world renowned expert in disproving religious phenomena. But, when she investigates a small Louisiana town that is suffering from what appear to be the Biblical plagues, she realizes that science cannot explain what is happening, and she must regain her faith to combat the dark forces threatening the community.","R (for violence, disturbing images and some sexuality)","Horror, Mystery & Suspense",Stephen Hopkins,Warner Bros. Pictures,99 minutes,"Hilary Swank, David Morrissey, Idris Elba"
317,11726,Firehouse Dog,"Firehouse Dog's cute premise is ruined with endless fart and poop jokes, and an overlong run time.",38%,82,62%,94073,"Rex, Hollywoods top-grossing canine, is known for his extreme athletic abilities and diva-like demeanor. His perks package, rivaling that of any A-list celebrity, includes Kobe beef, a poodle harem, and a diamond collar. Rexs luck--and Hollywood high life--runs out while shooting a commercial. An aerial stunt goes awry, leading Rexs handlers to presume hes dead. But Rex is merely lost--alone, filthy and unrecognizable in an unfamiliar city. Chased by animal control, he takes refuge in grubby abandoned lofts, a far cry from his former luxurious lifestyle. Shane Fahey, a bright but rebellious 12-year-old, has exasperated his father Connor for the umpteenth time. A single parent and captain of the rundown inner city fire station known as Dogpatch, Connor is charged with inspiring the sad-sack company: veteran and firehouse cook Joe Musto, the super-fit and strong-willed mother hen Pepita ""Pep"" Clemente (Mayte Garcia), the exhausted family-man Lionel Bradford, and the calendar-worthy rookie Terence Kahn. The team is still coping with the recent loss of their former captain, Connors brother. Shane is also troubled by his uncles death, and hes been acting out by ditching school.","PG (for sequences of action peril, some mild crude humor and language)","Action & Adventure, Comedy, Kids & Family","Tom Dey, Todd Holland",20th Century Fox,111 minutes,"Josh Hutcherson, Bruce Greenwood, Bill Nunn"
318,11727,Meet the Robinsons,Meet the Robinsons is a visually impressive children's animated film marked by a story of considerable depth.,67%,141,74%,400070,"An orphan who dreams of someday finding a family to call his own finds his fate taking an unexpected turn when a mysterious stranger named Wilbur Robinson transports him into the future. Based on the book A Day With Wilbur Robinson by William Joyce, Meet the Robinsons tells the story of a boy with a lifelong wish to belong, and shows what happens when he meets an incredible collection of characters who just might have the power to make his wildest fantasies come true. The films all-star cast of vocal contributors -- including Angela Bassett, Kelly Ripa, Tom Selleck, Adam West, Steve Zahn, and Laurie Metcalf -- brings the world of the future to life as never before seen on the silver screen. ~ Jason Buchanan, Rovi",G,"Action & Adventure, Animation, Kids & Family","Stephen J. Anderson, Stephen Anderson",Buena Vista,96 minutes,"Angela Bassett, Daniel Hansen, Jordan Fry"
319,11728,American Hardcore,American Hardcore is an informative and highly entertaining look at the heyday of punk in the early 1980s.,72%,61,78%,34886,"Generally unheralded at the time, the early-80s Hardcore Punk Rock scene gave birth to much of the rock music and culture that followed. There would be no Nirvana, Beastie Boys or Red Hot Chili Peppers were it not for hardcore pioneers such as Black Flag, Bad Brains and Minor Threat. Hardcore was more than music -- it was a social movement created by Reagan-era misfit kids. The participants constituted a tribe unto themselves -- some finding a voice, others an escape in the hard-edged music; some sought a better world, others were just angry and wanted to raise hell.",R (for pervasive language including sex and drug references),"Documentary, Musical & Performing Arts",Paul Rachman,Sony Pictures Classics,98 minutes,"The Circle Jerks, Flea, M.D.C."
320,11729,Quel maledetto treno blindato (The Inglorious Bastards),N/A,100%,5,69%,614799,"The Inglorious Bastards was the alternate title for the Italian adventure yarn Counterfeit Commandos. The main characters are five soldiers facing court-martial in World War II France. The quintet consists of Bo Svenson, Fred Williamson, Peter Hooten, Michael Pergolami, and Jackie Basehart. The men escape, heading to the safety of the Swiss border; along the way, they pull off several random acts of above-and-beyond heroism. ~ Hal Erickson, Rovi",R,"Action & Adventure, Art House & International, Comedy",Enzo G. Castellari,Severin Films,99 minutes,"Bo Svenson, Fred Williamson, Ian Bannen"
321,11730,Seraphim Falls,"A brutal, slow-moving drama that unfolds among some great-looking scenery.",55%,85,54%,10952,"Frequent television director David Von Ancken (Oz and The Shield) offers a thrilling meditation on the true nature of revenge with this post-Civil War era tale of a one mans quest to put his nemesis in the ground, and another mans struggle to survive at any cost. Deep in the snowy mountains of the American West, a lone man named Gideon (Pierce Brosnan) basks, lost in thought, in the warm glow of a small fire. When a shot suddenly rings out and a bullet whizzes just inches from his head, Gideon is suddenly pulled from his repose. His reaction is too slow, however, to save him from the impact of a second bullet fired immediately thereafter; a bullet that painfully lodges itself into the soft flesh of Gideons tired shoulder. The man who fired these bullets is Colonel Morsman Carver (Liam Neeson), and Carvers goal is to hunt Gideon down like an animal and extract painful revenge for a past transgression that left Colonel Carver forever changed. From this point on, there will be no peace in either mans life as a harrowing game of kill-or-be-killed is played out against the backdrop of the awe-inspiring and deceptively treacherous wilderness where the unforgiving law of the land takes deadly precedence over the civility of modern society.",R (for violence and brief language.),"Action & Adventure, Drama, Mystery & Suspense, Western",David Von Ancken,Samuel Goldwyn Films,112 minutes,"Liam Neeson, Pierce Brosnan, Michael Wincott"
322,11732,Sunshine,"Danny Boyle continues his descent into mind-twisting sci-fi madness, taking us along for the ride. Sunshine fulfills the dual requisite necessary to become classic sci-fi: dazzling visuals with intelligent action.",76%,169,73%,168290,"As the sun begins to dim along with humankinds hope for the future, its up to a desperate crew of eight astronauts to reach the dying star and reignite the fire that will bring life back to planet Earth in this tense psychological sci-fi thriller that re-teams 28 Days Later director Danny Boyle with writer Alex Garland and producer Andrew Macdonald. The skies are darkening, and the outlook for planet Earth is grim. Though the encroaching darkness at first seems unstoppable, scientists have concocted one desperate last-ditch plan to buy the human race a temporary reprieve from the grim future that looms just past the horizon. A crew of eight men and women has been given a nuclear device designed to literally reignite the sun and sent hurtling through infinity on the most crucial space mission ever attempted. Suddenly, as the crew loses radio contact with mission control, everything begins to fall apart. Now, in the farthest reaches of the galaxy, the men and women who may hold the key to ultimate survival find themselves not only struggling for their lives, but their sanity as well. Rose Byrne, Chris Evans, Cillian Murphy, and Michelle Yeoh star in a film that asks audiences just what would become of humankind if the sky suddenly went black.",R (for violent content and language),"Drama, Science Fiction & Fantasy",Danny Boyle,Fox Searchlight Pictures,107 minutes,"Cillian Murphy, Chris Evans, Rose Byrne"
323,11733,Judge Priest,N/A,80%,5,49%,356,"Will Rogers stars as Judge William ""Billy"" Priest, the common-sense Kentucky jurist created by humorist Irvin S. Cobb. The Judges easygoing manner bothers many of the self-righteous good citizens of his small 19th-century hometown, imperiling his chances for re-election. The anecdotal plot boils down to a single storyline involving orphaned Anita Louise, reclusive David Landau (secretly Louises father), and young attorney Tom Brown.The testimony that saves Landau from a murder charge is delivered by Civil War veteran H.B. Walthall, whose stirring loyalty to the Confederacy inspires everyone in town to organize an impromptu parade! Some of the best scenes are highlighted by Will Rogers affectionate rapport with stereotyped black-actors Stepin Fetchit and Hattie McDaniel, though these scenes are frequently removed from TV showings of Judge Priest due to their undeniably racist overtones. If you havent guessed by the first frame of the film that John Ford was the director, youll recognize Fords personal stamp the moment Will Rogers kneels by his wifes grave and carries on a warm conversation with his long-departed bride. Ford would remake (and improve upon) Judge Priest in 1953 as The Sun Shines Bright, with Charles Winninger as the judge.",G,"Classics, Comedy, Drama",John Ford,20th Century Fox Film Corporation,80 minutes,"Will Rogers, Tom Brown, Anita Louise"
324,11734,"Copying Beethoven, (Klang der Stille)","A pretentious historical drama that's ultimately a drag, despite Ed Harris' powerful performance.",28%,81,56%,14200,"When a young Vienna Music Conservatory student and aspiring composer accepts a job as a copyist for Ludwig von Beethoven, she soon finds her destiny forever interlinked with that of the legendary classical musician in director Agnieszka Hollands romantic period drama. Beethoven (Ed Harris)s ""Ninth Symphony"" is about to make its historical debut, but Beethovens publisher Herr Schlemmer is dying of cancer. Now in desperate need of a copyist to complete the score, the ailing Schlemmer enlists the aid of ambitious student Anna Holz (Diane Kruger); who readily accepts the job despite an explicit warning that the composer is a callous wretch. As Anna begins the arduous process of copying Beethovens career-defining work, her soul-stirring kindness causes the composer to view their collaboration as a blessing that will enable him to produce some of the most sublime music ever created. When Anna works up the courage to show Beethoven some of her own work, however, his thoughtless derision of the composition causes his sensitive assistant to abandon their current collaboration. Subsequently determined to flee Vienna and marry her devoted paramour Martin, Anna is quickly tracked down by Beethoven and forced to choose between love and duty. ~ Jason Buchanan, Rovi",PG-13 (for some sexual elements),"Drama, Musical & Performing Arts, Romance",Agnieszka Holland,MGM,103 minutes,"Ed Harris, Diane Kruger, Matthew Goode"
325,11742,Dr. Seuss' How the Grinch Stole Christmas,"Jim Carrey shines as the Grinch. Unfortunately, it's not enough to save this movie. You'd be better off watching the TV cartoon.",50%,140,56%,948989,"The curmudgeonly recluse Grinch, who hates Christmas, becomes annoyed with the out-of-control Christmas festivities in Whoville, the town lying below his cave dwelling on Mt. Crumpit. But after the Grinch conspires to deprive the Whos of their favorite holiday by sneaking into town on Christmas eve to steal everything associated with the holiday, he learns that the spirit of Christmas goes much deeper than tinsel and toys.",PG (for some crude humor),"Comedy, Drama, Kids & Family, Science Fiction & Fantasy",Ron Howard,Universal Pictures,105 minutes,"Taylor Momsen, Jeffrey Tambor, Bill Irwin"
326,11744,Goya's Ghosts,Ornate costumes and a talented cast can't make up for Ghosts' glacial pace and confused plot.,30%,87,57%,41637,"""Goyas Ghosts"" is a sweeping historical epic, told through the eyes of celebrated Spanish painter Francisco Goya. Set against the backdrop of political turmoil at the end of the Spanish Inquisition and start of the invasion of Spain by Napoleons army, the film captures the essence and beauty of Goyas work which is best known for both the colorful depictions of the royal court and its people, and his grim depictions of the brutality of war and life in 18th century Spain. Brother Lorenzo, an enigmatic, cunning member of the Inquisitions inner circle who becomes infatuated with Goyas teenage muse, Ines, when she is falsely accused of heresy and sent to prison.","R (for violence, disturbing images, some sexual content and nudity)",Drama,Milos Forman,Samuel Goldwyn Films,114 minutes,"Javier Bardem, Natalie Portman, Stellan Skarsgard"
327,11746,Disturbia,"Aside from its clichéd resolution, Disturbia is a tense, subtle thriller with a noteworthy performance from Shia LaBeouf.",69%,175,77%,1452504,"Salton Sea director D.J. Caruso travels from the shore to the suburbs for this suspenseful tale of a high-school senior who suspects that his neighbor is a notorious serial killer. Kale (Shia LaBeouf) is a high-school senior who has yet to come to terms with the fact that his father is gone, the tragic victim of a fatal accident. As Kales mother (Carrie-Anne Moss) struggles to pay the bills by picking up extra shifts at work, her sons behavior grows increasingly erratic. When an altercation at school finds Kale placed under court-ordered house arrest, the homebound student teams with newly arrived girl-next-door Ashley (Sarah Roemer) to investigate the suspicious neighbor (David Morse) whom Kale believes to be an elusive and wanted serial killer. Their attentions focused intensely on the man they believe to be a murderous maniac hiding in broad daylight, Kale and Ashley trespass down a dangerous path while attempting to discern whether his suspicions are grounded in fact or just a combination of deep depression and suffocating cabin fever. ~ Jason Buchanan, Rovi","PG-13 (for sequences of terror and violence, and some sensuality)","Drama, Mystery & Suspense",D.J. Caruso,Dreamworks,104 minutes,"Shia LaBeouf, Carrie-Anne Moss, David Morse"
328,11747,Pathfinder,A few rousing action sequences can't make up for Pathfinder's non-existent plot and silly dialogue.,10%,77,36%,94308,"In an untamed, primordial America, 500 years before Columbus will reach its shores, unfolds an epic battle between love and hate that will change one mans destiny and the future of a nation: ""Pathfinder."" This action-adventure saga recreates one of the most riveting, yet never-before-seen, eras in human history--when Viking ""dragon"" ships from the mysterious Norse lands arrived out of nowhere to invade a pristine North America. Inspired by historical findings, yet forged with the magic and style of a modern graphic novel, ""Pathfinder"" comes to life in a cinematic experience filled with intense and primal action.",R (for strong brutal violence throughout),"Action & Adventure, Drama",Marcus Nispel,20th Century Fox,99 minutes,"Karl Urban, Moon Bloodgood, Clancy Brown"
329,11750,Straight Time,N/A,75%,8,83%,1991,"Paroled criminal Max Dembo is compelled to withstand the calculated cruelties of parole officer Earl Frank. The more Max tries to go straight, the more he is defeated by circumstance. It eventually becomes clear that neither Hoffman nor his fellow ex-cons will be able to survive looking for legitimate work.",R,Drama,Ulu Grosbard,Warner Bros. Pictures,114 minutes,"Dustin Hoffman, Theresa Russell, Harry Dean Stanton"
330,11751,Tristana,N/A,97%,29,83%,3220,"After the death of her mother, Tristana goes to live with her guardian Don Lope, who seduces her. She runs away from Lope with a young artist named Horacio. Unable to commit to Horacio and in need of health care due to her growing cancer, Tristana returns to Don Lope.",PG-13 (for thematic elements and some disturbing images),"Art House & International, Drama",Luis Buñuel,Cohen Film Collection,98 minutes,"Catherine Deneuve, Fernando Rey, Franco Nero"
331,11752,Puccini for Beginners,A Woody Allen-ish film that needs more of the caustic wit expected from the best New York rom coms.,51%,63,45%,706,"A woman who loves opera finds herself playing a romantic version of musical chairs in this independent comedy from writer and director Maria Maggenti. Allegra (Elizabeth Reaser) is a writer who has been involved with Samantha (Julianne Nicholson) for some time, but Allegra just isnt willing to make a commitment. Eventually, Samantha decides shes had enough, and she not only leaves Allegra, she jumps to the other side of the gender divide and starts dating a man. While Allegra is none too pleased with Samanthas actions, she unwittingly finds herself following suit when she meets Philip (Justin Kirk), a college professor, at a party. After a few cocktails, Allegra and Philip end up in bed, and while Allegra is content to leave it as a one-night stand, Philip has different ideas, and goes so far as to dump his girlfriend to pursue a relationship with Allegra, even though shes made it clear to him shes not at all serious about him. At the same time, Allegra strikes up a new romance with Grace (Gretchen Mol), but she doesnt know all that much about Graces previous lovers -- who happen to include Philip. Puccini for Beginners was screened in competition at the 2006 Sundance Film Festival. ~ Mark Deming, Rovi",NR,"Art House & International, Comedy, Special Interest, Romance",Maria Maggenti,Strand Releasing,82 minutes,"Justin Kirk, Gretchen Mol, Julianne Nicholson"
332,11753,Slow Burn,"With wooden acting and hammy, overheated dialogue, Slow Burn isn't so much a noir as it is a mediocre parody of one.",12%,34,55%,7273,"A cop trying to clear the name of a woman he loves falls deep into a morass of corruption in this crime thriller. Ford Cole (Ray Liotta) is the district attorney in a crime-ridden town where hes contemplating a run for mayor in a bid for greater power. Cole is also having an affair with one of his assistants, Nora Timmer (Jolene Blalock), though he tries to keep that a secret. One evening, while Cole is chatting with journalist Trippin (Chiwetel Ejiofor), Timmer arrives with startling news -- she claims to have been sexually assaulted by Isaac Duparde (Mekhi Phifer), a clerk at a nearby music store who broke into her apartment. Making matters more complicated is the fact that Duparde is currently dead in her flat, leaving Cole to find a way to protect Timmer while not staining his own reputation. Cole realizes this may be harder than he imagined when Luther Pinks (LL Cool J) arrives on the scene to tell him that Timmer actually lured Duparde back to her apartment on purpose, in an effort to get information on a well-connected organized crime figure. Slow Burn was the first directorial effort from screenwriter Wayne Beach.","R (adult situations/language, sex, violence)","Drama, Mystery & Suspense",Wayne Beach,Lions Gate Films,93 minutes,"Ray Liotta, LL Cool J, Jolene Blalock"
333,11754,Redline,"Redline has plenty of bad acting, laughable dialogue, and luxury cars.",0%,27,47%,104019,"Eddie Griffin and Nathan Phillips put the pedal to the metal in stunt coordinator-turned-director Andy Chengs supercharged auto thriller. As a serious collection of speed freaks gather to hit the streets in hopes of winning 24 million dollars, every rule is broken and the law simply doesnt have enough horsepower to ensure that justice is served. With the speedometer maxed out and the past becoming nothing more than a fading image in the rearview mirror, these drivers will do whatever it takes to win the prize that promises to change their life forever. In addition to featuring a score (and cameo) by hip-hop icon Wyclef Jean, Redline was produced by real-estate developer-turned-producer Daniel Sadek -- who not only financed the 26-million-dollar film, but also donated his personal car collection to the production. Featured automobiles include Sadeks Lamborghini Murcielago, Enzo Ferrari, Ferrari F430, Ferrari Scaglietti Phantom, and two McLarens. In a bid to increase the realism of the driving scenes, one of Sadeks two 400,000-dollar Porsche Carrera GTs was set to be destroyed for the film.","PG-13 (for violence, illegal and reckless behavior, sexual content, language and drug references)",Action & Adventure,Andy Cheng,Chicago Releasing,93 minutes,"Nadia Bjorlin, Nathan Phillips, Angus Macfadyen"
