,dataIndex,realTitle,criticsConcensus,tomatoMeter,tomatoCount,audienceScore,audienceCount,realSynopsis,rating,genreString,directedBy,studio,runTime,cast
0,28001,Reach Me,"Featuring a bewildering array of talented actors pummeled by disjointed direction and a dull, hackneyed script, Reach Me is so fundamentally misbegotten that its title reads more like a threat.",4%,23,48%,557,"A motivational book written by a mysterious man (Tom Berenger) goes viral and quickly gains popularity, inspiring a group of people that includes a journalist (Kevin Connolly), his editor (Sylvester Stallone), a former inmate (Kyra Sedgwick), a hip-hop mogul (Nelly), an actor (Cary Elwes) and an undercover cop (Thomas Jane) to re-evaluate their choices and decisions by confronting their fears in hopes of creating more positive lives. REACH ME also stars Terry Crews, Danny Aiello, Kelsey Grammer, Lauren Cohan, Ryan Kwanten, Tom Sizemore, and is written/directed by John Herzfield. The film is produced by Rebekah Chaney, Cassian Elwes, John Herzfield, and Buddy Patrick. (C) Millennium","PG-13 (for sexual content, violence, language, drug use, and smoking.)",Drama,John Herzfeld,Millennium Entertainment,95 minutes,"Kyra Sedgwick, Danny Aiello, Cary Elwes"
1,28009,The Last Gladiators,N/A,90%,10,80%,350,Academy Award (R) Winning Director Alex Gibney examines the NHLs most feared enforcers while also exploring the career of Chris Nilan. (c) Official FB,R (for language),"Documentary, Special Interest, Sports & Fitness",Alex Gibney,Phase 4 Films,94 minutes,"Chris Nilan, Tony Twist, Marty McSorley"
2,28018,100 Bloody Acres,N/A,79%,38,46%,1639,"In 100 BLOODY ACRES, brothers Reg and Lindsay Morgan are struggling to keep their organic blood and bone fertilizer business in motion. Their secret ""recipe"" for success (using dead car crash victims in their product) was a huge boon to business, but lately supply has been gravely low. Months have passed since their last find, and an important new customer is now waiting on a delivery. When junior partner Reg (Damon Herriman of Justified) stumbles upon 3 travelers stranded on a remote country road, he cooks up a radical solution to their problem, and a way of finally gaining the respect of his bossy big brother (Angus Sampson). But when Reg starts to fall for Sophie, one of the intended victims, things get complicated... A bloody good time, the Cairnes brothers witty horror-comedy blends sly Australian humor, gory fun, and a clever storyline that gives ""recycling"" a whole new context. (c) Doppelgänger Releasing",NR,"Comedy, Horror","Colin Cairnes, Cameron Cairnes",Doppelganger Releasing,91 minutes,"Damon Herriman, Angus Sampson, Anna McGahan"
3,28065,Killing Kennedy,N/A,56%,18,42%,326,"Based on the best-selling book by Bill OReilly and Martin Dugard, Killing Kennedy begins in 1959, at major turning points for both the future president and his assassin. John F. Kennedy (played by Emmy-award winner Rob Lowe) is in Washington, D.C., preparing to announce his presidential candidacy, while Lee Harvey Oswald finds himself in the U.S. embassy in Moscow, renouncing his U.S. citizenship. These two events start both men-one a member of one of the United States most wealthy and powerful families, the other a disillusioned former Marine and Marxist-on a cataclysmic track that would alter the course of history. Throughout the film, we see their highs and lows, culminating in not one but two shocking deaths that stunned the nation. (c) National Geographic",NR,Drama,Nelson McCormick,National Geographic Entertainment,88 minutes,"Rob Lowe, Ginnifer Goodwin, Will Rothhaar"
4,28070,Beer for My Horses,N/A,0%,7,62%,5799,"Country music star Toby Keith writes and stars in this road movie comedy as a deputy who takes to the road with a fellow cop (played by co-writer Rodney Carrington) in order to save their kidnapped girlfriends. The CMT Films production is directed by Michael Salomon (A Glimpse of Hell), with Ted Nugent, Willie Nelson, Claire Forlani, Barry Corbin, and Tom Skerritt filling out the supporting cast.","PG-13 (for some violence, sexual humor and dialogue, language, drug content and brief nudity)",Comedy,"Michael Salomon, Mikael Salomon",Roadside Attractions,89 minutes,"Toby Keith, Rodney Carrington, Ted Nugent"
5,28071,Beethoven's 3rd,N/A,0%,7,24%,75422,"Beethoven the Saint Bernard is back in this comedy for the whole family, in which the Newton Family (with their rather large pet in tow) hops into their camper for a cross-country vacation. Along the way, they encounter a gang of bad guys. Can Beethoven help bring them to justice? Beethovens 3rd stars Judge Reinhold, Julia Sweeney, Jamie Marsh, and Michaela Gallo. Charles Grodin, star of the first two films, opted not to appear in this one.",G (adult situations),"Comedy, Kids & Family",David Mickey Evans,Universal Studios Home Video,98 minutes,"Judge Reinhold, Julia Sweeney, James Marsh"
6,28081,Greetings From Tim Buckley,"Slight yet resonant, Greetings from Tim Buckley honors a family's musical legacy while offering Penn Badgley a remarkable opportunity to display his dramatic gifts.",72%,32,46%,1757,"In 1991, a young musician named Jeff Buckley (Penn Badgley, ""Gossip Girl,"" MARGIN CALL) rehearses for his public singing debut at a Brooklyn tribute concert for his father, the late folk singer Tim Buckley. Struggling with the legacy of a man he barely knew, Jeff finds solace in a relationship with an enigmatic young woman (Imogen Poots, 28 WEEKS LATER) working at the show. As they explore New York City, their adventures recall glimpses of Tims (Ben Rosenfield) own 60s heyday, as he drives cross-country with a girlfriend and finds himself on the verge of stardom. Leading up to the now-legendary show that launched Jeffs own brilliant career, GREETINGS FROM TIM BUCKLEY is a poignant mirror portrait of father and son, two of the most beloved singer-songwriters of their generations. -- (C) Tribeca",NR,Drama,Dan Algrant,Tribeca Film,99 minutes,"Penn Badgley, Imogen Poots, Norbert Leo Butz"
7,28085,Hercules,"Fast-paced and packed with dozens of pop culture references, Hercules might not measure up with the true classics of the Disney pantheon, but it's still plenty of fun.",84%,55,76%,388756,"Disneys animation team dipped into the rich well of ancient mythology for this musical comedy. The son of Greek gods Zeus (voice of Rip Torn) and Hera (Samantha Eggar), Hercules (voice of Josh Keaton) is stolen as a boy by the minions of Hades (voice of James Woods), lord of the underworld. Forced to live among humans, Hercules is turned into a half-god and half-mortal after drinking a forbidden potion brewed by Hades right hand men, Pain (voice of Bob Goldthwait) and Panic (voice of Matt Frewer). Now Hercules has the remarkable strength of a god, but is trapped in the body of a human, and before he learns how to use his power properly he goes through a typically adolescent awkward period. In order to become a god and return to his home on Mount Olympus, Hercules must prove himself a true hero on Earth. With the assistance of Philotes (voice of Danny De Vito), a plucky satyr known as ""Phil,"" the grown-up Hercules (voice of Tate Donovan) learns to use his strength to his advantage and becomes a famous and benevolent protector of those around him, successfully battling a variety of gods and monsters. However, Hades, wanting to cut Hercules down to size, sends his secret weapon after him -- Megara (voice of Susan Egan), a seductively beautiful woman under Hades control, who is to win Hercules heart and render him helpless against the forces of the underworld. Acclaimed British cartoonist Gerald Scarfe served as production designer for this project, while Alan Menken wrote the musical score. Incidentally, for the Spanish language version of the film, Latin pop singer Ricky Martin provided the singing voice of Hercules, two years before he became a chart-topping sensation in America with his hit single ""Livin la Vida Loca.""",G,"Animation, Kids & Family, Science Fiction & Fantasy","John Musker, Ron Clements",Buena Vista Internationa,93 minutes,"Tate Donovan, Danny DeVito, James Woods"
8,28087,Little Monsters,N/A,50%,8,62%,48924,"Lonely 11 year old Brian (Fred Savage) makes an unusual new friend when he captures Maurice (Howie Mandel), the mischievous monster who lives under his bed, and stumbles into an exciting new world where mythical creatures really exist. When Brian learns that he, too, will become a monster unless he turns his back Maurice, however, he struggles with the prospect of losing the only real friend hes ever known.","PG (adult situations/language, violence)","Comedy, Kids & Family, Science Fiction & Fantasy","Richard Alan Greenberg, Richard Greenberg",MGM Home Entertainment,100 minutes,"Fred Savage, Howie Mandel, Daniel Stern"
9,28090,Pulse,"Another stale American remake of a successful Japanese horror film, Pulse bypasses the emotional substance of the original and overcompensates with pumped-up visuals and every known horror cliche.",11%,73,27%,83301,"Imagine our wireless technologies made a connection to a world beyond our own. Imagine that world used that technology as a doorway into ours. Now, imagine the connection we made cant be shut down. When you turn on your cell phone or log on to your e-mail, theyll get in, youll be infected, and theyll be able to take from you what they dont have anymore--life.","PG-13 (for intense sequences of sci-fi terror, disturbing images, language, sensuality and thematic material)","Horror, Mystery & Suspense",Jim Sonzero,The Weinstein Company,85 minutes,"Kristen Bell, Ian Somerhalder, Christina Milian"
10,28099,The Secret World of Arrietty,"Visually lush, refreshingly free of family-friendly clatter, and anchored with soulful depth, The Secret World of Arrietty lives up to Studio Ghibli's reputation.",95%,150,85%,61036,"Arrietty (Bridgit Mendler), a tiny, but tenacious 14-year-old, lives with her parents (Will Arnett and Amy Poehler) in the recesses of a suburban garden home, unbeknownst to the homeowner and her housekeeper (Carol Burnett). Like all little people, Arrietty (AIR-ee-ett-ee) remains hidden from view, except during occasional covert ventures beyond the floorboards to ""borrow"" scrap supplies like sugar cubes from her human hosts. But when 12-year-old Shawn (David Henrie), a human boy who comes to stay in the home, discovers his mysterious housemate one evening, a secret friendship blossoms. If discovered, their relationship could drive Arriettys family from the home and straight into danger. -- (C) Disney",G,"Animation, Art House & International, Science Fiction & Fantasy",Hiromasa Yonebayashi,Walt Disney Pictures,94 minutes,"Mirai Shida, Ryûnosuke Kamiki, Kirin Kiki"
11,28124,Charlie Victor Romeo,N/A,84%,19,84%,165,"When you board an airplane, you put your life in the hands of the pilot and co-pilot. What happens in the cockpit when these professionals are faced with impending disaster? CHARLIE VICTOR ROMEO (code for ""cockpit voice recorder"") dramatizes actual black box recordings of six harrowing airline emergencies, using the sparest of elements to foreground the unabashedly heroic professionalism of these unsung men and women. Adapted from a critically-acclaimed theatrical production, the movie - shot and projected in 3-D - puts you in the cockpit as they do everything possible to land under near-impossible circumstances: a plane that can only make right turns; blown engines due to bird strikes; or failed hydraulics, resulting from maintenance negligence. ""For 80 minutes, the movie keeps you in something like suspended animation, waiting to exhale. Youve never seen anything like it."" - Scott Foundas, Village Voice (c) Film Forum",NR,"Documentary, Special Interest","Karlyn Michelson, Robert Berger",Charlie Victor Romeo LLC,80 minutes,"Robert Berger, Patrick Daniels, Noel Dinneen"
12,28126,Super Duper Alice Cooper,N/A,50%,6,74%,208,"Super Duper Alice Cooper is the twisted tale of a teenage Dr Jekyll whose rock n roll Mr Hyde almost kills him. It is the story of Vincent Furnier, preachers son, who struck fear into the hearts of parents as Alice Cooper, the ultimate rock star of the bizarre. From the advent of Alice as front man for a group of Phoenix freaks in the 60s to the hazy decadence of celebrity in the 70s to his triumphant comeback as 80s glam metal godfather, we will watch as Alice and Vincent battle for each others souls. The is the first ever doc opera - a dizzying blend of documentary archive footage, animation and rock opera that will cement forever the legend of Alice Cooper.",NR,"Documentary, Musical & Performing Arts","Reginald Harkema, Sam Dunn, Scot McFadyen",Banger Films Inc.,127 minutes,"Alice Cooper, Dee Snider, Shep Gordon"
13,28131,The Hateful Eight,"The Hateful Eight offers another well-aimed round from Quentin Tarantino's signature blend of action, humor, and over-the-top violence -- all while demonstrating an even stronger grip on his filmmaking craft.",75%,327,76%,73042,"Set six or eight or twelve years after the Civil War, a stagecoach hurtles through the wintry Wyoming landscape. The passengers, bounty hunter John Ruth and his fugitive Daisy Domergue, race towards the town of Red Rock where Ruth, known in these parts as ""The Hangman,"" will bring Domergue to justice. Along the road, they encounter two strangers: Major Marquis Warren, a black former union soldier turned infamous bounty hunter, and Chris Mannix, a southern renegade who claims to be the towns new Sheriff. Losing their lead on the blizzard, Ruth, Domergue, Warren and Mannix seek refuge at Minnies Haberdashery, a stagecoach stopover on a mountain pass. When they arrive at Minnies, they are greeted not by the proprietor but by four unfamiliar faces. Bob, whos taking care of Minnies while shes visiting her mother, is holed up with Oswaldo Mobray, the hangman of Red Rock, cow-puncher Joe Gage (Madsen), and Confederate General Sanford Smithers. As the storm overtakes the mountainside stopover, our eight travelers come to learn they may not make it to Red Rock after all...","R (for strong bloody violence, a scene of violent sexual content, language and some graphic nudity)",Western,Quentin Tarantino,The Weinstein Company,167 minutes,"Samuel L. Jackson, Kurt Russell, Jennifer Jason Leigh"
14,28159,Little Accidents,"Little Accidents has good intentions -- and a talented cast, led by Elizabeth Banks -- but it drowns them under dour melodrama.",54%,39,29%,3555,"When a teenage boy goes missing in a small town already devastated by a fatal mining accident, three strangers find themselves drawn together in a tangle of secrets, lies, and the collective grief of the community. Reeling from the disappearance of her son, Diane (Elizabeth Banks) finds herself drifting away from her husband (Josh Lucas), a mining company executive whose role in the accident has made her family the prime target for the towns anger. When she forms a dangerous bond with the sole survivor of the disaster (Boyd Holbrook), truths will be uncovered that threaten to tear apart the few remaining threads holding the town together in this intense drama from writer-director Sara Colangelo. (C) Amplify",NR,Drama,Sara Colangelo,Amplify Films,105 minutes,"Elizabeth Banks, Josh Lucas, Boyd Holbrook"
15,28165,Wild Card,"Hardcore Jason Statham fans may enjoy parts of Wild Card, but all other action aficionados need not apply.",32%,56,29%,7687,Simon West directs this remake of the 1987 Burt Reynold action thriller in this Sierra/Affinity production starring Jason Statham as a paid enforcer who goes after a gang leader when a group of thugs beat up a personal friend. William Goldman provides the script.,R,"Action & Adventure, Drama, Mystery & Suspense",Simon West,The Film Arcade,92 minutes,"Jason Statham, Sofía Vergara, Milo Ventimiglia"
16,28171,Paper Towns,"Paper Towns isn't as deep or moving as it wants to be, yet it's still earnest, well-acted, and thoughtful enough to earn a place in the hearts of teen filmgoers of all ages.",57%,138,47%,32983,"Adapted from the bestselling novel by author John Green (""The Fault in Our Stars""), PAPER TOWNS is a coming-of-age story centering on Quentin and his enigmatic neighbor Margo, who loved mysteries so much she became one. After taking him on an all-night adventure through their hometown, Margo suddenly disappears--leaving behind cryptic clues for Quentin to decipher. The search leads Quentin and his quick-witted friends on an exhilarating adventure that is equal parts hilarious and moving. Ultimately, to track down Margo, Quentin must find a deeper understanding of true friendship--and true love. (C) Fox","PG-13 (for some language, drinking, sexuality and partial nudity - all involving teens)",Drama,Jake Schreier,20th Century Fox,109 minutes,"Nat Wolff, Cara Delevingne, Halston Sage"
17,28175,The Wedding Ringer,"Kevin Hart and Josh Gad might be two great comedians that go great together, but there's little evidence of it on display in The Wedding Ringer.",29%,111,63%,40141,"Doug Harris (Josh Gad) is a loveable but socially awkward groom-to-be with a problem: he has no best man. With less than two weeks to go until he marries the girl of his dreams (Kaley Cuoco-Sweeting), Doug is referred to Jimmy Callahan (Kevin Hart), owner and CEO of Best Man, Inc., a company that provides flattering best men for socially challenged guys in need. What ensues is a hilarious wedding charade as they try to pull off the big con, and an unexpected budding bromance between Doug and his fake best man Jimmy. (c) Sony","R (for crude and sexual content, language throughout, some drug use andf brief graphic nudity)",Comedy,Jeremy Garelick,Sony Screen Gems,101 minutes,"Kevin Hart, Josh Gad, Kaley Cuoco"
18,28181,My Mistress,N/A,33%,9,36%,98,What starts as a beautiful and strangely innocent affair between a vulnerable teenage romantic and a French S&M mistress soon becomes more dangerous.,NR,"Drama, Romance",Stephen Lance,Mini Studios,104 minutes,"Emmanuelle Béart, Harrison Gilbertson, Hugh Parker"
19,28184,Hits,Hits undermines its undeniably timely message with a darkly bitter tone that makes the movie's caustic humor harder to swallow.,35%,23,50%,390,"HITS is a dark comedy exploring the nature of fame in 21st Century YouTube America. The film takes place in a small town in upstate New York populated by people who trade in unrealistic expectations. Its a story in which fame, delusion, earnestness, and recklessness meet, shake hands, and disrupt the lives around them.(C) Honora Productions",NR,"Comedy, Drama",David Cross,Honora Productions,100 minutes,"Meredith Hagner, Matt Walsh, James Adomian"
20,28207,The Boy Next Door,"The Boy Next Door may get a few howls out of fans of stalker thrillers, but for most viewers, it won't even rise to ""so bad it's good"" status.",11%,133,33%,28715,"Jennifer Lopez leads the cast in The Boy Next Door, a psychological thriller that explores a forbidden attraction that goes much too far. Directed by Rob Cohen (The Fast and the Furious) and written by Barbara Curry, the film also stars Ryan Guzman, John Corbett and Kristin Chenoweth. (C) Universal","R (for violence, sexual content/nudity and language.)",Mystery & Suspense,Rob Cohen,Universal Pictures,91 minutes,"Jennifer Lopez, Ryan Guzman, John Corbett"
21,28211,John Doe: Vigilante,N/A,40%,5,46%,291,"Some call him a hero. Some call him a villain. Hes ""John Doe: Vigilante"" - an ordinary man who decides to take the law into his own hands. Frustrated with a failing legal system that continues to allow violent criminals to go free, John Doe begins exacting justice the only way he knows how - by killing one criminal at a time. Soon he becomes a media sensation and inspires a group of copycat vigilantes, but who is the real John Doe - a pillar of justice or a cold-blooded murderer? You decide. (c) Main Street",R (for disturbing violent content and for language),Mystery & Suspense,Kelly Dolen,Main Street Films,93 minutes,"Jamie Bamber, Lachy Hulme, Gary Abrahams"
22,28213,Knight of Cups,"Knight of Cups finds Terrence Malick delving deeper into the painterly visual milieu he's explored in recent efforts, but even hardcore fans may struggle with the diminishing narrative returns.",47%,174,37%,6318,"Knight of Cups follows writer Rick (Christian Bale, The Fighter, American Hustle) on an odyssey through the playgrounds of Los Angeles and Las Vegas as he undertakes a search for love and self. Even as he moves through a desire-laden landscape of mansions, resorts, beaches and clubs, Rick grapples over complicated relationships with his brother (Wes Bentley) and father (Brian Dennehy). His quest to break the spell of his disenchantment takes him on a series of adventures with six alluring women: rebellious Della (Imogen Poots); his physician ex-wife, Nancy (Cate Blanchett); a serene model Helen (Freida Pinto); a woman he wronged in the past Elizabeth (Natalie Portman); a spirited, playful stripper Karen (Teresa Palmer); and an innocent Isabel (Isabel Lucas), who helps him see a way forward. Rick moves in a daze through a strange and overwhelming dreamscape -- but can he wake up to the beauty, humanity and rhythms of life around him? The deeper he searches, the more the journey becomes his destination. The 7th film from director Terrence Malick (The Thin Red Line, Tree of Life), Knight of Cups (the title refers to the Tarot card depicting a romantic adventurer guided by his emotions) offers both a vision of modern life and an intensely personal experience of memory, family, and love. Knight of Cups is produced by Nicolas Gonda, Sarah Green and Ken Kao. Prominent crew includes cinematographer Emmanuel Lubezki (Gravity, Birdman), production designer Jack Fisk, costume designer Jacqueline West, and composer Hanan Townshend (To The Wonder). The films ensemble cast also includes Antonio Banderas, Cherry Jones and Armin Mueller-Stahl.","R (for some nudity, sexuality and language)","Drama, Romance",Terrence Malick,Broad Green Pictures,118 minutes,"Christian Bale, Cate Blanchett, Natalie Portman"
23,28214,45 Years,45 Years offers richly thought-provoking rewards for fans of adult cinema -- and a mesmerizing acting showcase for leads Charlotte Rampling and Tom Courtenay.,97%,203,67%,13739,"There is just one week until Kate Mercers forty-fifth wedding anniversary and the planning for the party is going well. But then a letter arrives for her husband. The body of his first love has been discovered, frozen and preserved in the icy glaciers of the Swiss Alps. By the time the party is upon them, five days later, there may not be a marriage left to celebrate.",R (for language and brief sexuality),Drama,Andrew Haigh,Sundance Selects,95 minutes,"Charlotte Rampling, Tom Courtenay, Geraldine James"
24,28227,Home Sweet Hell,"Home Sweet Hell mistakes misogyny for subversive wit, aiming for black comedy but ending up with a grueling test of viewer endurance that wastes game efforts from its likable leads.",5%,20,26%,3633,"Mona and Dons seemingly perfect suburban bliss is disrupted by a sexy extortionist and Mona will stop at nothing, including killing the competition, to keep her little slice of heaven. (C) Vertical Entertainment","R (for violence, language, sexual content and some drug use)","Comedy, Drama",Anthony Burns,Vertical Entertainment,97 minutes,"Patrick Wilson, Katherine Heigl, Jordana Brewster"
25,28229,Everybody Wins,N/A,14%,7,38%,307,"Private investigator Tom OToole (Nick Nolte) is reluctant to take on a case offered to him by cryptically offbeat Angela Crispini (Debra Winger), but he lets himself be seduced by her. Angela believes that Felix Daniels (Frank Military) was wrongly convicted of murdering his uncle. As OToole learns more about the crime, he becomes convinced that Felix was framed by corrupt local officials, including States Attorney, and old rival, Charlie Haggerty (Frank Converse). OToole also falls in love with Angela, who increasingly appears to be a psychologically disturbed woman who may have been involved with several of the principals. When Angela admits that she doesnt always know when she is telling the truth, she speaks to OTooles predicament and the films theme: the dangers of relying on an unreliable narrator.","R (adult situations/language, violence)","Drama, Mystery & Suspense",Karel Reisz,Orion Home Video,120 minutes,"Nick Nolte, Debra Winger, Will Patton"
26,28231,Jamie Marks Is Dead,N/A,56%,16,45%,436,"In a small town, the body of a teenager named Jamie Marks (Noah Silver) is found by the river. Adam (Cameron Monaghan), the star of his cross-country team, becomes fascinated with Jamie- a boy nobody really knew or interacted with, except occasionally to bully him. When Jamies ghost begins to appear both to Adam and Gracie (Morgan Saylor), the classmate who discovered the body, Adam is caught between two worlds. He has a budding romance with Gracie, but he also feels a deep connection to Jamie, who brings him closer to the world of the undead. (C) Gravitas Ventures",NR,Drama,Carter Smith,Gravitas Ventures,100 minutes,"Cameron Monaghan, Noah Silver, Morgan Saylor"
27,28232,Slam Dance,N/A,20%,5,54%,954,"In this off-beat and stylish mystery by director Wayne Wang, C.C. Drood (Tom Hulce) is an underground cartoonist who is separated from his wife Helen (Mary Elizabeth Mastrantonio) and daughter Bean (Judith Barsi). When his lover Yolanda (Virginia Madsen) is found murdered, Drood is the main focus of the police investigation. When Drood uncovers a sex scandal involving police chief Gilbert (John Doe) and Detective Smiley (Harry Dean Stanton), he realizes he is being made the fall guy for the crime. Singer Adam Ant plays Droods buddy Jim.",R,Mystery & Suspense,Wayne Wang,Island Pictures,99 minutes,"Tom Hulce, Mary Elizabeth Mastrantonio, Adam Ant"
