,dataIndex,realTitle,criticsConcensus,tomatoMeter,tomatoCount,audienceScore,audienceCount,realSynopsis,rating,genreString,directedBy,studio,runTime,cast
209,29575,San Andreas,"San Andreas has a great cast and outstanding special effects, but amidst all the senses-shattering destruction, the movie's characters and plot prove less than structurally sound.",50%,241,52%,65991,"Journey 2: The Mysterious Islands Brad Peyton steps into disaster movie territory with this 3D film surrounding an earthquake that hits the West Coast. Carlton Cuse provides the script. ~ Jeremy Wheeler, Rovi","PG-13 (for intense disaster action and mayhem throughout, and brief strong language)",Action & Adventure,Brad Peyton,Warner Bros.,114 minutes,"Dwayne Johnson, Carla Gugino, Alexandra Daddario"
210,29576,Regression,Regression boasts a pair of eminently likable leads -- neither of whom are able to dislodge the movie from the mire of psychological thriller mediocrity.,15%,40,21%,7844,"Minnesota, 1990. Detective Bruce Kenner (Ethan Hawke) investigates the case of young Angela (Emma Watson), who accuses her father, John Gray (David Dencik), of an unspeakable crime. When John unexpectedly and without recollection admits guilt, renowned psychologist Dr. Raines (David Thewlis) is brought in to help him relive his memories and what they discover unmasks a horrifying nationwide mystery. (C) TWC-Dimension","R (for disturbing violent and sexual content, and for language)","Drama, Mystery & Suspense",Alejandro Amenábar,The Weinstein Company,106 minutes,"Ethan Hawke, Emma Watson, David Thewlis"
211,29577,Welcome to Me,A transfixing central performance by Kristen Wiig performance holds Welcome to Me together and compensates for its uneven stretches.,74%,108,46%,10057,"What happens when a young woman with Borderline Personality Disorder wins the lottery? In the case of Alice Klieg (Kristen Wiig), she quits her psychiatric meds and buys her own talk show. Inspired by the immortal Oprah, she broadcasts her dirty laundry as both a form of exhibitionism and a platform to share her peculiar views on everything from nutrition to relationships to neutering pets. Also starring Wes Bentley, James Marsden, Tim Robbins, Joan Cusack, Jennifer Jason Leigh and Linda Cardellini. (C) Alchemy","R (for sexual content, some graphic nudity, language and brief drug use)","Comedy, Drama",Shira Piven,Alchemy,87 minutes,"Kristen Wiig, Tim Robbins, Linda Cardellini"
212,29587,Woman on the Run,N/A,83%,6,77%,466,"Though it is Ross Elliot who witnesses a gangland rubout in Woman on the Run, the film is told from the point of view of Elliots wife, played by Anne Sheridan. When Elliot goes into hiding, the police approach Sheridan and ask her aid in locating her husband. She is reluctant at first, since hers is a marriage in name only, but her conscience is aroused when she learns that Elliot is suffering from a potentially fatal heart ailment. Reporter Dennis OKeefe offers to go along with Anne in her search for Elliot. Hes a real friendly reporter. Real, real friendly, and helpful, too. So guess who the ""hit man"" hired to by the mob to kill Elliot turns out to be?",NR,"Classics, Drama, Mystery & Suspense",Norman Foster,Fidelity Pictures,77 minutes,"Ann Sheridan, Dennis O'Keefe, Robert Keith"
213,29596,Testament Of Youth,"Testament of Youth is well-acted and beautifully filmed, adding up to an enriching if not adventurous experience for fans of British period dramas.",84%,125,78%,9110,"Testament of Youth is a powerful story of love, war and remembrance, based on the First World War memoir by Vera Brittain, which has become the classic testimony of that war from a womans point of view. A searing journey from youthful hopes and dreams to the edge of despair and back again, its a film about young love, the futility of war and how to make sense of the darkest times.(C) Sony Classics",PG-13 (for thematic material including bloody and disturbing war related images),"Drama, Romance",James Kent,Sony Pictures Classics,129 minutes,"Alicia Vikander, Kit Harington, Dominic West"
214,29602,Girl Rising,N/A,89%,9,82%,1705,"10x10 is a social action organization seeking educational equality for underprivileged girls across the globe. Director Richard Robbins tells the moving stories of several of these girls, with help from some of the most recognizable female voices of today.",PG-13 (for thematic material including disturbing images),"Documentary, Special Interest","Richard E. Robbins, Gareth Smith, Chris Wilcha, Jenny Lee Wright",Gathr Films,101 minutes,"Anne Hathaway, Selena Gomez, Meryl Streep"
215,29617,Captive Wild Woman,N/A,40%,5,8%,85,"In this low-budget horror outing an insane researcher manages to create a terrifying creature that is half orangutan and half woman. The trouble begins when she falls in love with the hunter/trainer who captured her primate parts in the jungle. Unfortunately, the hunter cannot return her love causing her to fly into a deadly jealous rage that doesnt stop until his life is later endangered in a cage full of jungle cats.",NR,"Classics, Horror, Science Fiction & Fantasy",Edward Dmytryk,Universal,61 minutes,"John Carradine, Acquanetta, Evelyn Ankers"
216,29623,Awake: The Life Of Yogananda,N/A,64%,11,71%,639,"AWAKE: The Life of Yogananda is an unconventional biography about an Indian Swami who brought yoga and meditation to the West in the 1920s. This feature documentary explores the life and teachings of Paramahansa Yogananda, who authored the spiritual classic Autobiography of a Yogi, which has sold millions of copies worldwide and is a go-to book for seekers, philosophers and yoga enthusiasts today. It was the only book that Steve Jobs had on his iPad, and he arranged to give away 800 copies of it to the dignitaries who attended his memorial service. It was also a point of entry into Eastern mysticism for George Harrison, Russell Simmons and countless yogis. By personalizing his own quest for enlightenment and sharing his struggles along the path, Yogananda made ancient teachings accessible to a modern audience, attracting many followers and ultimately helping millions of seekers today to turn their attention inwards, bucking the temptations of the material world in pursuit of self-realization. (C) PMK BNC","PG (for thematic elements, some violent images and brief smoking)",Documentary,"Lisa Leeman, Paola di Florio",PMK BNC Film,87 minutes,"Ravi Shankar, Krishna Das, George Harrison"
217,29624,The Kill Team,"Urgent, mesmerizing, and infuriating, The Kill Team looks at American foreign policy from a rarely considered perspective.",90%,42,73%,2755,"When Private Adam Winfield, a 21-year-old soldier in Afghanistan, witnessed members of his platoon murder innocent civilians (planting weapons on the corpses to make it appear as though they were terrorists), he attempted to alert the military to these heinous war crimes with the help of his father. But Winfields pleas went unheeded. Left on his own and with threats to his life, Private Winfield was himself drawn into the moral abyss, forced to make a split-second decision that would change his life forever. (c) Official Site",NR,"Documentary, Special Interest",Dan Krauss,Oscilloscope Pictures,79 minutes,"Adam Winfield, Jeremy Morlock, Andrew Holmes"
218,29626,Appropriate Behavior,"Warm, funny, and quietly profound, Appropriate Behavior serves as a thoroughly compelling calling card for writer, director, and star Desiree Akhavan.",97%,58,64%,1654,"For Shirin, being part of a perfect Persian family isnt easy. Acceptance eludes her from all sides: her family doesnt know shes bisexual, and her ex-girlfriend, Maxine, cant understand why she doesnt tell them. Even the six-year-old boys in her moviemaking class are too ADD to focus on her for more than a second. Following a family announcement of her brothers betrothal to a parentally approved Iranian prize catch, Shirin embarks on a private rebellion involving a series of pansexual escapades, while trying to decipher what went wrong with Maxine. (K.Y.) (C) Official Site",NR,Comedy,Desiree Akhavan,Gravitas Ventures,90 minutes,"Desiree Akhavan, Rebecca Henderson, Halley Feiffer"
219,29631,Thunder and the House of Magic,"Thunder and the House of Magic lacks real narrative depth, but its visual splendor offers sufficient compensation for younger viewers.",73%,30,53%,2887,"THUNDER AND THE HOUSE OF MAGIC is a whimsical animated family adventure, bringing to life a unique story with a great sense of humor, positive values and universal appeal. Brimming with spectacular animation and endearing characters, this internationally acclaimed motion picture delivers a fun and highly entertaining movie experience for the entire family. The film tells the story of Thunder, an abandoned young cat who stumbles into a magical old mansion operated by a dazzling array of automatons and gizmos. Owned by a retired magician, the house is occupied by an assortment of his wacky assistants who dont all welcome the new houseguest. But when the magician lands in the hospital and his scheming nephew puts the mansion up for sale, our young hero and his new friends join forces to save their magical home. (C) Shout Factory",NR,"Action & Adventure, Animation, Art House & International, Kids & Family","Ben Stassen, Jeremy Degruson, Jeremie Degruson",Shout! Factory,85 minutes,"Cinda Adams, Murray Blue, Eugene Levy"
220,29635,Frontera,"Frontera is solidly cast, handsomely mounted, and well-acted; unfortunately, it's also rather dull and fairly forgettable.",54%,24,59%,1782,"Set in the tumultuous Border area of Arizona and Mexico, Frontera follows the events that take place after a former Arizona Sheriffs wife (Amy Madigan) is killed while riding on their Ranch property. It would appear a Mexican man (Michael Pena) crossing in to the US illegally is at fault. As former Sheriff (Ed Harris) and current Sheriff (Aden Young) search for answers, lives are changed forever and the facts as to who is really at fault in this tragedy are nearly as tenuous and complex as the issues and tensions between the people who live in this region on either side of the line. (c) Magnolia","PG-13 (for violence including a sexual assault, and brief strong language)",Drama,Michael Berry,Magnolia Pictures,103 minutes,"Ed Harris, Michael Peña, Eva Longoria"
221,29638,Dear Lemon Lima,N/A,75%,12,63%,581,"Vanessa gets a dose of reality when Philip, her one true love, ends their relationship, again. The quirky teen enrolls in his school to win him back, but ends up making matters worse. Downgraded to social outcast, Vanessa struggles to reclaim Phillips affection. Luckily, when Vanessa is declared a captain for the schools Snowstorm Survivor competition, she assembles a team of likeminded misfits to prove they deserve to compete and hopefully win her loves heart again. -- (C) Official Site",PG-13 (for some thematic material and language),"Comedy, Drama",Suzi Yoonessi,Phase 4 Films,87 minutes,"Savanah Wiltfong, Shayne Topp, Zane Huett"
222,29670,Canopy,N/A,75%,24,34%,309,"Wartime, 1942. Singapore. An Australian fighter pilot shot down in combat awakens suspended in the treetops. As night devours day, he must navigate through a dangerous jungle in search of sanctuary. Transcending language and culture, CANOPY is a cinematic tour de force exploring the collision of war, nature and its impact on humanity. Aaron Wilsons thrilling, breathtaking film marks the debut of an exciting new voice in Australian cinema.",PG-13 (for intense war situations including some bloody images),Drama,Aaron Wilson,Monterey Media,84 minutes,"Khan Chittenden, Mo Tzuyi, Edwina Wren"
223,29672,Rites of Spring,N/A,11%,9,14%,332,"After kidnapping the nine-year-old daughter of a wealthy socialite and hiding out in an abandoned school, the kidnappers fall prey to a recurring terror in this place, a bloodlust that comes every first day of spring. -- (C) Official Site",NR,"Horror, Mystery & Suspense",Padraig Reynolds,IFC Films,79 minutes,"AJ Bowen, Anessa Ramsey, Sonny Marinelli"
224,29705,Hitman: Agent 47,"Hitman: Agent 47 fails to clear the low bar set by its predecessor, forsaking thrilling action in favor of a sleekly hollow mélange of dull violence and product placement.",9%,125,40%,39426,"HITMAN: AGENT 47 centers on an elite assassin who was genetically engineered from conception to be the perfect killing machine, and is known only by the last two digits on the barcode tattooed on the back of his neck. He is the culmination of decades of research - and forty-six earlier Agent clones -- endowing him with unprecedented strength, speed, stamina and intelligence. His latest target is a mega-corporation that plans to unlock the secret of Agent 47s past to create an army of killers whose powers surpass even his own. Teaming up with a young woman who may hold the secret to overcoming their powerful and clandestine enemies, 47 confronts stunning revelations about his own origins and squares off in an epic battle with his deadliest foe. (c) Fox","R (for sequences of strong violence, and some language)",Action & Adventure,Aleksander Bach,20th Century Fox,96 minutes,"Rupert Friend, Hannah Ware, Zachary Quinto"
225,29715,Tinker Bell and the Great Fairy Rescue,N/A,78%,9,76%,10215,"Disney fairy Tinker Bell is most well known as the friend and ally of Peter Pan, but in this CG adventure, we meet the pixie long before she knew Wendy or the Lost Boys. While summering in England, Tinker Bell meets her very first human, a little girl who believes in fairies, and who very much needs a friend. Tink may be small, but she soon learns that her big heart can help someone many times her size. ~ Cammila Albertson, Rovi",G,"Animation, Kids & Family, Science Fiction & Fantasy",Bradley Raymond,Walt Disney Pictures,77 minutes,"Mae Whitman, Raven-Symoné, Michael Sheen"
226,29718,Island Of Lemurs: Madagascar,"Brief enough for the youngest viewers yet informative and visually spectacular enough for all ages, Island of Lemurs: Madagascar is educational entertainment for the whole family.",81%,36,65%,12949,"Academy Award (R) winner Morgan Freeman (""Million Dollar Baby,"" ""Dolphin Tale"") narrates the IMAX 3D (R) documentary ""Island of Lemurs: Madagascar,"" the incredible true story of natures greatest explorers-lemurs. The film reunites Freeman with Drew Fellman, who also wrote and produced the 2011 IMAX 3D documentary ""Born to Be Wild 3D,"" and director David Douglas, who served as director of photography on that film. Captured with IMAX (R) 3D cameras, ""Island of Lemurs: Madagascar"" takes audiences on a spectacular journey to the remote and wondrous world of Madagascar. Lemurs arrived in Madagascar as castaways millions of years ago and evolved into hundreds of diverse species but are now highly endangered. Join trailblazing scientist Dr. Patricia Wright on her lifelong mission to help these strange and adorable creatures survive in the modern world.(C) Warner Bros",G,"Animation, Documentary, Kids & Family","David Douglas, Drew Fellman",Warner Bros. Pictures,40 minutes,"Morgan Freeman, Patricia Wright, Dr. Hantanirina Rasamimanana"
227,29721,The Secret Lives Of Dorks,N/A,11%,9,40%,271,"THE SECRET LIVES OF DORKS, Payton (Gaelan Connell) is a pathetic dork, a comic book geek whose high school career is one hopeless faux pas after another. Yet hes a dreamer and madly in love with the head cheerleader Carrie (Riley Voelkel), who he is determined to win over. But she is wise to his desperate advances, so to get off his radar she creates a plan to push him into the arms of a dorkette at the school, Samantha (Vanessa Marano).(c) Official Site","PG-13 (for crude and sexual content throughout, and for language)",Comedy,Salomé Breziner,D&E Entertainment,91 minutes,"Gaelan Connell, Riley Voelkel, Vanessa Marano"
228,29725,When Comedy Went to School,N/A,55%,33,46%,429,"This remarkable documentary presents an entertaining portrait of this countrys greatest generation of comedians - the generation that includes the likes of Jerry Lewis, Sid Caesar, Robert Klein, Jackie Mason, Mort Sahl, Jerry Stiller, Larry King, and others, all of whom make appearances in the film, telling jokes and telling their stories. (c) International Film Circuit",NR,"Documentary, Special Interest","Mevlut Akkaya, Ron Frank",International Film Circuit,76 minutes,"Robert Klein, Sid Caesar, Jerry Lewis"
229,29726,Jimmy P.,"Jimmy P. has interesting ideas and talented stars, but director Arnaud Desplechin can't seem to figure out how to bring them together.",52%,33,39%,485,"In ""one of the most unexpected and inspiring movie pairings in recent memory (The Village Voice),"" Jimmy P stars Academy Award winner Benicio Del Toro and Mathieu Amalric in a true story about two very different men who build a unique and powerful bond through psychotherapy. A WWII vet plagued by excruciating headaches, dizzy spells, hearing loss and bizarre dreams, Jimmy Picard (Del Toro), a Native American Blackfoot, is labeled schizophrenic by a military hospital confused by his condition. Enter French anthropologist and Native American researcher Georges Devereux (Amalric), called in by the hospital to make sense of their baffling patient. Through increasingly vivid conversation, Picard and Devereux develop a compelling friendship as they embark on an exploration of Jimmys memories and dreams, an experiment they conduct like a couple of detectives in this intelligent and extraordinarily moving film from Arnaud Desplechin (A Christmas Tale, Kings and Queen). (c) IFC",NR,Drama,Arnaud Desplechin,IFC Films,117 minutes,"Benicio Del Toro, Mathieu Amalric, Gina McKee"
230,29734,The Dead Lands,"The Dead Lands doesn't add anything new to the primeval quest genre, but its battle scenes boast enough visceral thrills to carry viewers through the more mundane moments.",69%,51,56%,1218,"Hongi (James Rolleston) - a Maori chieftains teenage son - must avenge his fathers murder in order to bring peace and honor to the souls of his loved ones after his tribe is slaughtered through an act of treachery. Vastly outnumbered by a band of villains, led by Wirepa (Te Kohe Tuhaka), Hongis only hope is to pass through the feared and forbidden Dead Lands and forge an uneasy alliance with the mysterious ""Warrior"" (Lawrence Makoare), a ruthless fighter who has ruled the area for years. (C) Magnolia",R (for brutal bloody violence),Action & Adventure,Toa Fraser,Magnet Releasing,104 minutes,"George Henare, James Rolleston, Lawrence Makoare"
231,29736,Ricki And The Flash,Meryl Streep's outstanding work helps Ricki and the Flash overcome its inconsistent tone and fairly predictable premise.,65%,195,43%,16383,"Three-time Academy Award (R) winner Meryl Streep goes electric and takes on a whole new gig - a hard-rocking singer/guitarist - for Oscar (R)-winning director Jonathan Demme and Academy Award (R)-winning screenwriter Diablo Cody in the uplifting comedy Ricki and the Flash. In a film loaded with music and live performance, Streep stars as Ricki, a guitar heroine who gave up everything for her dream of rock-and-roll stardom, but is now returning home to make things right with her family. Streep stars opposite her real-life daughter Mamie Gummer, who plays her fictional daughter; Rick Springfield, who takes on the role of a Flash member in love with Ricki; and Kevin Kline, who portrays Rickis long-suffering ex-husband. (C) Tristar","PG-13 (for thematic material, brief drug content, sexuality and language)","Comedy, Drama",Jonathan Demme,Sony Pictures,101 minutes,"Meryl Streep, Mamie Gummer, Kevin Kline"
232,29739,The Trials of Henry Kissinger,This compelling unauthorized biography takes a muckraker's view of the controversial diplomat.,95%,58,77%,1189,"The Trials of Henry Kissinger is a documentary based on Christopher Hitchens controversial book about the Nobel Laureate and famous U.S. diplomat. Filmmakers Eugene Jarecki and Alex Gibney thoroughly examine Kissingers life and career, from his childhood escape from the Nazis to his canny achievement of celebrity status and formidable power over American foreign policy under Presidents Nixon and Ford. The film presents the case that Kissinger could be tried as a war criminal in International Criminal Court for his role in influencing illegal military actions by the U.S. government. Hitchens, other journalists, and several political figures, including Kissinger supporters like Alexander Haig, discuss Kissingers role in the following events -- the secret bombings of Cambodia during the Vietnam War, which killed thousands of civilians in the neutral country, and indirectly led to the rise of the Khmer Rouge; the 1970 military coup in Chile that brought vicious dictator Augusto Pinochet to power; and the 1975 massacre of East Timor by a U.S.-backed Indonesian military. The film describes how a new climate of international justice, exemplified by Pinochets arrest, could mean that Kissinger will eventually have to defend his actions in court.",NR,"Documentary, Special Interest","Eugene Jarecki, Alex Gibney",First Run,80 minutes,"Alexander Haig, Gen. Brent Scowcroft, Seymour Hersch"
233,29741,Pump,N/A,75%,20,82%,631,"PUMP is an inspiring, eye-opening documentary that tells the story of Americas addiction to oil, from its corporate conspiracy beginnings to its current monopoly today, and explains clearly and simply how we can end it - and finally win choice at the pump. Today oil is our only option of transportation fuel at the pump. Our exclusive use of it has drained our wallets, increased air pollution and sent our sons and daughters to war in faraway lands. PUMP shows us how through the use of a variety of replacement fuels, we will be able to fill up our cars - cheaper, cleaner and American made - and in the process, create more jobs for a stronger, healthier economy. The film features notable experts such as John Hofmeister, former President of Shell Oil US; Elon Musk, CEO of Tesla Motors; Peter Goldmark, former president of the Rockefeller Foundation; and other noteworthy figures who share their passionate views and knowledge. Right now we have the ability to change our countrys future, but we never knew it. Arent we tired of being taken for a ride? PUMP is the movie that could change that. (c) Submarine",PG (for mild thematic material),Documentary,"Josh Tickell, Rebecca Harrell Tickell",Submarine Entertainment,88 minutes,"Jason Bateman, Elon Musk, John Hofmeister"
234,29743,Cocaine Cowboys,"As frenetic, thrilling, and lacking in subtletly as its drug of focus...and just as likely to prompt some hard questions after it's gone.",69%,51,79%,77109,"When brutal Colombian cocaine lords moved to Miami in the early 80s, they brought with them a form of decadence, drugs and debauchery that hadnt been seen since the Prohibition days. This stylized, high-energy film reveals how Miami went from a sleepy southern city to a drug-and-murder capital, as told by the people who put the vice in ""Miami Vice.""","R (for pervasive drug content, gruesome, violent images and language)",Documentary,Billy Corben,Magnolia Pictures,118 minutes,"Jon Roberts, Mickey Munday, Jorge ""Rivi"" Ayala"
235,29754,Sushi: The Global Catch,N/A,70%,10,63%,247,"Sushi, a cuisine formerly found only in Japan, has grown exponentially in other nations, and an industry has been created to support it. In a rush to please a hungry public, the expensive delicacy has become common and affordable, appearing in restaurants, supermarkets and even fast food trailers. The traditions requiring 7 years of apprenticeship in Japan have given way to quick training and mass-manufactured solutions elsewhere. This hunger for sushi has led to the depletion of apex predators in the ocean, including bluefin tuna, to such a degree that it has the potential to upset the ecological balance of the worlds oceans, leading to a collapse of all fish species. -- (C) Official Site",NR,Documentary,Mark Hall,Kino-Lorber Films,75 minutes,"Mamoru Sugiyama, Mike Sutton, Alistair Douglas"
236,29757,The Fruit Hunters,N/A,100%,7,68%,209,"You can find them deep in the jungles of Borneo, in the hills of Umbria and perhaps even in your own backyard. They are fruit hunters, the subjects of the dizzying new film from acclaimed director Yung Chang (Up the Yangtze, China Heavyweight). THE FRUIT HUNTERS travels across culture, history and geography to show how intertwined we are with the fruits we eat. The ranks of the fruit-obsessed include adventurers, scientists, fruit detectives and even movie star Bill Pullman, fruit hunters dedicating themselves to searching for and saving rare and exotic fruit, and to creating a Garden of Eden in a world increasingly dominated by industrialized monoculture. A cinematic odyssey through nature and commerce, THE FRUIT HUNTERS will change not only the way we look at what we eat but how we view our relationship to the natural world. (c) Cinedigm",NR,"Documentary, Special Interest",Yung Chang,Cinedigm,92 minutes,"Bill Pullman, Juan Fernando Aguilar Morán, Richard Campbell"
237,29760,Radio Unnameable,N/A,100%,13,64%,279,"Legendary radio personality Bob Fass revolutionized late night FM radio by serving as a cultural hub for music, politics and audience participation for nearly 50 years. Long before todays innovations in social media, Fass utilized the airwaves for mobilization encouraging luminaries and ordinary listeners to talk openly and take the program in surprising directions. Radio Unnameable is a visual and aural collage that pulls from Bob Fasss immense archive of audio from his program, film, photographs, and video that has been sitting dormant until now. -- (C) Official Site",NR,"Documentary, Special Interest, Television","Jessica Wolfson, Paul Lovelace",Kino Lorber Films,87 minutes,"Bob Dylan, Wavy Gravy, Dave Van Ronk"
