,dataIndex,realTitle,criticsConcensus,tomatoMeter,tomatoCount,audienceScore,audienceCount,realSynopsis,rating,genreString,directedBy,studio,runTime,cast
115,28848,The Final Girls,The Final Girls offers an affectionate nod to slasher tropes while adding a surprising layer of genuine emotion to go with the meta amusement.,72%,68,70%,5670,"A young woman grieving the loss of her mother, a famous scream queen from the 1980s, finds herself pulled into the world of her moms most famous movie. Reunited, the women must fight off the films maniacal killer.","PG-13 (for horror violence, some crude and sexual material, language and drug use)","Comedy, Horror",Todd Strauss-Schulson,Stage 6 Films,88 minutes,"Nina Dobrev, Taissa Farmiga, Malin Akerman"
116,28857,New Year's Evil,N/A,14%,7,14%,510,"During a New Years Eve celebration, a Punk Rock & New Wave show host gets a phone call saying that when New Years strikes in each time zone, someone will be murdered--and she will be the last one.",R,"Horror, Mystery & Suspense",Emmett Alston,Cannon Film Distributors,90 minutes,"Roz Kelly, Kip Niven, Chris Wallace"
117,28861,Bolero,N/A,0%,17,17%,1499,"When a young wealthy woman graduates from a British boarding school, she is determined to lose her virginity. Soon, she embarks on a mini world tour to find just the right man for the task.",R,"Comedy, Drama",John Derek,Live Home Video,106 minutes,"Bo Derek, George Kennedy, Andrea Occhipinti"
118,28866,The Whisperer In Darkness,N/A,86%,7,65%,232,"A visionary screen adaptation of the classic weird tale by legendary horror writer HP Lovecraft. Following a series of floods in rural Vermont, the bodies of grotesque creatures are found floating in several rivers. The creatures match descriptions given in certain local myths and legends. University Folklorist Albert Wilmarth (Matt Foyer) is initially dismissive of the stories, until he starts to receive a series of increasingly disturbing letters from Vermont farmer, that hint at a horrifying truth. He travels to Vermont to investigate further, and uncovers a conspiracy that extends out into the furthest reaches of space and the darkest pits of hell.",NR,Science Fiction & Fantasy,Sean Branney,HPLHS Motion Pictures,103 minutes,"Barry Lynch, Conor Timmis, Matt Lagan"
119,28883,When the Whales Came,N/A,60%,5,86%,474,"In this English drama, set during World War I, a strange, deaf man, known to all as ""The Birdman"" (Paul Scofield), must enlist the help of young Daniel Pender (Max Rennie) and Gracie Jenkins (Helen Pearce) to prevent the narwhal whales from suffering abuse at the hands of the local islanders.",PG,Drama,Clive Rees,20th Century Fox,100 minutes,"Paul Scofield, Helen Mirren, Helen Pearce"
120,28884,Spring,"Rich in atmosphere and intelligence, Spring is a singular horror film with a sneaky, lingering impact.",85%,54,70%,6363,"""Spring"" follows young man in a personal tailspin as he flees California to the Italian coast, where he meets a woman carrying a dark secret. (C) FilmBuff",NR,"Horror, Science Fiction & Fantasy, Romance","Aaron Moorhead, Justin Benson",Drafthouse Films,109 minutes,"Lou Taylor Pucci, Nadia Hilker, Augie Duke"
121,28895,Cymbeline,N/A,31%,29,14%,1735,"This is a gritty story of a take-no-prisoners war between dirty cops and a drug-dealing biker gang. When extortion, betrayal, and fiery passions threaten his criminal empire, a drug kingpin is driven to desperate measures in this explosive film based on Shakespeares Cymbeline.",R (for some violence),Action & Adventure,Michael Almereyda,Lionsgate Pictures,98 minutes,"Ethan Hawke, Ed Harris, Milla Jovovich"
122,28908,Shiza,"A stark and moving coming-of-age tale and crime thriller, Schizo gives viewers a peek into the lives of Kazakhstan's poor.",78%,36,84%,563,"An author who specializes in conspiracy theories finds his sanity slipping following the death of his mother. ~ Jason Buchanan, Rovi",R,"Art House & International, Drama",Gulshat Omarova,Picture This!,86 minutes,"Olzhas Nusupbaev, Olga Landina, Eduard Tabishev"
123,28915,Child 44,"There's a gripping story at the heart of Child 44 and a solid performance from Tom Hardy in the lead, but it all still adds up to a would-be thriller that lacks sufficient thrills.",27%,82,41%,11971,"A politically-charged serial killer thriller set in 1953 Soviet Russia, CHILD 44 chronicles the crisis of conscience for secret police agent Leo Demidov [Tom Hardy], who loses status, power and home when he refuses to denounce his own wife, Raisa [Noomi Rapace], as a traitor. Exiled from Moscow to a grim provincial outpost, Leo and Raisa join forces with General Mikhail Nesterov [Gary Oldman] to track down a serial killer who preys on young boys. Their quest for justice threatens a system-wide cover-up enforced by Leos psychopathic rival Vasili [Joel Kinnaman], who insists ""There is no crime in Paradise."" (C) Lionsgate","R (for violence, some disturbing images, language and a scene of sexuality)","Drama, Mystery & Suspense",Daniel Espinosa,Summit Entertainment,137 minutes,"Tom Hardy, Noomi Rapace, Joel Kinnaman"
124,28929,A Little Chaos,"Stylish and well-acted without ever living up to its dramatic potential, A Little Chaos is shouldered by the impressive efforts of a talented cast.",48%,92,49%,4956,"A romantic drama following Sabine, a talented landscape designer, who is building a garden at Versailles for King Louis XIV. Sabine struggles with class barriers as she becomes romantically entangled with the courts renowned landscape artist. (C) Focus World",R (for some sexuality and brief nudity),"Art House & International, Drama",Alan Rickman,Focus Features,116 minutes,"Kate Winslet, Matthias Schoenaerts, Alan Rickman"
125,28940,Get Hard,"A waste of two fine funnymen, Get Hard settles for tired and offensive gags instead of tapping into its premise's boundary-pushing potential.",28%,182,45%,53273,"Will Ferrell and Kevin Hart headline this Warner Bros. comedy about a wrongfully convicted investment banker who prepares for prison life with the help of the man who washes his car. Etan Cohen directs, with Ian Roberts and Jay Martel handling screenwriting duties. ~ Jason Buchanan, Rovi","R (for pervasive crude and sexual content and language, some graphic nudity, and drug material)",Comedy,Etan Cohen,Warner Bros. Pictures,100 minutes,"Will Ferrell, Kevin Hart, T.I."
126,28943,The Intruders,N/A,17%,6,21%,340,"Every town has its secrets, as college student Rose Halshford (Miranda Cosgrove) learns when she and her dad (Donal Logue) move into a musty, old house. When Rose discovers that the previous tenant mysteriously disappeared, leaving her possessions behind, she suspects her unfriendly neighbors know more than they let on. When Rose repor ts strange noises coming from inside the house, no one, not even her father believes her, insisting that its all in her head. As Roses suspicions grow she begins to fear that she may be the next victim of whatever or whomever has infiltrated her new home.","PG-13 (for some violence, scary images, thematic elements and language)","Action & Adventure, Mystery & Suspense",Adam Massey,Sony Pictures,92 minutes,"Donal Logue, Miranda Cosgrove, Tom Sizemore"
127,28944,Filmistaan,N/A,100%,7,74%,119,"An affable Bollywood buff and wanna-be-actor Sunny, goes with an American crew to remote areas in Rajasthan to work on a documentary film. One day after pack-up an Islamic terrorist group kidnaps him. When the group leader find that the inept terrorist had mistaken their prisoner for the American crew-member he decide to keep him hostage until they locate their original target. (c) Official Facebook",NR,Drama,"Nitin Kakkar, Nittin Khakkar",UTV Communications,117 minutes,"Sharib Hashmi, Innamulhaq, Gopal Datt"
128,28945,That Sugar Film,"That Sugar Film is slick and entertaining, even if it settles for a surface look at a subject that could benefit from a far deeper exploration.",68%,38,74%,1571,"THAT SUGAR FILM is one mans journey to discover the bitter truth about sugar. Damon Gameau embarks on a unique experiment to document the effects of a high sugar diet on a healthy body, consuming only foods that are commonly perceived as healthy. Through this entertaining and informative journey, Damon highlights some of the issues that plague the sugar industry, and where sugar lurks on supermarket shelves. THAT SUGAR FILM will forever change the way you think about healthy food. (C) Samuel Goldwyn Films",NR,Documentary,Damon Gameau,Samuel Goldwyn Films,97 minutes,"Damon Gameau, Stephen Fry, Isabel Lucas"
129,28957,Growing Up and Other Lies,N/A,8%,13,26%,146,"After struggling for years as an artist in New York City, Jake is calling it quits and returning home to Ohio. On his last day in the city, he persuades his three oldest friends to help him retrace their greatest adventure together: a walk down the entire length of Manhattan. But their attempt to reclaim the glory of their early 20s doesnt go quite as planned. Over the course of the day, buried conflicts emerge as Jake becomes embroiled with his ex-girlfriend and his friends dip into their own crises of manhood. GROWING UP AND OTHER LIES is an anti-coming-of-age comedy.(C) eOne",NR,Comedy,"Danny Jacobs, Darren Grodsky",Entertainment One Films,90 minutes,"Adam Brody, Amber Tamblyn, Danny Jacobs"
130,28965,Cinderella III: A Twist in Time,N/A,75%,8,61%,42028,"Experience a compelling twist on the familiar fairy tale in an animated Disney sequel that explores just what may have happened had the mythical glass slipper not fit. Cinderellas wicked stepmother has stolen the Fairy Godmothers magic wand, and now shes determined to turn back the hands of time. Now, in order to break the evil spell, the frightened Cinderella will have to find her beloved Prince Charming before her time runs out. Gus, Jaq, and all of the characters who made the original Cinderella a beloved classic return in an enchanting animated sequel filled with show-stopping musical numbers, nail-biting suspense, and magical wonders for the entire family.",G,"Animation, Kids & Family",Frank Nissen,Walt Disney Productions,74 minutes,"Jennifer Hale, C.D. Barnes, Christopher Daniel Barnes"
131,28972,Rudolph the Red-Nosed Reindeer: The Movie,N/A,40%,5,58%,20032,"A recreation of the Christmas classic. Rudolph had a very shining nose, but the other reindeer laughed and called him names. Then on that famous foggy Christmas eve- Rudolphs legacy was forever made.",G,"Animation, Kids & Family",William R. Kowalchuk,Legacy Releasing,83 minutes,"Sarah Jessica Parker, Eric Idle, Bob Newhart"
132,28974,Saving Santa,N/A,17%,6,40%,410,"At the North Pole, a well-meaning but error-prone elf learns that Santa has a secret time machine built into his sleigh. Later, he must protect the machine from army commandos who want to use it for evil purposes.",NR,"Animation, Kids & Family","Leon Joosen, Aaron Seelman, Arish Fyzee",STARZ MEDIA LLC.,83 minutes,"Pam Ferris, Noel Clarke, Rebecca Ferdinando"
133,29030,Brother Bear 2,N/A,50%,8,56%,24357,"An old friendship is renewed and new bonds are forged as Kenai and Nita set out on the adventure of a lifetime in this animated, direct-to-video sequel to the 2003 Disney hit Brother Bear. When Kenai emerges from his first hibernation with a hearty appetite and a craving for the best spring berries around, he takes his younger brother Koda to Crowberry Ridge for a delicious feast. As Rutt and Tuke scour the landside looking for some female companionship, Kenai is surprised to find his childhood friend Nita venturing into the wilderness with a pressing problem that only Kenai can solve. It appears as if the amulet given to Nita by Kenai has much greater power than either of them had previously thought, and in order to marry, the old friends must travel back to Hokani Falls to burn the amulet together. Now, as the pair travel over icy mountain ranges and down raging rivers, the plan set into motion by the Great Spirits for Nita and Kenai slowly begins to come into focus.",G,"Animation, Kids & Family","Ben Gluck, Benjamin Gluck",Walt Disney Home Entertainment,73 minutes,"Patrick Dempsey, Mandy Moore, Jeremy Suarez"
134,29037,Innocence,"Predictable and listlessly paced, Innocence is guilty of wasting its audience's time and money.",19%,26,34%,1536,"Haunted by the death and dreams of her beloved mother in a Montauk surfing accident, 16 year old Beckett and her father, novelist Miles Warner, move to Manhattan and attempt to piece together their shattered life. Now enrolled at the exclusive Hamilton preparatory school, her psychosis and hallucinations intensify with the dubious suicides of current and past students as does her first love for Tobey Crawford. The discovery that her new school may be run by a coven of beautiful and seductive women who perpetuate their youth by drinking the blood of virgins becomes the ultimate challenge of Beckett and Tobeys young lives. INNOCENCE is a chilling allegory of the precarious state of an American teenager, explores themes of loss, the human condition and a society torn between purity and narcissism. (c) Abramoorama",PG-13,Action & Adventure,Hilary Brougher,Abramorama Entertainment,96 minutes,"Kelly Reilly, Sophie Curtis, Graham Phillips"
135,29061,Six Days in Roswell,N/A,83%,6,70%,38,"The makers of Trekkies (1997) bring you this exploration through another bizarre American subculture. The film focuses on Richard Kronfeld, a self-proclaimed UFO-ologist who has never had a girlfriend and still lives with his (very concerned) mother. He guides the film through a series of weird tableaus in the southwestern town of Roswell. Six Days in Roswell was screened at the 1999 AFI/L.A. Film Festival.",NR,"Comedy, Documentary, Special Interest",Timothy B. Johnson,Midnight Pulp,80 minutes,"Rich Kronfeld, Budd Hopkins, Whitley Streiber"
136,29077,Kill Me Three Times,"Kill Me Three Times offers Simon Pegg an opportunity to play against type as a villain; unfortunately, its derivative storyline fails to offer much of anything to viewers.",16%,55,30%,3136,"A mercurial assassin (Simon Pegg) discovers he isnt the only person trying to kill the siren (Alice Braga) of a sun-drenched surfing town. In this darkly comedic thriller, the hitman finds himself unraveling three tales of mayhem, murder, blackmail and revenge. (C) Magnet","R (for bloody violence, language and some sexuality/nudity)",Mystery & Suspense,Kriv Stenders,Magnolia Pictures,91 minutes,"Sullivan Stapleton, Simon Pegg, Teresa Palmer"
137,29081,Walter,N/A,54%,13,49%,283,"Walter, a mild mannered ticket-taker at a movie theater believes himself to be the son of God with the responsibility to judge whether people will spend eternity in heaven or hell. When a ghost stuck in purgatory interrupts Walters daily routine his world is turned upside down forcing him to reassess the meaning of his life.",NR,"Comedy, Drama",Anna Mastro,Entertainment One Films,94 minutes,"Andrew J. West, Neve Campbell, Justin Kirk"
138,29082,The Atticus Institute,N/A,50%,6,26%,848,"Dr. Henry West founded The Atticus Institute in the early 1970s to test individuals expressing supernatural abilities - E.S.P., clairvoyance, psychokinesis, etc. Despite witnessing several noteworthy cases, nothing could have prepared Dr. West and his colleagues for Judith Winstead. She outperformed every subject they had ever studied - soon gaining the attention of the U.S. Department of Defense, who subsequently took control of the research facility. The more experiments they conducted on Judith, the clearer it became that her abilities were the manifestation of evil forces within her, prompting the government to take measures to weaponize this force. But they soon discovered there are powers that exist in this world that simply cannot be controlled. Now the details of the inexplicable events that occurred within The Atticus Institute are being made public after remaining classified for nearly forty years.",NR,"Drama, Horror, Mystery & Suspense",Chris Sparling,Anchor Bay Entertainment,83 minutes,"William Mapother, Rya Kihlstedt, Harry Groener"
139,29088,The Houses October Built,N/A,60%,15,29%,933,"Beneath the fake blood and cheap masks of countless haunted house attractions across the country, there are whispers of truly terrifying alternatives. Looking to find an authentic, blood-curdling good fright for Halloween, five friends set off on a road trip in an RV to track down these underground Haunts. Just when their search seems to reach a dead end, strange and disturbing things start happening and it becomes clear that the Haunt has come to them... (C) RLJ/Image Entertainment",NR,"Drama, Horror",Bobby Roe,RLJ/Image Entertainment,91 minutes,"Bobby Roe, Brandy Schaefer, Mikey Roe"
140,29090,Preservation,N/A,58%,12,23%,704,"PRESERVATION follows brothers Sean (Pablo Schreiber), a recently returned veteran, and Mike (Aaron Staton), a hedge fund manager, who head out of town to hunt in a closed nature preserve with Mikes wife, Wit (Wrenn Schmidt) - a brainy anesthesiologist - in tow. With Sean unhinged from his stint in the military, and Mike distracted by career ambition, this was not the romantic getaway Wit was hoping for. But soon the trio is threatened by an unseen menace, and the hunters become the hunted. A camping trip in the woods turns into a contest for survival. When the brothers are stalked and ensnared, Wit must unleash her own animal instincts or else end up a trophy. (C) The Orchard",NR,"Horror, Mystery & Suspense",Christopher Denham,The Orchard,90 minutes,"Pablo Schreiber, Aaron Staton, Wrenn Schmidt"
141,29093,Poker Night,N/A,50%,10,42%,271,"In this twisted thriller, a young detective is caught in a sadistic game of cat-and-mouse when he is kidnapped and tormented by a masked serial killer. In order to survive, the rookie must use the wisdom imparted to him by senior detectives on their regular poker night.",NR,"Action & Adventure, Art House & International, Mystery & Suspense",Greg Francis,Xlrator Media,104 minutes,"Ron Perlman, Giancarlo Esposito, Beau Mirchoff"
142,29125,The Humbling,"The Humbling is an inarguable highlight of Al Pacino's late-period filmography, but that's an admittedly low bar that it doesn't always clear by a very wide margin.",52%,61,28%,1200,"Over-the-hill stage actor Simon Axler struggles to find his passion for life again. Near his breaking point, he finds motivation in the form of a young and lustful lesbian Pegeen Stapleford, but as their relationship heats up Simon has a hard time keeping up with the youthful Pegeen.","R (for sexual material, language and brief violence)",Drama,Barry Levinson,Millennium Entertainment,102 minutes,"Al Pacino, Greta Gerwig, Dianne Wiest"
143,29148,My American Cousin,N/A,60%,5,63%,125,"A 12-year-old Canadian girl comes of age thanks to American rock music in this comedy-drama from director Sandy Wilson. The somewhat repressed Sandy Wilcox (Margaret Langrick) is visited by her cousin Butch (John Wildman), a handsome young man from the U.S.A. who passes his favorite musical tracks along to his impressionable younger relative. As the two begin to form a bond, Butchs true mischevious nature is revealed.",PG (adult situations/language),"Comedy, Drama, Kids & Family",Sandy Wilson,Media Home Entertainment,94 minutes,"Margaret Langrick, John Wildman, Richard Donat"
144,29157,Shaun the Sheep Movie,"Warm, funny, and brilliantly animated, Shaun the Sheep is yet another stop-motion jewel in Aardman's family-friendly crown.",99%,166,80%,22612,"When Shaun decides to take the day off and have some fun, he gets a little more action than he bargained for. A mix up with the Farmer, a caravan, and a very steep hill lead them all to the Big City and its up to Shaun and the flock to return everyone safely to the green grass of home. (C) Lionsgate",PG (for rude humor),"Animation, Comedy","Mark Burton, Richard Starzak",Lionsgate,84 minutes,"Justin Fletcher, John Sparkes, Omid Djalili"
145,29158,Infinitely Polar Bear,"Infinitely Polar Bear handles its thorny themes with a somewhat troublesomely light touch, but Mark Ruffalo's complex performance keeps the drama solidly grounded.",81%,117,71%,11296,"Maya Forbes autobiographically inflected Infinitely Polar Bear stars Mark Ruffalo as Cameron, a man who suffers from bipolar disorder. After a breakdown forces him to leave his family and move into a halfway house, he attempts to rebuild a relationship with his two daughters, and win back the trust of his wife Maggie (Zoe Saldana). When Maggie decides to go to business school in New York, they decide that he will move back in and take care of the day-to-day care for the kids. Due to his mercurial nature, this leads to a series of quirky, funny, and sometimes frightening episodes. Infinitely Polar Bear screened at the 2014 Toronto International Film Festival. ~ Perry Seibert, Rovi",R (for language),"Comedy, Drama",Maya Forbes,Sony Pictures Classics,90 minutes,"Mark Ruffalo, Zoe Saldana, Keir Dullea"
146,29178,Last Knights,"As blandly unimaginative as its title, Last Knights revisits well-worn sword-and-sandal tropes without adding anything new -- or interesting -- to the genre.",13%,30,46%,3447,"Academy Award (R) Nominee Clive Owen (Best Performance by an Actor in a Supporting Role, Closer, 2004) delivers an electrifying performance as a fallen warrior who rises against a corrupt and sadistic ruler to avenge his dishonored master, Academy Award (R) Winner Morgan Freeman (Best Performance by an Actor in a Supporting Role, Million Dollar Baby, 2004) in this epic, sword-clashing adventure of loyalty, honor, and vengeance. (C) Lionsgate",R (for some violence),Action & Adventure,Kazuaki Kiriya,Lionsgate Films,115 minutes,"Clive Owen, Brian Caspe, Morgan Freeman"
147,29184,Matt Shepard is a Friend of Mine,N/A,100%,29,86%,606,"On October 7, 1998, University of Wyoming student Matthew Shepard was brutally beaten, tied to a fence and left to die because he was gay. Years later, Michele Josue, a close friend of Matts, revisits the shocking case with never-before-seen photos, rare video footage, as Matts all-too-brief life is remembered through the vivid testimonies of those whose lives he touched, from the friends and family who knew him best to the bartender who saw him on the night of the attack. New revelations emerge in one of the most notorious hate crimes in US history, leading to a searing, poignant, and multi-layered biographical and sociological portrait. In the end, the notion of forgiveness--embodied in the moving and courageous final act of Matts parents--takes on truly heroic proportions. (C) Run Rabbit Run Media",NR,"Documentary, Special Interest",Michele Josue,Run Rabbit Run Media,89 minutes,"Matthew Shepard, Judy Shepard, Michele Josue"
148,29188,Batman Vs. Robin,N/A,100%,5,78%,1762,"Batman and the new Robin, his son Damian Wayne, clash over different codes of morality while protecting Gotham from villains.",PG-13,"Action & Adventure, Animation",Jay Oliva,WARNER BROTHERS PICTURES,72 minutes,"Stuart Allen, Jason O'Mara, Stuart Allan (II)"
149,29208,Woman in Gold,"Woman in Gold benefits from its talented leads, but strong work from Helen Mirren and Ryan Reynolds isn't enough to overpower a disappointingly dull treatment of a fascinating true story.",57%,152,79%,17989,"WOMAN IN GOLD is the remarkable true story of one womans journey to reclaim her heritage and seek justice for what happened to her family. Sixty years after she fled Vienna during World War II, an elderly Jewish woman, Maria Altmann (Mirren), starts her journey to retrieve family possessions seized by the Nazis, among them Klimts famous painting Portrait of Adele Bloch-Bauer I. Together with her inexperienced but plucky young lawyer Randy Schoenberg (Reynolds), she embarks upon a major battle which takes them all the way to the heart of the Austrian establishment and the U.S. Supreme Court, and forces her to confront difficult truths about the past along the way. (C) TWC",PG-13 (for some thematic elements and brief strong language),Drama,Simon Curtis,The Weinstein Company,110 minutes,"Helen Mirren, Ryan Reynolds, Katie Holmes"
150,29226,Cut Bank,"Cut Bank contains typically outstanding work from its solid veteran cast, but it's lost in a dull morass of predictably derivative crime thriller clichés.",35%,37,29%,2170,"Dwayne McLaren (Liam Hemsworth) dreams about escaping small town life in Cut Bank, Montana, ""the coldest spot in the nation,"" with his vivacious girlfriend Cassandra (Teresa Palmer). When Dwayne witnesses an awful crime, he tries to leverage a bad situation into a scheme to get rich quickly but he finds that fate and an unruly accomplice are working against him. Thrust into the middle of a police investigation spearheaded by the local sheriff (John Malkovich), everything goes from bad to worse in this all-American thriller. Directed by Matt Shakman and also starring Billy Bob Thornton, Bruce Dern, Michael Stuhlbarg, and Oliver Platt. (C) Official Site",R (for violence and language),Mystery & Suspense,Matt Shakman,A24 and DIRECTV,93 minutes,"Liam Hemsworth, Billy Bob Thornton, Bruce Dern"
151,29230,Killing Jesus,N/A,43%,7,30%,140,"A fictionalized retelling of the life and death of Jesus Christ, based on the book Killing Jesus by Bill OReilly and Martin Dugard.",NR,Documentary,Christopher Menaul,National Geographic,120 minutes,"Haaz Sleiman, Stephen Moyer, Kelsey Grammer"
152,29239,Slaughter High,N/A,0%,5,34%,2553,"When the school geek (Simon Scuddamore) is physically scarred by his classmates ill-conceived practical joke, he vows to get revenge. When the guilty students travel back to Doddsville High for a ten-year reunion, they begin to die off in mysterious and violent ways.",R,Horror,"George Dugdale, Mark Ezra, Peter Litten",Vestron Pictures Ltd.,90 minutes,"Simon Scuddamore, Caroline Munro, Carmine Iannoccone"
